Crazy Sexy Kitchen: 150 Plant-Empowered Recipes to Ignite a Mouthwatering Revolution,14311
"Eating Clean: Budget-Friendly Breakfast, Lunch & Dinner Recipes for Clean Eating Diet and Healthy Weight Loss. Clean-Eating Cookbook for Beginners and Busy Families (eat clean diet recipes)",65309
"The Gut-Friendly Cookbook: Delicious Low-FODMAP, Gluten-Free, Allergy-Friendly Recipes for a Happy Tummy",154505
New Weight Watchers Freestyle Cookbook: Wholesome & Easy New WW Freestyle Recipes 500 | Delicious Meals With WW SmartPoints System,100054
The Daniel Plan Cookbook: Healthy Eating for Life,127221
"Keto Bread: Simple and Rapid Step by Step Low-Carb and Gluten-Free Cookbook for Ketogenic Diet (Includes Pizza, Cookies, Crusts, Muffins Bakers Recipes and more)",108763
New Weight Watchers Freestyle Cookbook: Healthy & Tasty WW Freestyle Rapid Weight Loss Program 2020,21947
Wheat Belly 10-Day Grain Detox: Reprogram Your Body for Rapid Weight Loss and Amazing Health,111934
"Dairy-Free Gluten-Free Baking Cookbook: 75+ Delicious Cookies, Cakes, Pies, Breads & More",115306
"Air Fryer Cookbook for Beginners: Easy, Healthy & Low-Carb Recipes That Will Help Keep You Sane",40347
Ketogenic Diet :The Step by Step Guide For Beginners: Ketogenic Diet For Beginners : Ketogenic Diet For Weight Loss : Keto Diet : The Step by Step Guide For Beginners,140277
"Keto Instant Pot Cookbook: The Complete Ketogenic Diet Instant Pot Cookbook – Healthy, Quick & Easy Keto Instant Pot Recipes for Everyone",156311
The Grain Brain Cookbook: More Than 150 Life-Changing Gluten-Free Recipes to Transform Your Health,53805
"The Gluten-Free Asian Kitchen: Recipes for Noodles, Dumplings, Sauces, and More [A Cookbook]",150244
The Easy Gluten-Free Cookbook: Fast and Fuss-Free Recipes for Busy People on a Gluten-Free Diet,32181
"YumUniverse: Infinite Possibilities for a Gluten-Free, Plant-Powerful, Whole-Food Lifestyle",23807
"Danielle Walker's Against All Grain: Meals Made Simple: Gluten-Free, Dairy-Free, and Paleo Recipes to Make Anytime",105414
Alkaline Smoothies: Alkaline Smoothie Recipes for Weight Loss and the Benefits of an Alkaline Diet - Alkaline Drinks Your Way to Vibrant Health - Massive Energy and Natural Weight Loss,138586
"Paleo Baking at Home: The Ultimate Resource for Delicious Grain-Free Cookies, Cakes, Bars, Breads and More",133140
"The Simply Real Health Cookbook: Easy Real Food Recipes for a Healthy Life, Made Simple",78116
"Bakerita: 100+ No-Fuss Gluten-Free, Dairy-Free, and Refined Sugar-Free Recipes for the Modern Baker",114042
"Instant Loss: Eat Real, Lose Weight: How I Lost 125 Pounds—Includes 100+ Recipes",860
"Danielle Walker's Eat What You Love: Everyday Comfort Food You Crave; Gluten-Free, Dairy-Free, and Paleo Recipes [A Cookbook]",58416
The Sourdough School: The ground-breaking guide to making gut-friendly bread,116030
Perfect Health Diet: Regain Health and Lose Weight by Eating the Way You Were Meant to Eat,152157
Gout Smoothie Recipes : Contains Cherry in Each Recipe for Gout Relief,153694
"Eating Clean: The 21-Day Plan to Detox, Fight Inflammation, and Reset Your Body",136184
"The Dance of Fear: Rising Above Anxiety, Fear, and Shame to Be Your Best and Bravest Self",115880
"Wheat Belly (Revised and Expanded Edition): Lose the Wheat, Lose the Weight, and Find Your Path Back to Health",127833
Mediterranean Diet for Beginners 2019-2020: The Complete Guide - 21-Day Diet Meal Plan - Lose Up to 20 Pounds in 3 Weeks,42142
The Homemade Flour Cookbook,30060
"Danielle Walker's Against All Grain Celebrations: A Year of Gluten-Free, Dairy-Free, and Paleo Recipes for Every Occasion [A Cookbook]",60669
"Eat Happy: Gluten Free, Grain Free, Low Carb Recipes For A Joyful Life",65466
"Keto Bread: Easy and Delicious Low Carb and Gluten-Free Bakery Recipes for Every Meal to Lose Weight, Burn Fat and Transform Your Body",137011
Everyday Grain-Free Baking: Over 100 Recipes for Deliciously Easy Grain-Free and Gluten-Free Baking,99221
"Rescue Recipes: 101 Flexible Recipes for Multiple Diets at the Same Table! (Omnivore, Paleo, Gluten-Free, Vegetarian, Vegan)! (Paleo Cookbooks Book 1)",81184
"Gluten-Free Artisan Bread in Five Minutes a Day: The Baking Revolution Continues with 90 New, Delicious and Easy Recipes Made with Gluten-Free Flours",117305
Hashimoto's Food Pharmacology: Nutrition Protocols and Healing Recipes to Take Charge of Your Thyroid Health,128573
The Gluten Free Cookbook for Families: Healthy Recipes in 30 Minutes or Less,129476
DR. SEBI ALKALINE RECIPE: A Complete Guide On Dr. Sebi’s Alkaline Electric Recipes Using The Sebian Food List And Ingredients,115814
"Paleo Power Bowls: 100 Easy, Nutrient-Dense, Anti-Inflammatory Meals",124953
The Wahls Protocol: A Radical New Way to Treat All Chronic Autoimmune Conditions Using Paleo Principles,41290
Einkorn: Recipes for Nature's Original Wheat: A Cookbook,66003
"A Year of Easy Keto Desserts: 52 Seasonal Fat Burning, Low-Carb & Paleo Desserts & Fat Bombs with less than 5 gram of carbs",142328
The Keto Cupcake Cookbook  | 100+ EASY KETO CUPCAKE & FROSTING RECIPES: So You Can Stick To Your Low Carb Diet And Lose Weight For Good,17228
"The Grain Brain Whole Life Plan: Boost Brain Performance, Lose Weight, and Achieve Optimal Health",232564
Celiac Disease Cookbook for the Newly Diagnosed: Guidance and Recipes for an Easy Transition to the Gluten-Free Diet,156319
"True Roots: A Mindful Kitchen with More Than 100 Recipes Free of Gluten, Dairy, and Refined Sugar: A Cookbook",178607
Keto Diet Cookbook for Beginners – Easy 1001 Ketogenic Recipes: The Big Ketosis Cookbook for Keto cook,189642
Keto Pasta Cookbook: Homemade Low Carb Pasta & Noodles,161970
"The Grain Brain Whole Life Plan: Boost Brain Performance, Lose Weight, and Achieve Optimal Health",171463
Latin American Paleo Cooking: Over 80 Traditional Recipes Made Grain and Gluten Free,162528
"Instant Pot Pressure Cooker Cookbook: 575 Best Instant Pot Recipes of All Time (with Nutrition Facts, Easy and Healthy Recipes)",217037
Nourishing Superfood Bowls: 75 Healthy and Delicious Gluten-Free Meals to Fuel Your Day,165575
"The Everything Gluten-Free Baking Cookbook: Includes Oatmeal Raisin Scones, Crusty French Bread, Favorite Lemon Squares, Orange Ginger Carrot Cake, Coconut ... Cream Pie and hundreds more! (Everything®)",199392
"Wheat Belly Cookbook: 150 Recipes to Help You Lose the Wheat, Lose the Weight, and Find Your Path Back to Health",231830
"Gluten-Free Baking At Home: 102 Foolproof Recipes for Delicious Breads, Cakes, Cookies, and More",209967
The Autoimmune Wellness Handbook: A DIY Guide to Living Well with Chronic Illness,212807
"Pan Sin Gluten. Segunda Edición: Principios, técnicas y trucos para hacer pan, pizza, bizcochos, cupcakes y otras recetas sin gluten. (Spanish Edition)",224632
The Gluten-Free Bread Machine Cookbook:175 Recipes for Splendid Breads and Delicious Dishes to Make with Them,176584
"The How Can It Be Gluten Free Cookbook Volume 2: New Whole-Grain Flour Blend, 75+ Dairy-Free Recipes",204091
"What When Wine: Lose Weight and Feel Great with Paleo-Style Meals, Intermittent Fasting, and Wine",209044
"The Joy of Gluten-Free, Sugar-Free Baking: 80 Low-Carb Recipes that Offer Solutions for Celiac Disease, Diabetes, and Weight Loss",167903
The Everything Guide To The Low-FODMAP Diet: A Healthy Plan for Managing IBS and Other Digestive Disorders (Everything®),188704
"Eat Happy Too: 160+ New Gluten Free, Grain Free, Low Carb Recipes for a Joyful Life",197590
The Gluten Free Mediterranean Diet Cookbook Collection: 150 Delicious and Healthy Recipes,189819
Perfect Gluten-Free Pies,235909
Solving the Gluten Puzzle: Discovering Gluten Sensitivity and Embracing the Gluten-Free Lifestyle (Restore Your Health Book 1),228143
"THE DIVERTICULITIS GUIDE TO LIVE PAIN FREE: Diverticulitis Diet Plan, Foods to Eat & Avoid, Diagnosis and Tips for Causes, Recovery and Prevention",193646
"Gluten-Free on a Shoestring Bakes Bread: (Biscuits, Bagels, Buns, and More)",166492
The G Plan Diet: The revolutionary diet for gut-healthy weight loss,158975
the California Country Gal's SWEET SECRETS: Real Food CUPCAKES!,205417
The Complete IC Diet Cookbook,211990
100 Best Gluten-Free Recipes: Delicious and Nutritious Recipes for a Varied and Enjoyable Diet (Love Food),196512
"The Autoimmune Plant Based Cookbook: Recipes to Decrease Pain, Optimize Health, and Maximize Your Quality of Life",161408
Lectin Free Cookbook Instant Pot: Lose Weight with Perfect Lectin-Free Recipes for Your Electric Pressure Cooker. Two Weeks Meal Planning for Fast Weight Loss,158415
"The Migraine Relief Plan: An 8-Week Transition to Better Eating, Fewer Headaches, and Optimal Health",216642
PITMASTER: THE KETO GRILL BIBLE,159553
Buck Naked Kitchen: Whole30 Endorsed: Radiant and Nourishing Recipes to Fuel Your Health Journey,215051
The 30-Minute Gluten-Free Cookbook: 100+ Quick and Simple Recipes For Every Day,228361
Affordable Paleo Cooking with Your Instant Pot: Quick + Clean Meals on a Budget,191773
BabyCakes Covers the Classics: Gluten-Free Vegan Recipes from Donuts to Snickerdoodles: A Baking Book,187501
Beat The Bloat: Low FODMAP Recipes: Over 40 delicious gut friendly recipes to ease digestive symptoms,223782
The Healthy Coconut Flour Cookbook,192314
The Paleo Approach Cookbook: A Detailed Guide to Heal Your Body and Nourish Your Soul,174495
Gluten Free Bread Machine Cookbook,171387
Gluten-Free Brews: The Guide to Gluten-Free Beer,207157
"Gluten Free Dairy Free Cookbook: 100 Satisfying, Family-Friendly Recipes",157479
Gluten-Free All-in-One For Dummies,198795
Get Real Gluten Free Baking: Simple and delicious everyday recipes,199741
Superfoods Cookbook: Over 95 Quick & Easy Gluten Free Low Cholesterol Whole Foods Recipes full of Antioxidants & Phytochemicals (Natural Weight Loss Transformation Book 29),174053
"Paleo Sauces, Salad Dressings, Dips, Marinades and more for your paleo recipes.",233499
"Gluten-Free Baking: Perfect Gluten Free Bread, Cookies, Cakes, Muffins and other Gluten Intolerance Recipes for Healthy Eating. Essential Cookbook for Beginners to Avoid Celiac Disease",172061
Discovering Sourdough Part III-B Advanced Sourdough,174028
"The Ultimate Grain-Free Cookbook: Sugar-Free, Starch-Free, Whole Food Recipes from My California Country Kitchen",178721
Beat The Bloat: Low FODMAP Recipes: Over 40 delicious gut friendly recipes to ease digestive symptoms,223782
Autoimmune Protocol Diet: a Step by Step Scientifically Proven Solution for Managing Hashimoto's Disease with a 14-Day Meal Plan and a CookBook Full of Easy Paleo AIP Compliant Recipes,87854
"Paleo Power Bowls: 100 Easy, Nutrient-Dense, Anti-Inflammatory Meals",124953
"Antianxiety Diet: MAIN COURSE - 60+ Breakfast, Lunch, Dinner and Dessert Recipes for Antianxiety Diet",217722
Vegan Ice Cream: Over 90 Sinfully Delicious Dairy-Free Delights [A Cookbook],170434
GAPS Introduction Diet Cookbook: 100 Delicious & Nourishing Recipes for Stages 1 to 6,66694
"Eating Clean: The 21-Day Plan to Detox, Fight Inflammation, and Reset Your Body",136184
"The Skinny Vegan Cookbook: Easy Weight Loss With A Plant Based Diet | Recipes Include Oil-Free Mayo, Pizza, Burgers, Chocolate Fudge Brownies etc",205408
Dairy Free Baking Cookbook: Easy And Delicious Dairy Free Baking And Dessert Recipes (Lactose Intolerance Diet Book 1),167221
"Carnivore Diet Box Set: The Carnivore Diet Handbook, Carnivore Diet Intermittent Fasting, and the Frugal Carnivore Diet",106705
"Foodi Multi-Cooker Cookbook for Beginners: Simple, Easy and Delicious Foodi Multi-Cooker Recipes",216666
Einkorn: Recipes for Nature's Original Wheat: A Cookbook,66003
The Complete Low-FODMAP Diet: A Revolutionary Plan for Managing IBS and Other Digestive Disorders,67556
"Clean Slate: A Cookbook and Guide: Reset Your Health, Detox Your Body, and Feel Your Best",149004
The Bloated Belly Whisperer: See Results Within a Week and Tame Digestive Distress Once and for All,127057
"The AntiHistamine Diet: Lower Histamine, Increase DAO, and Reverse Histamine Intolerance in Six Weeks",89575
"The Psoriasis Diet Cookbook: Easy, Healthy Recipes to Soothe Your Symptoms",155074
"The Carnivore Diet Handbook: Get Lean, Strong, and Feel Your Best Ever on a 100% Animal-Based Diet (with meal plans, keto recipes, and smart tips to start)",86483
"365 Days of Vegan Recipes: A Vegan Cookbook with Over 365 Recipes Book for Beginners Easy, Fun and Filling Plant-Based Recipes for Weight Loss and Healthy Lifestyle",164322
"Eating Clean: Budget-Friendly Breakfast, Lunch & Dinner Recipes for Clean Eating Diet and Healthy Weight Loss. Clean-Eating Cookbook for Beginners and Busy Families (eat clean diet recipes)",65309
"Vegan Cheese: Become a 5-Star Cheese Maker.. Yes Vegan Cheese. New to Plant Based Cheeses, Delicious Non Dairy Cheese That Melts, with Hard, Soft, Cultured and Nut Free Cheeses. Bonus Cheese Journal",65005
"ACID REFLUX DIET: The Complete Solution to Understand, Heal and Prevent GERD & LPR with a 30-Day Meal Plan and a Cookbook Full of Low Acid Recipes Including Vegan & Gluten-Free",154858
"Air Fryer Cookbook for Beginners: Easy, Healthy & Low-Carb Recipes That Will Help Keep You Sane",40347
"The 4-Phase Histamine Reset Plan: Getting to the Root of Migraines, Eczema, Vertigo, Allergies and More",65450
"Summary: The Plant Paradox: The Hidden Dangers In ""Healthy"" Foods That Cause Disease and Weight Gain By Dr Steven R. Gundry",92368
"365 Days of Clean Eating Recipes: A Clean Eating Cookbook with Over 365 Recipes Book for Healthy Clean Eat Diet, Healthy Living Wellness Lifestyle and Weight Loss",82429
"Eat Happy: Gluten Free, Grain Free, Low Carb Recipes For A Joyful Life",65466
"The Healthy Make-Ahead Cookbook: Wholesome, Flavorful Freezer Meals the Whole Family Will Enjoy",91007
"My Vitamix Blender Smoothie Recipe Book, A Simple Steps Cookbook: 101 Superfood Green Smoothie Recipes for Vitamix, to Gain Energy, Lose Weight & Feel ... (Blender Vitamix, Vitamix Cookbook Book 1)",215965
"Crock Pot Cookbook for Beginners: 700+ Quick, Easy and Delicious Recipes for Healthy Cook’s Kitchen with 1000-Day Hand-Picked Meal Plan",131163
Dairy Free Keto Cookbook: Beginner's Guide to Non-Dairy Ketogenic Diet with Low-Carb Recipes & 2-Week Dairy-Free Keto Meal Plan to Speed Up Your Weight Loss,132884
"The Affordable Ketogenic Diet For Beginners: Essential Low Carb Recipes That Actually yummy Good (Your Essential Guide to Living the Keto Lifestyle, Keto Dinner with Lose Weight Ideas)",111737
"Low-FODMAP Paleo Cookbook: The Revolutionary Diet for Managing IBS, Inflammation and Other Digestive Disorders",167089
"HISTAMINE INTOLERANCE: An Expository Guide on the Causes, Symptoms and Remedy to Histamine Intolerances",206907
The Sourdough School: The ground-breaking guide to making gut-friendly bread,116030
"Lectin Free Cookbook: Fast, Affordable & Delicious Lectin Free Recipes for your Instant Pot & Pressure Cooker for Healthy Living, Weight Loss and Anti-Inflammatory Diet",108403
Ingredients: A Visual Exploration of 75 Additives & 25 Food Products,220036
The 30-Minute Dairy Free Cookbook: 101 Easy and Delicious Meals for Busy People,129836
"The Low-FODMAP Diet Cookbook: 150 Simple, Flavorful, Gut-Friendly Recipes to Ease the Symptoms of IBS, Celiac Disease, Crohn's Disease, Ulcerative Colitis, and Other Digestive Disorders",181576
This Cheese is Nuts!: Delicious Vegan Cheese at Home,207877
"Anti Inflammatory Diet: Step By Step Guide To Heal The Immune System, Reduce Inflammation And Restore Your Health",187235
Made Whole Made Simple,173956
Crockpot Recipes: Easy and Healthy Meals for Smart People,211636
"Atkins Diet for Beginners: Easier to Follow than Keto, Paleo, Mediterranean or Low-Calorie Diet",105211
The Sirtfood Diet Cookbook: Recipes For The “Bespoke American Meal” That helps  Adele shed 7st.,132849
"The 30-Minute Autoimmune Diet Cookbook: Quick and Delicious Recipes for Autoimmune Disease, Chronic Illness, and Immune Function",186459
"Anti Inflammatory Diet: Cookbook: Nutrient Rich Healing Recipes to Help Relieve Chronic Pain & Inflammation (Pain free, Healthy Eating Low Carb, Diet) (Spanish Edition)",138486
Keto After 50: The Ultimate Guide to Ketogenic Diet for Beginners with 21-Day Keto Meal Plan Designed Specifically for People Over 50,155004
"GAPS Diet One Pot Delights Cookbook: Delicious Slow Cooker, Stockpot, Skillet & Roasting Pan Recipes",137370
"The Autoimmune Plant Based Cookbook: Recipes to Decrease Pain, Optimize Health, and Maximize Your Quality of Life",161408
"Carnivore Diet Intermittent Fasting: Increase Your Focus, Performance, Weight Loss, and Longevity Combining Two Powerful Methods for Optimal Health",292730
The End of Food Allergy: The New Science of Reintroduction and Reversal to Take the Fear Out of Food,371781
Psoriasis Warrior: The Miracle Program for Clear Skin,292300
Histamine Intolerance The Cookbook: Delicious recipes for people on low histamine diets (Cookbooks Book 1),367003
The Frugal Carnivore Diet: How I Eat a Carnivore Diet for $4 a Day,335385
Radiant - Eat Your Way to Healthy Skin,247859
The Alpha Gal Allergy: Working Mother's Cookbook Preparing Meals MEAT & DAIRY FREE,344579
Heal Your Gut: The Ultimate Beginner’s Heal Your Leaky Gut Diet Guide - Finally Heal & Restore Balance In Your Body + 50 Nourishing & Repairing Recipes,251800
Love Vegan: The Ultimate Mexican Cookbook: Easy Plant Based Recipes Anyone Can Cook | Includes a Bonus Gift Inside Each Copy!,288427
Nom Nom Paleo: Food for Humans,353214
"Food Babe Kitchen: More than 100 Delicious, Real Food Recipes to Change Your Body and Your Life",375690
Lactose Free Cookbook: A Collection of Recipes Perfect for if You Have a Lactose Allergy,399757
Clean Eating Cookbook for Beginners: Clean Eating 30 day Meal Prep Cookbook. Easy and Healthy Low Carb Recipes for Weight Loss Diet That Actually Works,343170
Carob Cookbook,393106
"Chia Seed Recipes: 30+ Recipes Using The Superfood Of The Aztecs For Weight Loss, Health, And Energy. (The Simple Recipe Series)",335461
"Keto Baking and Keto Dessert Recipes Cookbook: Low-Carb Cookies, Fat Bombs, Low-Carb Breads and Pies (keto diet cookbook, healthy dessert ideas, keto diet for diabetics, healthy sweets for adults)",291103
"1,000 Spanish Recipes (1,000 Recipes Book 22)",308403
The Kimchi Diet: Revive Your Gut • Get Lean • Live Longer,301008
The Essential Keto Diet Cookbook: 94 Delicious and Easy Ketogenic Recipes For both Beginners and Experts to Lose Weight Quickly and Easily + 28-Day Meal Plan for Healthy Lifestyle,383829
The 14-Day Elimination Diet Plan: Identify Food Allergies and Sensitivities the No-Stress Way,337254
"JJ Virgin's Sugar Impact Diet: Drop 7 Hidden Sugars, Lose Up to 10 Pounds in Just 2 Weeks",362040
"Anti Inflammatory Diet: Anti-Inflammatory - Whole Foods - Mediterranean - Inflammation (Flexible Dieting, Anti Inflammatory Diet, Pescetarian, Sugar Detox, ... Whole Foods, Low Carb, Inflammation Book 1)",384407
"No Gallbladder Diet: MAIN COURSE - Breakfast, Main Course, Dessert and Snacks Recipes for Gallbladder Disorders and surgery recovery",282588
"GAPS Diet Cookbook: Heal Your Leaky Gut and Restore Your Health Naturally; GAPS Recipes for Every Stage of the GAPS Diet With Photos, Serving Size, and Nutrition Facts for Every Recipe",400047
GAPS Family Cookbook: 100 Recipes to Nourish the Whole Family,232870
"ONE-POT MEALS: 44 Simple, Tasty Recipes That Take the Guesswork Out of Healthy Eating",385676
Acid Reflux Diet Cookbook: Delicious GERD Diet Recipes For Natural Acid Reflex And Gastritis Relief (GERD Cookbook Book 1),294466
"Nutribullet Smoothies Chef Inspired Recipes: A Healthy Recipe Book for Easy, Delicious & Tasty Smoothies.",374540
The Art of Healthy Eating - Savory: grain free low carb reinvented,310865
"My Yonanas Frozen Treat Maker Soft Serve Ice Cream Machine Recipe Book, a Simple Steps Brand Cookbook: 101 Delicious Frozen Fruit & Vegan Ice Cream Recipes, ... Steps! (Sorbet Maker, Vegan Gifts Book 1)",256564
The Dairy Free Keto Cookbook: Over 600 Dairy Free Ketogenic Recipes for healing and weight loss,377463
Bread Machine Recipes: Easy To Follow Steps For Delicious Bread In No Time,380314
The Anti-Inflammation Cookbook: The Delicious Way to Reduce Inflammation and Stay Healthy,271072
Anti Inflammatory Diet Instant Pot Cookbook: Easy Instant Pot Recipes to Decrease Inflammation. Heal Your Body and Lose Weight with Your Electric Pressure Cooker. Anti-inflammation Meal Plan,388382
The Heal Your Gut Cookbook: Nutrient-Dense Recipes for Intestinal Health Using the GAPS Diet,327382
"Food for a Happy Gut: Recipes to Calm, Nourish & Heal",412403
Joy's Simple Food Remedies: Tasty Cures for Whatever's Ailing You,415150
"Grain Brain: The Surprising Truth about Wheat, Carbs, and Sugar - Your Brain's Silent Killers",271900
The Wellness Mama Cookbook: 200 Easy-to-Prepare Recipes and Time-Saving Advice for the Busy Cook,253342
Simple AIP Paleo Comfort Food,319440
"Histamine Intolerance Journal: Track Symptoms, Find Solutions, Heal Yourself - Your Ultimate Personalised Histamine Tracking Journal / Diary (The Histamine Intolerance Series Book 3)",295749
"Anti-Inflammatory Cookbook for Two: 100 Simple & Delicious, Anti-Inflammatory Recipes For Two (The Anti-Inflammatory Diet & Anti-Inflammtory Cookbook Series)",381030
"Go Dairy Free: The Ultimate Guide and Cookbook for Milk Allergies, Lactose Intolerance, and Casein-Free Living",342121
Sweet Gratitude: A New World of Raw Desserts,237169
"Fatty Liver Diet: 50+ Smoothies, Dessert and Breakfast Recipes designed for Fatty Liver Diet",408679
Bakin' Without Eggs: Delicious Egg-Free Dessert Recipes from the Heart and Kitchen of a Food-Allergic Family,287254
The Leaky Gut Diet: The Low FODMAP Diet Made Easy - Simple solutions for IBS and Bowel Disorders,365581
"Heal Your Gut, Change Your Life: Step by Step Guide to the GAPS Diet + 50 Recipes to Nourish and Repair",236380
Low-FODMAP Instant Pot Cookbook: 100 Low-FODMAP Recipes for your Instant Pot to Overcome Digestive Disorders and Soothe Your Gut,283299
"Whole New You: How Real Food Transforms Your Life, for a Healthier, More Gorgeous You: A Cookbook",250905
"Keto Diet After 50: Ultimate Keto Cookbook for People Over 50 with Easy Recipes & Meal Plan - Regain Your Metabolism and Lose Weight, Stay Healthy and ... in Your Senior Years (Keto Diet for Women)",48741
Insulin Resistance Diet: How to Use Diet to Prevent Diabetes,112160
"The Insulin Resistance Diet Plan & Cookbook: Lose Weight, Manage PCOS, and Prevent Prediabetes",28445
"The Insulin Resistance Diet for PCOS: A 4-Week Meal Plan and Cookbook to Lose Weight, Boost Fertility, and Fight Inflammation",74026
The Complete 5-Ingredient Diabetic Cookbook: Simple and Easy Recipes for Busy People on Diabetic Diet with 4-Week Meal Plan,77158
"DIABETES: The Best Foods for Diabetes - 100 Easy, Delicious and Mouthwatering Superfoods to Reverse Diabetes and Lower Blood Sugar - The Smart Blood Sugar ... food,diabetes mellitus Book 1)",94690
"Yonanas: Frozen Healthy Dessert Maker Cookbook: (121 Easy Unique Frozen Treats and Alcoholic Desserts, Including Non-Dessert Recipes Like Mashed Potatoes, ... (Healthy Frozen Dessert Recipes Book 1)",103980
The Complete Diabetes Cookbook: The Healthy Way to Eat the Foods You Love,51332
Diabetic Cookbook for the Newly Diagnosed: 500 Simple and Easy Recipes for Balanced Meals and Healthy Living (21 Day Meal Plan Included),48104
The Southern Comfort Food Diabetes Cookbook: Over 100 Recipes for a Healthy Life,61473
"Food: What the Heck Should I Cook?: More than 100 Delicious Recipes--Pegan, Vegan, Paleo, Gluten-free, Dairy-free, and More--For Lifelong Health",54548
Dr. Neal Barnard's Program for Reversing Diabetes: The Scientifically Proven System for Reversing Diabetes without Drugs,34000
"The Blood Sugar Solution: The UltraHealthy Program for Losing Weight, Preventing Disease, and Feeling Great Now!",24367
KETO VEGETARIAN COOKBOOK: 555 HAND-PICKED VEGETARIAN RECIPES FOR A HEALTHY KETO DIET LIFESTYLE,112889
Dr. Neal Barnard's Cookbook for Reversing Diabetes: 150 Recipes Scientifically Proven to Reverse Diabetes Without Drugs,81827
A Year of Low Carb/ Keto Fat Bombs: 52 Seasonal Recipes Ketogenic Cookbook (Sweet & Savory Recipes) (Elizabeth Jane Cookbook),104410
28 Day Diabetes Diet Meal Planner- Menu Me!: Lower Carb Menus & Easy Recipes,101338
Easy Diabetic Meal Prep 2019-2020: Simple and Healthy Recipes - 3 Weeks Meal Plan - Lower Blood Sugar and Reverse Diabetes,102733
Sugar-Free Mom: Naturally Sweet and Sugar-Free Recipes for the Whole Family,80558
"Mediterranean Diet Cookbook for Two: Easy, Healthy and Delicious Recipes That Will Make Your Life Way Easier (Ready in 30 Min or Less)",26565
"Eat What You Love: Restaurant Favorites: Classic and Crave-Worthy Recipes Low in Sugar, Fat, and Calories",94947
21-Day Clean-Eating Meal Plan - 1200-1500 Calories: Healthy Recipes: The 3-Week Weight Loss Cookbook for Beginners. Part 2,77674
Insulin Resistance Diet for Beginners: The Complete Guide to Reverse Insulin Resistance & Manage Weight,50908
"Keto Snacks: Perfect Ketogenic Fat Burner Recipes | Supports Healthy Weight Loss - Burn Fat Instead of Carbs | Formulated for Keto, Diabetic, Paleo and Low-Carb/High-Fat Diets",92167
"PCOS Diet: A 30-Day Proven Program to Fight PCOS, Restore Your Fertility, and Prevent Diabetes. Meal Plan and Cookbook to Lose Weight with the Insulin Resistance Diet.",116358
The Type 2 Diabetic Cookbook & Action Plan: A Three-Month Kickstart Guide for Living Well with Type 2 Diabetes,36325
Sugar Detox in 10 Days: 100+ Recipes to Help Eliminate Sugar Cravings,80535
Dr. Bernstein's Diabetes Solution: The Complete Guide to Achieving Normal Blood Sugars,62968
