College Vegetarian Cookbook: Quick Plant-Based Recipes Every College Student Will Love. Delicious and Healthy Meals for Busy People on a Budget (Vegetarian Cookbook),335389
"Jello Salads 250: Enjoy 250 Days With Amazing Jello Salad Recipes In Your Own Jello Salad Cookbook! [Green Salad Recipes, Asian Salad Cookbook, Best Potato Salad Recipe] [Book 1]",119528
"Southern Salads, Sides & Soups: 400 Southern Favorites (Southern Cooking Recipes Book 2)",122687
The Family That Cooks Together: 85 Zakarian Family Recipes from Our Table to Yours,300304
THE DETOX DIET: The Definitive Guide for Vibrant Health and Maximum Weight Loss,185822
Pasta Salad - The Ultimate Guide,313483
Plant Power Bowls: 70 Seasonal Vegan Recipes to Boost Energy and Promote Wellness,287160
Filling Salads for Healthy Weight Loss: 25+ Delicious Salads to Help You Reach your Weight Goal,163260
Top 50 Most Delicious Homemade Salad Dressing Recipes [A Salad Dressing Cookbook] (Recipe Top 50's Book 106),246839
Recettes de Cuisine Traditionnelle de Salades Simples et Composées (Les recettes d'Auguste Escoffier t. 21) (French Edition),166362
Fixin' to Eat: Southern Cooking for the Southern at Heart (Cooking Squared Book 4),148473
"Keto Meal Prep Cookbook For Beginners: 600 Easy, Simple & Basic Ketogenic Diet Recipes (Keto Cookbook)",7566
Vegetarian Keto Diet for Beginners: TOP 55 Amazing and Simple Recipes in One Ketogenic Cookbook - Any Recipes on Your Choice for Any Meal Time - with Calories and Carbs and Vegan Replacements,276489
Superfood Salad Recipes: Eat Yourself Skinny Vegetable Cookbook for Healthy Green Fat Burning Diet,276340
Gastric Sleeve Bariatric Surgery Cookbook: The Complete Guide to Achieving Weight Loss Surgery Success with Over 100 Delicious Healthy Recipes,220731
"Nutribullet Recipe Book: Smoothie Recipes for Weight-Loss, Detox, Anti-Aging & So Much More! (Recipes for a Healthy Life Book 1)",58038
The Dinner Salad Cookbook: Easy & Satisfying Recipes That Make a Meal,154133
Plant-Based Diet: The Essential Cookbook for Beginners. Healthy Recipes & Meal Plan for Weight Loss,277143
Fire Islands: Recipes from Indonesia,297711
Williams-Sonoma Salad of the Day: 365 recipes for every day of the year,115495
Love Vegan: The Ultimate Asian Cookbook: Easy Plant Based Recipes Anyone Can Cook | Includes a Bonus Gift Inside Each Copy!,229444
The Happy Pear: Vegan Cooking for Everyone: Over 200 Delicious Recipes That Anyone Can Make,146405
500 Keto Instant Pot Recipes Cookbook: The Easy Electric Pressure Cooker Ketogenic Diet Cookbook to Reset Your Body and Live a Healthy Life,64496
Vegan Under Pressure: New Delicious Recipes to Your Life. Using a Traditional or Electric Pressure Cooker & Simple Plant-Based Diet,257441
"Saladish: A Crunchier, Grainier, Herbier, Heartier, Tastier Way with Vegetables",290126
"Fresh India: 130 Quick, Easy and Delicious Vegetarian Recipes for Every Day",265369
Cooking with Mary Berry: Classic Dishes and Baking Favorites Made Simple,221446
I Hate Vegetables Cookbook: Fresh and Easy Vegetable Recipes That Will Change Your Mind (Cooking Squared Book 1),97698
Simply Salads: More than 100 Creative Recipes You Can Make in Minutes from Prepackaged Greens,333672
DASH Diet for Dummies: 56 Easy Recipes for a 14-Day Diet Meal Plan to Lose Weight and Get Healthy (DASH Dieting Book 1),79994
"Plant-Based Diet Meal Prep: 7 Reasons to Choose a Plant-Based Diet. Easy, Healthy and Budget-Friendly Recipes Ideas to Prep, Grab, and Go. Beginners Guide for Perfect Make Ahead Meals",22104
365 Days of Salad Recipes: A Salad Cookbook with Over 365 Salad Recipes & Dressing Salads To Go for Weight Loss and Healthy Lifestyle,242356
"Salad Samurai: 100 Cutting-Edge, Ultra-Hearty, Easy-to-Make Salads You Don't Have to Be Vegan to Love",211483
"Bianco: Pizza, Pasta, and Other Food I Like",14390
"132+ Delicious Salads, Dressings And Dips: Healthy Salad Recipes For Weight Loss, Great For Vegetarian And Raw Vegan Diets (Gabrielle's FUSS-FREE Healthy Eating Cookbooks And Vegetarian Recipes)",245273
Homemade  Salad Dressing Recipes: A Salad Dressings Cookbook With 127 Healthy And Creative Salad Dressings And Vinaigrette recipes,299042
Mediterranean Salad Cookbook: Incredibly Delicious Salad Recipes for Natural Weight Loss and Detox: Mediterranean Diet Cookbook (Healthy Cooking and Eating 3),313119
Food52 Mighty Salads: 60 New Ways to Turn Salad into Dinner [A Cookbook] (Food52 Works),182171
Simple Salad Cookbook: 100 Recipes That Can Be Made in Minutes,198034
The Mediterranean Salad Cookbook: Salads and Salad Dressings for Healthy Living (Mediterranean Diet Cookbook Book 3),185999
"Salads on the Run: The Top 50 Mason Jar Salad Recipes That Are Quick, Crafty, and Great on the Go",320337
"Plant-Based Diet Cookbook for Beginners: 21-Day Meal Plan to Energize Your Body and Fuel Your Workouts with High-Protein Vegan Recipes, Healthy and Whole Foods Recipes to Kick-Start a Healthy Eating",56076
"The Art of Edible Flowers: Recipes and ideas for floral salads, drinks, desserts and more",177188
The Spicy Salads of India: Insanely Delicious and Nutritious! (Indian Salad Cookbook Book 1),318017
"FAST & EASY VEGETARIAN MEAL PREP: Weekly Plans and Recipes to Lose Weight the Healthy Way. Ready-to-Go Meals and Snacks for Healthy Plant-Based Eating (HEALTH, DIETS & WEIGHT LOSS)",143760
"Vegan Cookbook: Delicious Vegan Gluten-free Breakfast, Lunch and Dinner Recipes You Can Make in Minutes!: Healthy Vegan Cooking and Living on a Budget (Vegan Gluten-free Diet Book 1)",313357
"Keto Vegetarian Cookbook: Easy & Delicious Low-Carb Vegetarian Recipes for Easy and Fast Weight Loss, Heal your Body and Improve your Life",236597
Vegan Athlete Cookbook: High-Protein Delicious Recipes in Your Workouts. Golden Rules for Vegan Athletes & 70 Recipes Meal Prep,300717
Corn Cookbook,174142
"The Happy Pear: Recipes for Happiness: Delicious, Easy Vegetarian Food for the Whole Family",116266
The Salad Dressing Cookbook: Unleash your Creativity with 25 Unique Salad Dressing Recipes,391827
The Quick & Easy Spiralizer Cookbook: 100 Vegetable Noodle Recipes You Can Make in 30 Minutes or Less,420602
"Nutribullet Smoothies Chef Inspired Recipes: A Healthy Recipe Book for Easy, Delicious & Tasty Smoothies.",363782
"Seriously Good Salads: Creative Flavor Combinations for Nutritious, Satisfying Meals",469934
The Alkaline Diet: Ultimate Guide for Beginners with Healthy Recipes and Kick-Start Meal Plans (Alkaline cookbook),509722
Unauthorized Copycat Panera Bread Salads & Dressings: Current Classics & Forgotten Favorite Salads - Panera Bread Copycat Recipes (Unauthorized Copycat Recipes Book 2),380738
Green Salads: 70 Quick & Easy Gluten Free Low Cholesterol Whole Foods Recipes full of Antioxidants & Phytochemicals,573564
Plant Based Cookbook: Plant Based Cookbook for Beginners 2020 with 4 Weeks Plant Based Diet Meal Plan to Reset & Energize Your Body: Plant-based Diet for Beginners Book (Healthy Cookbook),370432
Superfood Cookbook: Delicious Vegetarian Superfood Salads for Easy Weight Loss and Detox: Healthy Clean Eating Recipes on a Budget (Superfood Kitchen Book 1),465441
"Vegan Mediterranean Cookbook: Incredibly Delicious Vegan Salad, Soup, Casserole and Skillet Recipes from the Mediterranean Diet (Everyday Vegan Recipes and Clean Eating Meals Book 1)",496224
Eat to Thrive: The Anti-Diet Cookbook,537580
Easy Coleslaw Cookbook: 50 Delicious Coleslaw Recipes (2nd Edition),554627
Pop It in a Jar: Delicious Recipes to Pop in a Jar,535632
"The Mason Jar Cookbook: 80 Healthy and Portable Meals for breakfast, lunch and dinner",364666
Plant Based Meal Prep: 100+ Healthy Plant-Based Recipes to Cleanse your Body with a 30-Day Plant-Based Diet Meal Plan to Save Time,466415
"THE PLANT-BASED DIET COOKBOOK FOR BEGINNERS: An Inspiring Collection of Plant-Based Diet Recipes to Help You Lose Weight, Become Healthy, and Revitalize Yourself (HEALTH, DIETS & WEIGHT LOSS)",388500
"Salads and Dressings: Over 100 Delicious Dishes, Jars, Bowls, and Sides",527349
"Super Easy Vegetarian Keto Cookbook: The proven way to lose weight healthily with the ketogenic diet,even if you're a clueless beginner",442380
"Everyday Vegetarian Family Cookbook: 100 Delicious Meatless Breakfast, Lunch and Dinner Recipes You Can Make in Minutes!: Healthy Weight Loss Diets (Vegetarian Living and Cooking Book 1)",512721
"Best Dressed: 50 Recipes, Endless Salad Inspiration",573923
Mason Jar Meals Cookbook: 30 Exquisite Jar Meals Recipes,492028
Salad for President: A Cookbook Inspired by Artists,507744
Quick and Easy Stir-Fry and Asian Salads (Delicious Mini Book Book 9),560096
50 MEJORES RECETAS DE ENSALADAS Para Bajar de Peso y Desintoxicar el Cuerpo: Deliciosas Recetas Faciles y Saludables (Spanish Edition),374711
"Hello! 123 Macaroni Salad Recipes: Best Macaroni Salad Cookbook Ever For Beginners [Bean Salad Recipes, Summer Salad Book, Tuna Salad Cookbook, Shrimp Salad Recipe, Macaroni & Cheese Recipe] [Book 1]",552826
Substantial Salads: 100 Healthy and Hearty Main Courses for Every Season,571158
"Vegetarian Cookbook: Incredibly Delicious Vegetarian Soup, Salad, Casserole, Slow Cooker and Skillet Recipes Inspired by The Mediterranean Diet: Weight Loss and Detox (Healthy Cooking Book 1)",383973
"Hello! 365 Main Dish Salad Recipes: Best Main Dish Salad Cookbook Ever For Beginners [Asian Salad Cookbook, Summer Salads Cookbook, Thai Salad Recipe, ... Cookbook, Crab Salad Recipes] [Book 1]",569595
Plant Based High Protein Cookbook: 100 Delicious Vegan Recipes for Athletes to Build Muscle Mass Maintain Excellent Fitness and Improve your Lifestyle,446070
The Best of Kale in One Book: Discover 30 Kale Recipes for Salads and Smoothies,563119
Salat-Rezept-Kochbuch Auf Deutsch/ Salad Recipe Cookbook In German (German Edition),376535
Pizza Camp: Recipes from Pizzeria Beddia,335672
Vegan Salads: Over 65 Vegan Quick and Easy Gluten Free Low Cholesterol Whole Foods Recipes full of Antioxidants and Phytochemicals,417809
Vegan in 7,480177
Leafy Greens: An A-to-Z Guide to 30 Types of Greens Plus More than 120 Delicious Recipes,381280
"The Casserole Queens Make-a-Meal Cookbook: Mix and Match 100 Casseroles, Salads, Sides, and Desserts",473731
"The Complete Keto For Two Cookbook For Beginners: Easy and Most Wanted Low-Carb Diet Recipes Book with Delicious Keto Desserts, Bread, Snacks and Keto Meal Plan for Your Rapid Weight Loss",344090
"Spiralizer: Spiralizer Cookbook - Healthy And Delicious Spiralizer Recipes (Spiralizer Recipes, Spiralizer Cooking, Spiralizer Vegetable)",505502
Salad Cookbook: Delicious High Protein Vegetarian Salad Recipes for Easy Weight Loss and Detox: Family Health and Fitness Books (Healthy Slimming Superfood Power Recipes Book 1),450936
Keep It Vegan,439013
Zucchini Cookbook: Family Zucchini Recipe Book with Tasty and Easy Zucchini Recipes (Zucchini Tastes 3),464675
Superfood Salad Recipes: A Clean Eating Cookbook for Easy Weight Loss and Detox: Fuss Free Dinner Recipes That Are Easy On The Budget,455251
Superfoods Salads In A Jar: Over 75 Quick & Easy Gluten Free Low Cholesterol Whole Foods Recipes full of Antioxidants & Phytochemicals,391145
"Top 30 Healthy, Popular, Delicious And Simple Japanese Appetizer, Main Dish And Salad Meals You Must Eat Before You Die",411498
30 recetas de ensaladas seductoras: ensaladas rápidas y fáciles para disfrutar (Spanish Edition),572010
"The Everyday Allergy Free Cookbook: Enjoy Amazing, Easy Recipes without Dairy, Gluten, Soy, Eggs, Fish, Shellfish, Nuts, Fruits or Spices. Comfortable Allergen-Friendly Cooking for Kids and Adults",545354
125 Homemade Salad Dressings: Healthy And Yummy Salad & Vinaigrette Recipes,339902
"LAZY KETO DIET FOR VEGANS: Top 90 Quick, Easy And Delicious Plant-Based Recipes On A Budget In 30-Day Keto Meal Plan To Help You Save Time And Enjoy Vegan Ketogenic Diet Lifestyle, Low Carb Cookbook",483024
Salads That Inspire: A Cookbook of Creative Salads,427908
Life-Changing Salad Dressings: In 3 Minutes Flat (Grace Légere Cookbooks Book 2),371362
"Plant-Based on a Budget: Delicious Vegan Recipes for Under $30 a Week, in Less Than 30 Minutes a Meal",128670
The Homemade Vegan Pantry: The Art of Making Your Own Staples [A Cookbook],53060
"Plant-Based Nutrition, 2E (Idiot's Guides)",110577
The Oh She Glows Cookbook: Over 100 Vegan Recipes to Glow from the Inside Out,78911
BOSH!: Simple Recipes * Amazing Food * All Plants (BOSH Series),75176
Forks Over Knives: The Plant-Based Way to Health,137344
"Vegan Pressure Cooking, Revised and Expanded:More than 100 Delicious Grain, Bean, and One-Pot Recipes  Using a Traditional or Electric Pressure Cooker or Instant Pot®",143956
PLANTLAB,124002
Bish Bash Bosh!: Your Favorites * All Plants (BOSH Series),16417
"The Engine 2 Cookbook: More than 130 Lip-Smacking, Rib-Sticking, Body-Slimming Recipes to Live Plant-Strong",16960
"But I Could Never Go Vegan!: 125 Recipes That Prove You Can Live Without Cheese, It's Not All Rabbit Food, and Your Friends Will Still Come Over for Dinner",92091
Rachel Ama’s Vegan Eats: Tasty plant-based recipes for every day,67174
"The Vegan Instant Pot Cookbook: Wholesome, Indulgent Plant-Based Recipes",31577
"Blissful Bites: Vegan Meals That Nourish Mind, Body, and Planet",39481
"Forks Over Knives: Flavor!: Delicious, Whole-Food, Plant-Based Recipes to Cook Every Day",66666
Forks Over Knives—The Cookbook: Over 300 Recipes for Plant-Based Eating All Through the Year,19109
Best Holiday Dishes for the Vegans in Your Life: Amazing Recipes to Try for the Most Popular Holidays Cookbook (Trying Out Vegan 1),105954
Thug Kitchen: The Official Cookbook: Eat Like You Give a F*ck (Thug Kitchen Cookbooks),12517
"YumUniverse: Infinite Possibilities for a Gluten-Free, Plant-Powerful, Whole-Food Lifestyle",22077
BOSH!: Healthy Vegan (BOSH Series Book 4),116372
Vegan Under Pressure: Perfect Vegan Meals Made Quick and Easy in Your Pressure Cooker,83995
"The Happy Pear: Recipes for Happiness: Delicious, Easy Vegetarian Food for the Whole Family",116266
"One-Hour Dairy-Free Cheese: Make Mozzarella, Cheddar, Feta, and Brie-Style Cheeses—Using Nuts, Seeds, and Vegetables",138849
Vegan 100,141615
Thug Kitchen 101: Fast as F*ck: A Cookbook (Thug Kitchen Cookbooks),62971
How to Cook Everything Vegetarian: Completely Revised Tenth Anniversary Edition,19309
Vegetable Kingdom: The Abundant World of Vegan Recipes,13759
Vegan Yack Attack's Plant-Based Meal Prep:Weekly Meal Plans and Recipes to Streamline Your Vegan Lifestyle,121989
"Afro-Vegan: Farm-Fresh African, Caribbean, and Southern Flavors Remixed [A Cookbook]",18101
"Sweet Potato Soul: 100 Easy Vegan Recipes for the Southern Flavors of Smoke, Sugar, Spice, and Soul : A Cookbook",18662
"Vegan for Everybody: Foolproof Plant-Based Recipes for Breakfast, Lunch, Dinner, and In-Between",56029
Crossroads: Extraordinary Recipes from the Restaurant That Is Reinventing Vegan Cuisine,138357
Hot for Food Vegan Comfort Classics: 101 Recipes to Feed Your Face [A Cookbook],38119
The Modern Cook's Year: More than 250 Vibrant Vegetarian Recipes to See You Through the Seasons,69091
Southern Vegan: Delicious Down-Home Recipes for Your Plant-Based Diet,98052
The Sprout Book: Tap into the Power of the Planet's Most Nutritious Food,10162
La Vida Verde: Plant-Based Mexican Cooking with Authentic Flavor,61120
The Easy Vegan Cookbook: Make  Healthy  Home Cooking Practically Effortless,129768
NYC Vegan: Iconic Recipes for a Taste of the Big Apple,119680
"Vegan Soul Kitchen: Fresh, Healthy, and Creative African-American Cuisine",141154
"The No Meat Athlete Cookbook: Whole Food, Plant-Based Recipes to Fuel Your Workouts—and the Rest of Your Life",95739
Plants-Only Kitchen,61791
Vegan Comfort Cooking: 75 Plant-Based Recipes to Satisfy Cravings and Warm Your Soul,86042
Love Your Body Feed Your Soul: Self-Care Rituals and Recipes for Your Inner Goddess,123808
"The Greenprint: Plant-Based Diet, Best Body, Better World",142510
"FAST & EASY VEGETARIAN MEAL PREP: Weekly Plans and Recipes to Lose Weight the Healthy Way. Ready-to-Go Meals and Snacks for Healthy Plant-Based Eating (HEALTH, DIETS & WEIGHT LOSS)",143760
Thug Kitchen Party Grub: For Social Motherf*ckers: A Cookbook (Thug Kitchen Cookbooks),133522
Love Real Food: More Than 100 Feel-Good Vegetarian Favorites to Delight the Senses and Nourish the Body: A Cookbook,26390
The Complete Vegetarian Cookbook: A Fresh Guide to Eating Well With 700 Foolproof Recipes,79078
Crazy Sexy Kitchen: 150 Plant-Empowered Recipes to Ignite a Mouthwatering Revolution,15495
This Cheese is Nuts!: Delicious Vegan Cheese at Home,201488
The Essential Vegan Keto Cookbook: 65 Healthy & Delicious Plant-Based Ketogenic Recipes: A Keto Diet Cookbook,234411
"Better Than Vegan: 101 Favorite Low-Fat, Plant-Based Recipes That Helped Me Lose Over 200 Pounds",197809
"The Mediterranean Vegan Kitchen: Meat-Free, Egg-Free, Dairy-Free Dishes from the Healthiest Region Under the Sun: A Vegan Cookbook",183023
"AFFORDABLE PLANT-BASED COOKING WITH YOUR INSTANT POT: Quick, Delicious & Clean Meals on a Budget (HEALTH, DIETS & WEIGHT LOSS)",171505
Party in Your Plants: 100+ Plant-Based Recipes and Problem-Solving Strategies to Help You Eat Healthier (Without Hating Your Life),200417
"Eat Real to Heal: Using Food As Medicine to Reverse Chronic Diseases from Diabetes, Arthritis, Cancer and More",155520
One Pot Vegan: 80 brand new recipes from the creators of SO VEGAN,169726
"Salad Samurai: 100 Cutting-Edge, Ultra-Hearty, Easy-to-Make Salads You Don't Have to Be Vegan to Love",211483
Vegan Richa's Indian Kitchen: Traditional and Creative Recipes for the Home Cook,157781
Ageless Vegan: The Secret to Living a Long and Healthy Plant-Based Life,189394
"Caribbean Vegan: Meat-Free, Egg-Free, Dairy-Free Authentic Island Cuisine for Every Occasion",172092
"Your Complete Vegan Pregnancy: Your All-in-One Guide to a Healthy, Holistic, Plant-Based Pregnancy",145807
Super Simple One Pot Meals: Learn to Cook Easy Whole-Foods Plant-Based Meals,197010
Mostly Plants: 101 Delicious Flexitarian Recipes from the Pollan Family,229934
"The China Study All-Star Collection: Whole Food, Plant-Based Recipes from Your Favorite Vegan Chefs",152544
"Skinny Bitch: A No-Nonsense, Tough-Love Guide for Savvy Girls Who Want To Stop Eating Crap and Start Looking Fabulous!",214193
"Gluten-Free Baking: Perfect Gluten Free Bread, Cookies, Cakes, Muffins and other Gluten Intolerance Recipes for Healthy Eating. Essential Cookbook for Beginners to Avoid Celiac Disease",165830
Vegetables Illustrated: An Inspiring Guide with 700+ Kitchen-Tested Recipes,207984
The Vegan Starter Kit: Everything You Need to Know About Plant-Based Eating,164252
"The Kind Diet: A Simple Guide to Feeling Great, Losing Weight, and Saving the Planet",179833
Vegan Dinner Party: Comforting Vegan Dishes for Any Occasion,149888
Ottolenghi Flavor: A Cookbook,153427
The First Mess Cookbook: Vibrant Plant-Based Recipes to Eat Well Through the Seasons,182831
"Dependable STARCH SOLUTION Manual: Comprehensive Guide on Everything You Need to Know About Starch Solution to Lose Weight, Keep Healthy, Prevent Diseases & So Much More",212903
"The Healthspan Solution: How and What to Eat to Add Life to Your Years: 100 Easy, Whole-Food Recipes",204274
Vegan Ice Cream: Over 90 Sinfully Delicious Dairy-Free Delights [A Cookbook],147924
Vegan Cooking in Your Air Fryer: 75 Incredible Comfort Food Recipes with Half the Calories,193474
VB6: Eat Vegan Before 6:00 to Lose Weight and Restore Your Health . . . for Good,157455
"Field Roast: 101 Artisan Vegan Meat Recipes to Cook, Share, and Savor",148858
"Power Plates: 100 Nutritionally Balanced, One-Dish Vegan Meals [A Cookbook]",180651
Five Ingredient Vegan,189095
The Ultimate Vegan Cookbook: The Must-Have Resource for Plant-Based Eaters,233427
Vegan Richa's Everyday Kitchen: Epic Anytime Recipes with a World of Flavor,216808
"The Vegan 8: 100 Simple, Delicious Recipes Made with 8 Ingredients or Less",229154
Vegan Reset: The 28-Day Plan to Kickstart Your Healthy Lifestyle,238694
Veggie Mama,202843
I Can Cook Vegan,233385
Sweetly Raw Desserts,213521
Food52 Vegan: 60 Vegetable-Driven Recipes for Any Kitchen [A Cookbook] (Food52 Works),176426
"Vegan with a Vengeance, 10th Anniversary Edition: Over 150 Delicious, Cheap, Animal-Free Recipes That Rock",153121
Keto Smoothie Recipes: Healthy And Delicious Ketogenic Diet Smoothie and Shake Recipes Cookbook,204275
Vegan on the Cheap: Great Recipes and Simple Strategies that Save You Time and Money,144282
Everyday Happy Herbivore: Over 175 Quick-and-Easy Fat-Free and Low-Fat Vegan Recipes,151492
The Happy Pear: Vegan Cooking for Everyone: Over 200 Delicious Recipes That Anyone Can Make,146405
The Plantpower Way: Italia: Delicious Vegan Recipes from the Italian Countryside: A Cookbook,192286
Indian in 7: Delicious Indian recipes in 7 ingredients or fewer,145598
The China Study Family Cookbook: 100 Recipes to Bring Your Family to the Plant-Based Table,224391
Veganize It!: Easy DIY Recipes for a Plant-Based Kitchen,147709
BabyCakes Covers the Classics: Gluten-Free Vegan Recipes from Donuts to Snickerdoodles: A Baking Book,165905
Every Grain of Rice: Simple Chinese Home Cooking,69243
Fermentation for Beginners: Delicious Fermented Vegetable Recipes for Better Digestion and Health,76641
"Fermented Vegetables: Creative Recipes for Fermenting 64 Vegetables & Herbs in Krauts, Kimchis, Brined Pickles, Chutneys, Relishes & Pastes",59361
The Vegetarian Meal Prep Cookbook: Time-Saving Recipes and Weekly Plans for Healthy Eating,80694
"Air Fryer Cookbook For Beginners In 2020: Easy, Healthy And Delicious Recipes For A Nourishing Meal (Includes Index, Some Low Carb Recipes, Air Fryer FAQs And Troubleshooting Tips) (Quick Recipes 1)",28366
The Easy Gluten-Free Cookbook: Fast and Fuss-Free Recipes for Busy People on a Gluten-Free Diet,41811
101 Things To Do With a Potato,39510
Six Seasons: A New Way with Vegetables,63963
"The Engine 2 Cookbook: More than 130 Lip-Smacking, Rib-Sticking, Body-Slimming Recipes to Live Plant-Strong",16960
The Complete Vegan Instant Pot Cookbook: 101 Delicious Whole-Food Recipes for your Pressure Cooker,37023
The Oh She Glows Cookbook: Over 100 Vegan Recipes to Glow from the Inside Out,78911
"The Plant Paradox Family Cookbook: 80 One-Pot Recipes to Nourish Your Family Using Your Instant Pot, Slow Cooker, or Sheet Pan",65552
Edible Wild Plants,18330
The Modern Cook's Year: More than 250 Vibrant Vegetarian Recipes to See You Through the Seasons,69091
"The Plant-Based Diet for Beginners: 75 Delicious, Healthy Whole-Food Recipes",2928
"THE GARDEN GURU’S GUIDE TO PRESERVING YOUR HARVEST: Learn How to be Self Sufficient: Canning, Fermenting, Pickling, Dehydrating, and Smoking Your Fresh Garden Herbs and Vegetables",50530
"The College Vegan Cookbook: 145 Affordable, Healthy & Delicious Plant-Based Recipes",66546
The New Vegetarian Cooking for Everyone: [A Cookbook],86436
"But I Could Never Go Vegan!: 125 Recipes That Prove You Can Live Without Cheese, It's Not All Rabbit Food, and Your Friends Will Still Come Over for Dinner",92091
BOSH!: Simple Recipes * Amazing Food * All Plants (BOSH Series),75176
Levant: New Middle Eastern Flavours,54000
"365 Days of Spiralizer Recipes: A Spiralizer Cookbook with Over 365 Recipes Book for Low Carb Vegetable Pasta Noodle, Clean Eating Salads and Healthy Vegan Weight Loss",78331
Beans 20 Ways,4749
Bish Bash Bosh!: Your Favorites * All Plants (BOSH Series),16417
"The Plant Paradox Cookbook: 100 Delicious Recipes to Help You Lose Weight, Heal Your Gut, and Live Lectin-Free",14690
The Essential Vegetable Cookbook: Simple and Satisfying Ways to Eat More Veggies,89176
How to Cook Everything Vegetarian: Completely Revised Tenth Anniversary Edition,19309
Smitten Kitchen Every Day: Triumphant and Unfussy New Favorites: A Cookbook,44580
Low-Carb Vegetarian Cookbook: 100 Easy Recipes and a Kick-Start Meal Plan,43850
"The Healthy Air Fryer Cookbook: Truly Healthy Fried Food Recipes with Low Salt, Low Fat, and Zero Guilt",75021
Rachel Ama’s Vegan Eats: Tasty plant-based recipes for every day,67174
Mycelium Running: How Mushrooms Can Help Save the World,86521
Eating Vegan: A Plant-Based Cookbook for Beginners,49149
"Foodi Digital Air Fry Oven Cookbook for Beginners: Simple, Easy and Delicious Recipes for Digital Air Fryer Oven",60555
"Cool Beans: The Ultimate Guide to Cooking with the World's Most Versatile Plant-Based Protein, with 125 Recipes [A Cookbook]",33808
"Eating in Color: Delicious, Healthy Recipes for You and Your Family",42107
"The Healthy Smoothie Bible: Lose Weight, Detoxify, Fight Disease, and Live Long",73068
The Gardener & the Grill: The Bounty of the Garden Meets the Sizzle of the Grill,42520
"One Pan, Two Plates: More Than 70 Complete Weeknight Meals for Two",5311
"The 30-Minute Vegetarian Cookbook: 100 Healthy, Delicious Meals for Busy People",33668
The Complete Vegetarian Cookbook: A Fresh Guide to Eating Well With 700 Foolproof Recipes,79078
You deserve this.: Simple & Natural Recipes For A Healthy Lifestyle,29051
"DR. SEBI: How to Naturally Detox the Liver, Reverse Diabetes and High Blood Pressure Through Dr. Sebi Alkaline Diet",6356
Ultimate Veg: Easy & Delicious Meals for Everyone [American Measurements],79370
Atkins Diet Plan 2020: The Complete Beginner's Guide With 4 Weeks Meal Plan to Shed Weight and Feel Great,54263
"The Beginner's Guide to a Plant-based Diet: Use the Newest 3 Weeks Plant-Based Diet Meal Plan to Reset & Energize Your Body. Easy, Healthy and Whole Foods Recipes to Kick-Start a Healthy Eating",14369
Ruffage: A Practical Guide to Vegetables,49680
