Under Pressure: Cooking Sous Vide (The Thomas Keller Library),313612
Michael Mina: The Cookbook,258589
"Favorite Recipes from Melissa Clark's Kitchen: Family Meals, Festive Gatherings, and Everything In-between",310812
Claridge's: The Cookbook,313791
Macarons :The Ultimate Recipe Guide,249163
Roman Style Recipes: An Illustrated Cookbook of Italian Dish Ideas!,299979
The New Laurel's Kitchen: [A Cookbook],308619
The Simple Art of Japanese Cooking: Everything You Need in a Japanese Cookbook,242566
The 50 Greatest Bacon Recipes of All Time (Recipe Top 50's Book 34),343541
The Smitten Kitchen Cookbook,239392
"Sharp: The Definitive Introduction to Knives, Sharpening, and Cutting Techniques, with Recipes from Great Chefs",343109
The Ritz London: The Cookbook,237858
Cooking Off the Clock: Recipes from My Downtime [A Cookbook],254394
The Food of Campanile: Recipes from the Famed Los Angeles Restaurant: A Cookbook,354015
Favorite Empanada Recipes: Easy to Make Hand-Held Pies,344863
On a Stick!: 80 Party-Perfect Recipes,319907
My ANOVA Sous Vide Home Kitchen Cookbook: Simple and Delicious Gourmet Recipes for Sous Vide Beginners and Experts (Culinary Immersion Circulators Book 1),341796
Copycat Recipes: Making Restaurants' Most Popular Recipes at Home. Quick and Easy Cookbook.,257590
Eat Right 4 Your Type Personalized Cookbook Type B: 150+ Healthy Recipes For Your Blood Type Diet,268615
Sous Vide Cookbook for Beginners: Easy-to-Follow Guide to Cooking Restaurant-Quality Meals at Home,328208
"How to Make Cheese: Complete beginner's guide to cheese making at home - Step by step cheese making recipes for simple, classic, and artisan cheese",320498
The Effortless Sous Vide Cookbook: 140 Recipes for Crafting Restaurant-Quality Meals Every Day,345859
Keys to Good Cooking: A Guide to Making the Best of Foods and Recipes,315706
Eat Right 4 Your Type Personalized Cookbook Type O: 150+ Healthy Recipes For Your Blood Type Diet,247064
"Anthony Bourdain's Les Halles Cookbook: Strategies, Recipes, and Techniques of Classic Bistro Cooking",346808
"Canapés (appetisers, cocktail party food, finger food, nibbles, hors d'oeuvres, amuse-bouche, mini bites including warm canapés, cold canapés and sweet ... canapés) (Chantal’s Kitchen Book 1)",273107
Flan Recipes: The Ultimate Guide,256291
Menus that Made History: Over 2000 years of menus from Ancient Egyptian food for the afterlife to Elvis Presleys wedding breakfast,334552
Bao Buns!: Beautiful Bao Bun Recipes For An Authentic Asian Banquet,340230
How to Make Butter and Yogurt: Make your own artisan butter & yogurt at home (Home Dairy Series Book 1),346882
"A Twist of the Wrist: Quick Flavorful Meals with Ingredients from Jars, Cans, Bags, and Boxes: A Cookbook",308917
Eat Right 4 Your Type Personalized Cookbook Type AB: 150+ Healthy Recipes For Your Blood Type Diet,366735
"Baking Sourdough Bread: Dozens of Recipes for Artisan Loaves, Crackers, and Sweet Breads",360187
Around My French Table: More than 300 Recipes from My Home to Yours,242254
"Asian Dumplings: Mastering Gyoza, Spring Rolls, Samosas, and More [A Cookbook]",334953
The Home Chef's Sous Vide Cookbook: Elevated Recipes for Your Favorite Meats and Sides,346728
Mourad: New Moroccan,348311
Le Bernardin Cookbook: Four-Star Simplicity,246770
The Martha Stewart Living Cookbook: The Original Classics,323399
Beard on Pasta,287434
"Mealthy CrispLid Cookbook for Beginners: Amazingly Easy and Delicious Recipes to Fry, Grill and Roast with the Mealthy CrispLid for Any Pressure Cooker",270373
"Sous Vide Cookbook: 101 Modern yet Simple Techniques for Rich, Healthy and Delicious Sous Vide Home Cooking (The Sadistically Delicious Series Book 2)",242669
Try This at Home: Recipes from My Head to Your Plate: A Cookbook,324490
Instant Pot Cookbook: Healthy 500 Quick & Easy Days of Instant Pot Recipes,247184
The Paleo Holiday Recipe Mega Bundle: 5 Delicious Recipe Books,2014484
"Copycat Recipes: 2020 Ultimate Cookbook to Easily Making Most Popular Recipes from Your Favorite Restaurants at Home ON A BUDGET - Cracker Barrel, Chipotle, Texas Roadhouse and many others!",26758
BAKING DESSERTS: A COOKBOOK OF DELICIOUS HOMEMADE RECIPES,1784022
"Simple Anti-Inflammatory Meal Plan for Beginners: Autoimmune Dinner Recipes: 30+ Anti Inflammation Diet Recipes To Fight Autoimmune Disease, Reduce Pain And Restore Health",2188366
Instant Pot Cookbook: Healthy 500 Quick & Easy Days of Instant Pot Recipes,247184
Weeknight Meals Cookbook for Two: Easy and Healthy Dinner Recipes for Weeknight Cooking for Two,120018
Bundt Cake Recipes: 30 Delicious Bundt Cake Recipes From Scratch,329224
Keto Festive & Christmas & New Year Cookbook: Recipes for Thanksgiving Christmas & New Year Delicious Low Carb High Fat Healing Recipes Including Nutritional Info,1642832
Effortless Sous Vide Cookbook for Complete Cooking at Home: Best Perfectly Cooked Delicious Meals Using Modern Technique for Restaurant Quality Food Everyday ... (Effortless Sous Vide Immersion Cooking 1),1050610
Paleo Party Food Cookbook: Make Your Friends Love You With Delicious & Healthy Party Food!,1863175
"Slow Cooker: Cookbook: 87 Easy Recipes - Simple to Follow: Food, Recipes, Cooking, Eating and Enjoying (Meals For Your Crock Pot, Meals For Your Slow Cooker, ... Loss Slow Cooker, Slow Cooker Recipes)",295417
Mediterranean Diet For Beginners: Fast and Easy Mediterranean Diet Cookbook and Home Recipes for Weight Loss with Finished Meal Pictures,482422
"The Essential Keto Diet  for Beginners: 5-Ingredient Affordable, Quick & Easy Ketogenic Recipes & Lose Weight, Cut Cholesterol & Reverse Diabetes & 7-Day Keto Meal Plan",1484680
Prediabetes Diet: A Simple Guide to Getting Healthy and Reversing,1503907
"Electric Smoker Meat Recipes: Smoke Chicken & Turkey Like a Pro (with pictures, complete guide, tips and tricks, temperature control, wood pairing, brines ... recipes included) (Poultry Recipes Book 1)",1371116
Paleo Bacon Cookbook: Lose Weight * Get Healthy * Eat Bacon (Paleo Kitchen Series Book 1),1946972
Season's Eatings!: Stress-Free Cooking & Baking for the Holidays,1835681
"Electric Smoker Meat Recipes: Complete Guide, Tips & Tricks, Essential TOP recipes including Beef, Pork & Lamb (with pictures) by Francis Wood",1813781
The Bread Baking Cookbook: 50 Tasty New Recipes for Beginners | Artisan Handcrafted Keto Gluten-Free Five Minutes a Day and More,160504
"Paleo Diet: The Paleo Sugar Addict Festive Cookbook: Reverse Diabetes, Sugar Free, Gluten Free, Grain Free, Delicious Paleo Meals and Treats, Anti Inflammatory",2100813
"The 7 Secrets of Healthy Happy People: Improve Your Mood, Emotions, Energy, Weight, and Life!",1469369
Instant Pot Cookbook & 2020: 101 Foolproof Reciреs fоr Beginners аnd Аdvаnced Users,1980072
Christmas Cookies: Reference to Go: 50 Delicious Holiday Confections (Epicurean Delights),1456266
"Anti Inflammatory: Best Holiday Paleo Keto Cupcake Recipes: Divine Tastes and Flavours, Celebrate this Festive Season, Irresistible Recipes",983548
Easy Baking: 50 Quick And Easy Bread Recipes For Beginners. The Complete Homemade Pastry Bible,68686
BREAKFAST IN AN INSTANT COOKBOOK: Quick & Modern Breakfast Recipes For Your Electric Pressure Cooker & Instant Pot With Beginners Guide.,835509
Easy Baking: 75 Quick And Easy Pies Recipes For Beginners. The Complete Homemade Pastry Bible.,327487
Instant Pot for Two Cookbook: Easy and Healthy Instant Pot Recipes Cookbook for Two,30022
Instant Pot Cookbook: 550 Simply Delicious Everyday Recipes for Your Instant Pot Pressure Cooker (Plus Pictures),466548
"Slow Cooker: Weight Loss: 250 Healthy, Delicious, Easy Diet Recipes to Lose Weight (Slow Cooker Weight Loss Series Book 1)",563774
Fixin' to Eat: Southern Cooking for the Southern at Heart (Cooking Squared Book 4),148473
Paleo Cravings: Your Favorite Comfort Foods Made Paleo,1949807
"Air Fryer Cookbook for Beginners: Easy, Healthy & Low-Carb Recipes That Will Help Keep You Sane",1366815
"TOP 50 Most Delicious Christmas Recipes: A Stunning Collection of Some of the Most Mouthwatering Christmas Meals & Treats (christmas books 2019, christmas recipes for parties, christmas recipes)",271061
Paleo Holiday Recipe Bundle: Paleo Diet and Cookbook,2088512
Air Fryer Cookbook for Beginners: 1001 Day Quick & Easy Recipe Book #2020: Healthy Meals for Newbies and Advanced Users with Keto Air Fryer Recipes,118756
Kosher Recipe Book for Purim & More: 10 easy and delicious dairy free baking recipes (Mediterranean Diet Recipes 1),406000
"250 Paleo - Keto Festive Recipes: Keeping Your Holiday and Festive Feasts Happy, Healthy and Wholesome",1649280
Homemade Holidays: 25 Holiday Sweets & Treats,2260932
"Slow Cooker: Gluten Free: 80 Gluten Free, Healthy, Delicious, Easy Recipes: Cooking and Recipes for Weight Loss and Healthy Living (Slow Cooker Weight Loss Series Book 4)",1424549
"Fruitcake: Memories of Truman Capote and Sook: Memories of Truman Capote & Sook (Hill Street Classics,)",1744000
"Air Fryer Cookbook for Beginners: Keto Friendly, No Wheat, No Gluten Air Fryer Recipes for Everyday Healthy Eating Habits (air fryer ninja, air fryer bible)",711382
Cooking with the Lodge Cast Iron Skillet Cookbook: Essential Family Meals and My Easy at Home Non Stick Comforting Stovetop Oven Pan Recipes to Enjoy (Best Cast Iron Cooking Book 1),54231
Mediterranean Diet: Mediterranean Diet Cookbook: Mediterranean Diet for Beginners: 30 Days Meal Plan For Rapid Weight Loss: 45 Mediterranean Diet Healthy ... Mediterranean Diet For Beginners Book 1),1684145
"Beginners Wood Pellet Smoker and Grill Cookbook: Complete Recipes and Techniques Smoker Cookbook for Grilling, Smoking and Ultimate BBQ (2019)",2114529
"Easy Baking: 75 Quick And Easy Desserts Recipes For Beginners: Cheesecakes, Pies, Muffins, Cupcakes, Cookies, Brownies and More. The Complete Homemade Pastry Bible",637450
Christmas Cookbook 2020: A Magnificent Collection of the Most Delicious Christmas Dishes and Treats,1522354
"Festive Cookbook: Festive Dessert Recipes: Paleo Keto, 50 Dessert Recipes for the Paleo Diet, Gluten Free, Healthy Eating, Quick and Easy Paleo recipes",1685090
Top 50 Most Delicious Christmas Recipes (Holiday Recipes Book 3),992279
"Ketogenic Diet: Lose Up to 20 Pounds, 4 Inches and Restore Overall Health! -- in 21 Days ( New Research, New Recipes )",823995
Simple Christmas Recipes,3220026
"Vegan Meal Prep Ideas: The Starter Kit for Vegetarian Keto Life, Weight Loss Solution with Cookbook and Recipes. Veganism with Ketogenic Diet Approach and Plant Based Diet with Whole Food.",2901030
"WE GATHER TOGETHER...holiday feasts with the family you have!: Notes on contemporary food culture, menu plans, and delicious recipes to help everyone feel welcome!",2916636
"Christmas Slow Cooker Recipes: The Simple Guide to Holiday Slow Cooker Appetizers, Snacks and Desserts (Easy Recipes)",2326133
Egg CookBook - 50 Delicious & Tasty Poultry Egg Recipes,3929241
Christmas Dinner: (Quick & Easy Ever) Christmas Cookbook Holiday Cookbook Party Planning (Holiday Dinner 1),3920633
Christmas Slow Cooker Recipes: The Simple Guide to Holiday Slow Cooker Main and Side Dishes (Easy Recipes),3142637
"Anti Inflammatory: Gluten Free Holiday Cookbook: Best Paleo Pasta and Desserts Ever, Lose Weight, Healthy Eating, Quick and Easy Paleo recipes,",2279439
"Keto Diet Guide Cookbook for Beginners: Your ultimate and essential 2020 guide/cookbook for women, busy or lazy people to weight loss. Clean your dirty ... with meal plans and 7-Day no-Cook Meal Plan",2508140
"Green smoothie: Everyday Green Smoothie For Beginners(Green Smoothies, Green Smoothie Recipes, Green Smoothie Cleanse, Green Smoothie Diet, Green Smoothie ... Juice) (healthy food for everyday Book 9)",2637852
Keto Diabetic Diet Cookbook: A Kickstart Guide for Living Well with Type 2 Diabetes,2418931
Janette Oke's Reflections on the Christmas Story,3060389
"Dukan Diet: The Ultimate Dukan Diet Guide How to Lose Wight Quickly, Burn Belly Fats & Feel Great Using Dukan Plan Starting Today",3869428
The Dash Diet For Beginners: Includes Extensive 7-Day Meal Plan With Different Calorie Levels for Weight Loss,2876461
Camille Glenn's Old-Fashioned Christmas Cookbook,3005520
COOK TASTY HOLIDAY: VEGAN AND GLUTEN-FREE! THE BEST RECIPES FOR THE FAMILY,2993276
Low Carb and Paleo Christmas - Healthy Easy Recipes: Based on the 12 days of Christmas,3259002
COPYCAT RECIPES: Cookbook on How to Make Cracker Barrel Restaurant's Popular Recipes at Home. OVER 80 RECIPES (Famous Recipes 1),252979
"Instant Pot Cookbook for Two: Easy, Healthy and Fast Instant Pot Pressure Cooker Recipes That Will Blow Your Mind",76009
Little Flower: Recipes from the Cafe,146019
"Crust: From Sourdough, Spelt and Rye Bread to Ciabatta, Bagels and Brioche",231364
THE ESSENTIAL INSTANT POT RECIPES FOR BEGINNERS: Easy & Most Delicious Foolproof Recipes for Your Whole Family with Beginners Guide (Electric Pressure Cooker Cookbook) (Instant Pot Cookbook).,256497
The Bread Baking Cookbook: A Step-by-Step Guide to Making No-Knead Bread at Home,88182
English Teatime Treats: Delicious Traditional Recipes Made Simple,115371
Bread Machine Cookbook: Delicious Recipes for Homemade Bread (Bread Maker Recipes & Bread Machine Recipes),203426
Ebelskivers: Danish-Style Filled Pancakes And Other Sweet And Savory Treats,197270
Brunch at Bobby's: 140 Recipes for the Best Part of the Weekend: A Cookbook,162137
Wood Pellet Smoker and Grill Cookbook: The Ultimate Guide with the Best Barbeque Secrets. Techniques and Recipes for Smoking and Grilling as a Grill Master,169193
"Instant Pot Mini Cookbook: Learn How to Master Your Instant Pot Mini. Must-Have, Easy and Healthy Instant Pot Recipes that Put Your Pressure Cooker to Work",79528
"Infuse: Herbal teas to cleanse, nourish and heal",184640
Cheese Making: The Beginners Guide To Making Cheese In Your Own Home,134961
Great British Bake Off  Bake it Better (No.1): Classic Cakes,168951
"The Anti-Inflammatory Diet Cookbook: How to Reduce Inflammation Naturally: Top 15 Anti-Inflammatory Foods. Easy, Healthy and Tasty Recipes That Will Make You Feel Better Than Ever",19984
The Delicious Breakfast Club: 27 Delectable Breakfast Recipes you shouldn't miss out on,180798
"Time to Eat: Delicious, time-saving meals using simple store-cupboard ingredients",119058
"Tea A Recipe and Guidebook Quick and Easy to Make Tea Recipes That Are Nutritious, Relaxing, and Energizing: Includes Recipes for: Black, Green, White, Oolong and Herbal Teas",138773
"Roasting, Brewing and More: How to Enjoy Coffee Beyond your Morning Routine",239794
Coffee Cakes and Pound Cakes (Delicious Recipes Book 18),183598
National Trust Book of Scones: Delicious recipes and odd crumbs of history,246656
The Most Delicious Donut Recipes: Make Every Donut You've Ever Dreamed of Right in The Comfort of Your Home,123871
Quick Lunch in a Brown Bag: Lightning Fast Lunch Recipes for The Busy Worker,254082
Foodi  Multi-Cooker Keto Cookbook: The Complete Guide to Keto Foodi Multi-Cooker Diet | Pressure Cooker and Air Fry | Delicious & Easy Low Carb Recipes to Lose Your Weight Fast and Never Let It Back,200437
Onigiri with a Twist Cookbook: Modern Onigiri Recipe Twists,269413
"Natural Liver Cleanse Recipes: Liver cleanse juices, liver cleanse tea, Liver cleanse soup, fatty liver cleanse, liver cleanse smoothie and liver cleanse vegan recipes",195537
The Bread Machine Cookbook: Fuss-Free Recipes for Making Homemade Bread with Any Bread Maker,40563
Tea Sandwiches: The Delicate & Delicious Tea Sandwich Cookbook,73469
Bowls of Goodness: Vibrant Vegetarian Recipes Full of Nourishment,182213
All Ages Doughnut Cookbook: The Most Delicious and Sweet Doughnut Recipes,230563
Sunday Casseroles: Complete Comfort in One Dish,193835
Vintage Tea Party Style Guide: High Tea Recipes and Planning Guides For Six Unique High Tea Party Events,270575
"Foolproof Air Fryer Recipes: The Best 50 Recipes for Your Air Fryer. Cook Simple, Delicious, and Healthy Everyday",187665
"Apple Desserts: Every recipe has space for notes, Dumplings, Crisps, Cake, Assorted recipes",240200
I Hate Vegetables Cookbook: Fresh and Easy Vegetable Recipes That Will Change Your Mind (Cooking Squared Book 1),97698
Comfort: food to soothe the soul,164005
"Nadiya’s Family Favourites: Easy, beautiful and show-stopping recipes for every day from Nadiya's BBC TV series",67587
Instant Pot Pressure Cooker Cookbook: 575 Recipes To Cover All The Basics And Cook Healthy Meals (Instant Pot Duo Cookbook),55071
The Ritz London: The Cookbook,237858
"Omelets, Quiches & Egg Casseroles: Main Dish Recipes For Breakfast, Brunch, Lunch & Dinner! (Southern Cooking Recipes Book 11)",94184
Betty Crocker: The Big Book of One-Pot Dinners (Betty Crocker Big Books),184263
"Crock Pot Cookbook for Beginners: 600 Quick, Easy and Delicious Crock Pot Recipes for Everyday Meals | Foolproof & Wholesome Recipes for Every Day 2020",179242
"Huckleberry: Stories, Secrets, and Recipes From Our Kitchen",91061
Tea at Downton - Afternoon Tea Recipes From The Unofficial Guide to Downton Abbey (Downton Abbey Tea Books),150572
"Keto Chaffle Recipes Cookbook for Beginners: Simple, Easy and Irresistible Low Carb and Gluten Free Ketogenic Waffle Recipes to Lose Weight, Reverse Disease, Boost Brain and Live Healthy",42061
Bread Machine Cookbook: Easy-to-Follow Guide to Baking Delicious Homemade Bread for Healthy Eating,103251
"Keto Cereal: The Ultimate Cookbook for Low Carb, Keto Breakfast Cereal to Enhance Weight Loss, Fat Burning, and Promote Healthy Living with Easy to Follow, Quick, and Delicious Recipes!",237899
Cooking with Mary Berry: Classic Dishes and Baking Favorites Made Simple,221446
Sourdough Bread Baking for Beginners: Complete Beginner's Guide. No Baking Tools. No Experience. From Sourdough Starter to Delicious Home-Made Sourdough Bread,56529
"TOP 50 Most Delicious Christmas Recipes: A Stunning Collection of Some of the Most Mouthwatering Christmas Meals & Treats (christmas books 2019, christmas recipes for parties, christmas recipes)",271061
"The Book of Donuts: The Most Delicious, Fluffiest, Mouth-Watering Donut Recipes Ever!",335424
Perfect Iced Coffee: 40 Recipes for Making Great Iced Coffee at Home,305125
The Donut Cookbook: Better than Dunkin Donuts,417633
Crave: Brilliantly Indulgent Recipes,414947
"The Best Homemade Kids' Lunches on the Planet:Make Lunches Your Kids Will Love with Over 200 Deliciously Nutritious Lunchbox Ideas - Real Simple, Real Ingredients, Real Quick! (Best on the Planet)",442821
"Hello! 175 Buttermilk Recipes: Best Buttermilk Cookbook Ever For Beginners [Fruit Pie Cookbook, Whole Wheat Bread Cookbook, Whole Grain Bread Cookbook, Healthy Bread Machine Recipes] [Book 1]",380306
Tea at Fortnum & Mason,476643
The Anne of Green Gables Cookbook,371551
Hot Dogs from Across the USA: Discover the Hottest Hot Dog Recipes,367909
Kid Chef Lunch:Healthy meal Cookbook For Kids ages 4 to 12,291545
The King of Hot Dog Cookbooks: Chef's Approved Hot Dog Recipes,445955
Tea Cakes: The Ultimate and Easy Way to Enjoy Your Evening Cup of Tea with Tea Party Cakes,474704
"Hello! 365 Macaroni Recipes: Best Macaroni Cookbook Ever For Beginners [Homemade Pasta Cookbook, Vegan Mac And Cheese Cookbook, Cottage Cheese Book, Tuna ... Recipe, Greek Salad Recipe] [Book 1]",402417
"Hello! 250 Noodle Casserole Recipes: Best Noodle Casserole Cookbook Ever For Beginners [Ramen Noodle Cookbook, Baked Pasta Cookbook, Vegetable Casserole Cookbook, Tuna Casserole Recipes] [Book 1]",400754
"KETO CHAFFLE RECIPES AND DIET COOKBOOK 2020: Complete Guide to Sweet and Savory Low Carb and Gluten-Free Ketogenic Waffle Recipes for Weight Loss, Burning Fat, Boosting Metabolism and Healthy Life",451357
"Scones (Scrumptious Scones, Simply the Best Scone Recipes Book 1)",346293
Doughnut Cookbook: Top 50 Doughnut Recipes,417827
Brunch! Recipes: An easy and delicious brunch cookbook!,344509
"Crust: From Sourdough, Spelt and Rye Bread to Ciabatta, Bagels and Brioche",313276
Scones :The Ultimate Recipe Guide,308905
"Quick-Time Homemade Bread and Pastries: Real Homemade Yeast Breads, Rolls, and Doughs Made Simple, in Less Time",294186
The Best Food Moments in Brooklyn Nine – Nine Recipe Book: Brooklyn Nine – Nine Easy Recipes Every Fan Must Try,487866
Easy and Healthy Slow Cooker Cookbook: Low-Carb Slow Cooker Recipes to Save Your Busy Weeknights,272741
Donburi Style Recipes: An Illustrated Cookbook of Complete Meal Bowl Ideas!,395033
"Dirty Lazy Keto - Lazy Keto Cookbook: The Best Complete Ketogenic Diet For Beginners: Ketogenic Cooking To Beginners, Weight Loss Success, Cookbook To Ketogenic, Ketogenic Kitchen, Diet Food List",291712
Baking Out Loud: Fun Desserts with Big Flavors: A Baking Book,300202
"How To Boil An Egg, Egg Recipes For Breakfast, Dinner And Tea!",473924
"Thinking About a Nice Brunch?: Here You Go, 31 Brunch Recipes for Grabs!",483880
Welcome to Buttermilk Kitchen,325939
Starting Your Own Coffee Shop: Opening & Running a Successful Coffee Business,443831
Giada at Home: Family Recipes from Italy and California: A Cookbook,466578
Sweet Treats Sugar Cookie: An Ultimate Sugar Cookie Recipe Book with 25 Best Sugar Cookies for Festive season,354380
Country Baking Quick Breads and Muffins (Delicious Recipes Book 13),282589
Bento Cookbook: The Bento Box Recipes You Will Love!,352844
Twist: Creative Ideas to Reinvent Your Baking,383743
A French-Canadian Style  Mother's Day Brunch Cookbook,410444
The Best Kitchen Tested Ground Beef Recipes,327613
"Bread Machine Cookbook: The Ultimate Baking Recipe Book for Easy, Tasty, Sweet and Savoury Homemade Bread, Loaves and Snacks Including Gluten Free Options!",371354
"The Real Power of Healing Herbal Teas: Simple and Delicious Tea Recipes For Detoxify, Cleansing, Energizing, Stress and Anxiety Relieving, Immune Boosting Herbal Tea Recipes with benefits",424203
COOKIES!: The Best Collection of Cookie Recipes EVER! Just for YOU!,286235
"Easy Keto Diet for Beginners: Healthy Ketogenic Appetizers, Best Keto Snacks and Treats for Busy People. (30 min ketogenic recipes, low carb snacks, quick keto snacks)",331815
"Chaffle Recipes: Keto Cookbook For Low Carb Waffles To Enhance Weight Loss, Fat Burning, And Promote Healthy Living With Easy To Follow, Quick, And Delicious Recipes!",469007
"Breakfast Ideas Super Value Pack I – 500 Recipes For Waffles, Omelets, Muffins, Smoothies, Quick Bread and More (Breakfast Ideas – The Breakfast Recipes Cookbook Collection 13)",308970
Instant Pot Cookbook: Enjoy Food and Become More Productive With the Quick & Easy Everyday Recipes for Busy People | 600 Days of Cooking With Your Instant Pot,452777
Doughnut Cookbook with Simple Instructions: Homemade Doughnuts Recipes That Will Make You Drool,319561
Great WFH Lunch Ideas: The Ultimate Guide to Awesome Lunch Recipes,385890
Sandwich: 100 Sandwich Recipes You'll Love,307353
Sandwich Press Recipes: A Complete Cookbook of Sandwich and Meal Ideas!,441430
The Breakfast Sandwich Maker Cookbook: 45 Delicious Recipes,318938
"Paleo Power Bowls: 100 Easy, Nutrient-Dense, Anti-Inflammatory Meals",114033
"FAT BOMBS: 120 SWEET AND SAVORY KETO TREATS FOR KETOGENIC, LOW CARB, GLUTEN-FREE AND PALEO DIETS (keto, ketogenic diet, keto fat bombs, desserts, healthy recipes, fat bombs cookbook, paleo, low carb)",107760
"Wired to Eat: Turn Off Cravings, Rewire Your Appetite for Weight Loss, and Determine the Foods That Work for You",108105
"Keto Ice Cream: Homemade Keto-Friendly Ice Creams, Frozen Dessert Recipes and Healthy Low Carb Treats for Ketogenic, Paleo, and Diabetic Diets (keto dessert book, easy ketogenic desserts)",105849
"Keto Bread and Keto Desserts Recipe Cookbook: Easy, Low Carb Recipes for Your  Ketogenic, Gluten-Free or Paleo Diet that Anyone Can Cook Using Simple Ingredients. ... Snacks, Ice Cream (Keto Bread and Desserts)",93880
"The Mexican Keto Cookbook: Authentic, Big-Flavor Recipes for Health and Longevity",116399
Keto for Life: Reset Your Biological Clock in 21 Days and Optimize Your Diet for Longevity,92911
"Keto Snacks: Perfect Ketogenic Fat Burner Recipes | Supports Healthy Weight Loss - Burn Fat Instead of Carbs | Formulated for Keto, Diabetic, Paleo and Low-Carb/High-Fat Diets",86039
"Paleo Baking at Home: The Ultimate Resource for Delicious Grain-Free Cookies, Cakes, Bars, Breads and More",126785
"KETOGENIC BREAD COOKBOOK: LOAVES: 35 LOW CARB KETO LOAVES TO BRIGHTEN YOUR DAY! FOR LOW CARB, KETOGENIC, PALEO, WHEAT-FREE, GRAIN-FREE AND GLUTEN FREE DIETS (bread recipes, breakfast cookbooks, keto)",41250
"Dr. Kellyann's Bone Broth Diet: Lose Up to 15 Pounds, 4 Inches--and Your Wrinkles!--in Just 21 Days",60173
"PALEO: Paleo Diet For Rapid Weight Loss: Lose Up To 30 lbs. In 30 Days (Paleo diet, Paleo diet for weight loss, Paleo diet for beginners, Diabetes diet, Ketogenic diet, Anti inflammatory diet)",103091
"Food Pharmacy: A Guide to Gut Bacteria, Anti-Inflammatory Foods, and Eating for Health",44357
"Rescue Recipes: 101 Flexible Recipes for Multiple Diets at the Same Table! (Omnivore, Paleo, Gluten-Free, Vegetarian, Vegan)! (Paleo Cookbooks Book 1)",72492
"Food: What the Heck Should I Cook?: More than 100 Delicious Recipes--Pegan, Vegan, Paleo, Gluten-free, Dairy-free, and More--For Lifelong Health",50288
Trim Healthy Mama's Trim Healthy Table: More Than 300 All-New Healthy and Delicious Recipes from Our Homes to Yours : A Cookbook,73013
"The Big 15 Paleo Cookbook: 15 Fundamental Ingredients, 150 Paleo Diet Recipes, 450 Variations",125369
"Wheat Belly: Lose the Wheat, Lose the Weight, and Find Your Path Back to Health",63562
"Danielle Walker's Against All Grain: Meals Made Simple: Gluten-Free, Dairy-Free, and Paleo Recipes to Make Anytime",102067
