The Grain Brain Cookbook: More Than 150 Life-Changing Gluten-Free Recipes to Transform Your Health,53805
"Keto Desserts Cookbook: The Complete Ketogenic Desserts Cookbook with Easy, Delicious, & Low-Carb Recipes for Weight Loss, Lower Cholesterol and Boost Energy",60127
"The Super Lazy Keto Diet for Beginners 2020: Catapult Your Weight Loss Journey into Reality with these Quick & Easy, 5-Ingredient Recipes to Prepare in Only 5 Minutes!",63358
"The Official Stupid Simple Keto Handbook: Ketogenic diet beginners guide, shopping lists, meal plans, recipes, and more!",41731
Easy Keto Dinners,58770
"Eat Happy: Gluten Free, Grain Free, Low Carb Recipes For A Joyful Life",65466
You deserve this.: Simple & Natural Recipes For A Healthy Lifestyle,31293
Keto-Green 16: The Fat-Burning Power of Ketogenic Eating + The Nourishing Strength of Alkaline Foods = Rapid Weight Loss and Hormone Balance,23757
"Easy Everyday Keto: Learn interesting and easy keto recipes, to eat tastefully, manage your weight and restore your physical condition to live healthy",44630
"Air Fryer Cookbook For Beginners In 2020: Easy, Healthy And Delicious Recipes For A Nourishing Meal (Includes Index, Some Low Carb Recipes, Air Fryer FAQs And Troubleshooting Tips) (Quick Recipes 1)",25364
Keto in an Instant: 100 Ketogenic Recipes for Your Instant Pot,47728
The Complete Diabetes Cookbook: The Healthy Way to Eat the Foods You Love,51332
"Ketotarian: The (Mostly) Plant-Based Plan to Burn Fat, Boost Your Energy, Crush Your Cravings, and Calm Inflammation: A Cookbook",45938
"Healthy Gut, Flat Stomach: The Fast and Easy Low-FODMAP Diet Plan",54441
OPTAVIA DIET INCREDIBLY EASY: The Complete Guide on How to Efficiently Use Optavia  Diet for Weight Loss Quickly Plus Recommended Foods  to eat and Avoid when on an Optavia Diet,53629
Keto Metabolic Breakthrough,57352
"Eat Rich, Live Long: Mastering the Low-Carb & Keto Spectrum for Weight Loss and Longevity",34693
"Ayuno Intermitente: 6   métodos   eficaces   para   perder   peso, fortalecer los   músculos, aumentar su metabolismo, conseguir una óptima condición cetogénica, ... la salud a todo nivel (Spanish Edition)",39536
"The Starch Solution: Eat the Foods You Love, Regain Your Health, and Lose the Weight for Good!",8213
Keto after 50: Beginners guide for women over 50 to start your ketogenic diet and reset your metabolism. Included a 7-day meal plan and a special BONUS about intermittent fasting,40011
Keto Diet for Beginners 2020-2021: 600 Foulproof Recipes for the Newbie Ketoer. The Only Cookbook You'll Need for 100% Keto Success,61876
"The DIRTY, LAZY, KETO Cookbook: Bend the Rules to Lose the Weight!",35733
Keto Meal Plan 28 Days: For Women and Men On Ketogenic Diet - Easy Keto Recipe Cookbook For Beginners,19213
The Complete Ketogenic Diet for Beginners: Your Essential Guide to Living the Keto Lifestyle,555
"Keto Diet Cookbook: 125+ Delicious Recipes to Lose Weight, Balance Hormones, Boost Brain Health, and Reverse Disease",80362
A Year of Low Carb/ Keto Fat Bombs: 52 Seasonal Recipes Ketogenic Cookbook (Sweet & Savory Recipes) (Elizabeth Jane Cookbook),104410
Mexican Keto Recipes: 50 Mexican Dishes That Are Surprisingly Keto-Friendly (Best Recipes Ever Book 1),112917
"Instant Pot Cookbook: Low-Carb, Easy and Healthy Instant Pot Pressure Cooker Recipes That Taste Incredible",80263
"Instant Pot Cookbook for Beginners: 550 Easy, Healthy and Delicious Recipes That’ll Save You So Much Time",79094
Breaking Up With Carbs: The 60-DAY Guide to STARTING & SUSTAINING KETO with Zero Will-Power,107317
Keto Friendly Recipes: Easy Keto for Busy People,65895
Keto Diet Cookbook for Women after 50: The Ultimate Guide Book Ketogenic Diet Lifestyle for Seniors.Simple Keto Recipes and 21-Day Meal Plan - Balance ... Regain Your Metabolism and Stay Healthy,87512
Easy Everyday Keto: Healthy Kitchen-Perfected Recipes,76552
Essential Keto Bread: Sweet and Savory Baked Goods to Satisfy Any Craving,86204
"Keto Diet for Beginners: The Comprehensive Guide to Ketogenic Diet for Weight Loss, Heal Your Body and Living Keto Lifestyle PLUS 70 Keto Recipes & 21-Day Meal Plan Program",104352
Keto Air Fryer Cookbook For Beginners: 550 Air Frying Recipes To Lose Weight Quick and Easy on the Ketogenic Diet (Keto Air Fryer Recipes),97680
"Keto Bread Machine Cookbook: Quick, Easy, Delicious, and Perfect Ketogenic Recipes for Baking Homemade Bread in a Bread Maker!",107148
"Ketogenic Slow Cooker Cookbook: Easy, Healthy and Fast Keto Recipes to Burn Fat, Lose Weight and Living the Keto Lifestyle",101467
Keto After 50: The Ultimate Ketogenic Diet Guide for Seniors. Includes Recipes to Reset Your Metabolism and Boost your Energy,100901
Keto in an Instant: More Than 80 Recipes for Quick & Delicious Keto Meals Using Your Pressure Cooker,95676
Keto for Life: Reset Your Biological Clock in 21 Days and Optimize Your Diet for Longevity,98803
"Keto Bread: Simple and Rapid Step by Step Low-Carb and Gluten-Free Cookbook for Ketogenic Diet (Includes Pizza, Cookies, Crusts, Muffins Bakers Recipes and more)",108763
PALEO DIET FOR BEGINNERS: THE SECRETS OF RAPID WEIGHT LOSS AND A HEALTHY LIFESTYLE USING THE PALEO DIET,97349
"The Carnivore Diet Handbook: Get Lean, Strong, and Feel Your Best Ever on a 100% Animal-Based Diet (with meal plans, keto recipes, and smart tips to start)",86483
"Nutribullet Soup Recipe Book: Low Carb Nutribullet Soup Recipes for Weight Loss, Detox, Anti-Aging & So Much More! (Recipes for a Healthy Life Book 3)",96554
"Keto for Women Over 50: The Beginner’s Guide With Recipes to Ketogenic Diet for Senior Women, Burn Fat, Diabetes Prevention and Easy Exercises for Boost Energy and Regain Body Confidence",108140
"Keto Ice Cream: Homemade Keto-Friendly Ice Creams, Frozen Dessert Recipes and Healthy Low Carb Treats for Ketogenic, Paleo, and Diabetic Diets (keto dessert book, easy ketogenic desserts)",113937
DASH Diet for Dummies: 56 Easy Recipes for a 14-Day Diet Meal Plan to Lose Weight and Get Healthy (DASH Dieting Book 1),89331
"The Basic Keto Cookbook For Beginners On A Budget: 800 Days of Quick, Easy and Healthy Ketogenic Diet Recipes (Ketogenic Diet Books For Beginners 1)",94695
Fat Kid Keto: Indulgent Low Carb Recipes For The Whole Family,101773
"Keto Bread: From Bagels and Buns to Crusts and Muffins, 100 Low-Carb, Keto-Friendly Breads for Every Meal",98130
"Keto Clarity Cookbook: Your Definitive Guide to Cooking Low-Carb, High-Fat Meals",119319
The Keto Vegan: 14-Day Ketogenic & Intermittent Fasting Meal Plan (With 51 Tasty Low-Carb Plant-Based Recipes) (The Carbless Cook Book 7),69329
Low Carb Yum 5-Ingredient Keto: 120+ Easy Recipes,84360
Rocco's Keto Comfort Food Diet: Eat the Foods You Miss and Still Lose Up to a Pound a Day,87212
The Affordable Keto Meal Prep Cookbook 2020: 5-Ingredient Quick & Easy Budget Friendly Meal Prep Recipes on the Ketogenic Diet,70879
"Keto Chaffles Cookbook: Simple, Sweet and Savory Low Carb Chaffles to Boost Fat Burning and And Reverse Disease",73948
Journey to Health: A Journey Worth Taking: Cooking Keto with Kristie (Kindle edition),100970
"The Keto Vegetarian: 84 Delicious Low-Carb Plant-Based, Egg & Dairy Recipes For A Ketogenic Diet (Nutrition Guide) (The Carbless Cook Book 1)",116553
30 Minute Ketogenic Cooking: 50+ Mouthwatering Low-Carb Recipes to Save You Time and Money,115917
KETO FOR WOMEN OVER 50: The Simplified Guide to A Ketogenic Diet Lifestyle For Women Over 50 | Lower Your Triglycerides Effectively With A Gentler Approach,116269
Lunch in Five: 30 Low Carb Lunches. Up to 5 Net Carbs & 5 Ingredients Each! (Keto in Five Book 2),86040
The 5-Ingredient Low-Carb Diet Cookbook: 100 Easy Recipes for Better Health,66469
"Homemade Keto Soup Cookbook: Fat Burning & Delicious Soups, Stews, Broths & Bread (Elizabeth Jane Cookbook Book 13)",99921
"Danielle Walker's Against All Grain: Meals Made Simple: Gluten-Free, Dairy-Free, and Paleo Recipes to Make Anytime",105414
Bone Broth Miracle Diet Instant Pot Cookbook: An Ancient Health & Beauty Remedy Made Easy & Delicious,65706
Cast Iron Keto: 75 Low-Carb One Pot Meals for the Home Cook,92090
"Carnivore Diet Box Set: The Carnivore Diet Handbook, Carnivore Diet Intermittent Fasting, and the Frugal Carnivore Diet",106705
Keto Diet for Beginners: 30-Day Keto Meal Plan for Rapid Weight Loss. Ketogenic Meal Prep Cookbook Full of Easy to Follow Recipes! Lose up to 20 Pounds in 30 Days! (Keto Diet for Beginners),91182
The Paleo 30-Day Challenge: A Paleo Cookbook to Lose Weight and Reboot Your Health,87868
"Easy Keto Desserts: 60+ Low-Carb, High-Fat Desserts for Any Occasion",111923
"Keto For Women Over 50: A Complete Guide to Keto Diet for Senior Women to Regulate Metabolism, Burn Fat, Lose Weight Healthily, Prevent Diabetes and Balance Hormones, Including Ketogenic Recipes",67476
"The 30-Day Carnivore Meal Plan: Your Day-by-Day 30-Day Guide Book to Eating Well, Looking Amazing, and Feeling Great on the Carnivore Diet",104022
"BARIATRIC COOKBOOK: 250+ Delicious Recipes for All Stages After Bariatric Surgery. All Recipes You Need in One Book! CLEAR LIQUIDS, THICKER LIQUIDS, SOFT PUREED and REGULAR FOOD",72806
THE SIRT FOOD DIET: A Beginner’s Guide For Weight Loss Without Eating Less Activate Your Skinny Gene To Burn Fat And Get Lean With The Help Of Easy And Fast Recipes,281488
Ketogenic Diet: The Complete How-To Guide For Beginners: Ketogenic Diet For Beginners: Ketogenic Cookbook: Keto Diet: The Complete How-To Guide For Beginners,407433
Olive Trees and Honey: A Treasury of Vegetarian Recipes from Jewish Communities Around the World,226217
"Hello! 365 Drop Cookie Recipes: Best Drop Cookie Cookbook Ever For Beginners [White Chocolate Cookbook, Macaroon Cookies Cookbook, Pumpkin Dessert Cookbook, Peanut Butter Cookie Recipe] [Book 1]",362343
"The Super Lazy Keto Diet for Beginners 2020: Catapult Your Weight Loss Journey into Reality with these Quick & Easy, 5-Ingredient Recipes to Prepare in Only 5 Minutes!",63358
The Sirtfood Diet: Beginner’s cookbook with easy and healthy recipes to activate your skinny gene and burn fat. This book will help you to lose weight fast and improve your life,103100
The Second Avenue Deli Cookbook: Recipes and Memories from Abe Lebewohl's Legendary Kitchen,158946
Delicious German Meals: The Only German Cookbook You Need,187821
"Sababa: Fresh, Sunny Flavors From My Israeli Kitchen: A Cookbook",124662
The SirtFood Diet: Learn how to Activate your Skinny Gene and Get Lean Fast. A Complete Beginner's Guide to Smart Weight Loss with Delicious and Healthy Recipes.,155189
Feed Me Bubbe: Recipes and Wisdom from America's Favorite Online Grandmother,84710
Miriam's Kitchen: A Memoir,377154
"Starter Sourdough: A Step by Step Guide to Make and Maintain Your Own Sourdough Starters, and use them for Making Tasty Bread, Loaves, Baguette, Pancakes, Pizza, and Other Delicious Baked Goods",233902
"Keto Diet In 10 Easy Steps: A Quick Start Guide: Streamlined Guide On How To Stat The Keto Diet Quickly, Very Easy To Follow, Straight To The Point",308393
Israel Eats,14796
Secrets of a Jewish Baker: Recipes for 125 Breads from Around the World [A Baking Book],415468
"Modern Jewish Baker: Challah, Babka, Bagels & More",359304
Jack's Wife Freda: Cooking From New York's West Village,387915
The Complete Keto Diet Cookbook For Beginners 2019: Quick And Simple Ketogenic Recipes For Smart People | Lose Weight And Become Healthy With The Keto Diet,244412
Nosh on This: Gluten-Free Baking from a Jewish-American Kitchen,286842
"Hello! 365 Jewish Recipes: Best Jewish Cookbook Ever For Beginners [Challah Cookbook, German Jewish Cookbook, Italian Jewish Book, Chicken Breast Recipe, ... Potato Book, Passover Recipes] [Book 1]",410222
The Art of Jewish Cooking: A Cookbook,274020
Dieta Cetogénica: El Keto Recetario Paso a Paso Para Alcanzar la Cetosis : Fáciles y Deliciosas Recetas Cetogénicas Para Pérdida de Peso Efectiva y Mejor ... | Spanish Book Version (Spanish Edition),259542
"The Children's Jewish Holiday Kitchen: A Cookbook with 70 Fun Recipes for You and Your Kids, from the Author of Jewish Cooking in America",217926
"Joy of Kosher: Fast, Fresh Family Recipes",294964
The 100 Most Jewish Foods: A Highly Debatable List,358782
"Keto Diet for Beginners: Essential Guide to Ketogenic Diet for Weight Loss, Body Healing and Happy Lifestyle. 57 Delectable Low-Carbohydrate Easy Recipes and a 21-Day Meal Plan (Сookbook)",379418
Braided: A Journey of a Thousand Challahs,261232
"The Brisket Chronicles: How to Barbecue, Braise, Smoke, and Cure the World's Most Epic Cut of Meat",150614
"Copycat Recipes: A COMPLETE Step-by-Step Cookbook Guide to make Italian Most Popular Restaurants Recipes at Home ( Olive Garden, Maggiano's Little Italy, Carrabba's Italian Grill, Romano's Grill )",64018
Air Fryer Cookbook for Beginners: 1001 Day Quick & Easy Recipe Book #2020: Healthy Meals for Newbies and Advanced Users with Keto Air Fryer Recipes,129686
"Intermittent Fasting for Women Over 50: The Complete Guide to Weight Loss, Increase Longevity and Balance Your Hormones Eating the Foods You Love",154114
The Bagel: The Surprising History of a Modest Bread,42472
The Essential Middle Eastern Cookbook: Classic Recipes Made Easy,124983
Ottolenghi: The Cookbook,272076
"Israeli Cookbook: 65 of the Best, Beginner-Friendly, Delicious, Easy-to-Follow, and Ingredient-Accessible Recipes in Israeli Cuisine",135352
The German-Jewish Cookbook: Recipes and History of a Cuisine (HBI Series on Jewish Women),189007
The Rye Baker: Classic Breads from Europe and America,261896
"On the Chocolate Trail: A Delicious Adventure Connecting Jews, Religions, History, Travel, Rituals and Recipes to the Magic of Cacao (2nd Edition)",285450
The Artisan Jewish Deli at Home,133079
The Complete Air Fryer Cookbook: 550 Effortless Air Fryer Recipes for Beginners and Advanced Users. Discover How to Change your Eating Routine with a better ... Plan (Air Fryer cookbook for Beginners 1),44852
"The Plant-Based Diet for Beginners: Under $20 a Week Meal Plan for People on a Budget | With Pictures, Shopping Lists + Bonus Weight Loss Action Plan",382337
"Israeli Soul: Easy, Essential, Delicious",245792
Plant-Based Diet Cookbook 2020: The Ultimate Guide for Beginners with 800 Delicious Whole Food Recipes and 21-Day Plant-Based Meal Plan,223763
Kosher Recipe Book for Purim & More: 10 easy and delicious dairy free baking recipes (Mediterranean Diet Recipes 1),415710
Foodie Grill Cookbook for Beginners: 1001 Recipe Foodie Grill Cookbook & Air Fryer Day Plan: Cook Quick and Easy Recipes Like a Ninja: Indoor Grilling and Air Frying for Newbies and Advanced Users,151547
Eat Something: A Wise Sons Book for Jews Who Like Food and Food Lovers Who Like Jews,392892
"Healthy Smoothie Recipes: Lose Weight, Cleanse your Body and Boost your Immune System with Easy Smoothie Recipes (smoothie bowls recipes)",26511
"Hello! 365 Potato Side Dish Recipes: Best Potato Side Dish Cookbook Ever For Beginners [Vegan Casserole Cookbook, Baked Potato Cookbook, Mashed Potato Cookbook, Sweet Potato Vegan Cookbook] [Book 1]",277414
Bubbe and Me in the Kitchen: A Kosher Cookbook of Beloved Recipes and Modern Twists,315073
Keto Diet for Beginners: 2 Books in 1: Home Recipes & Bread Baking. A Guide to Resetting Your Metabolism with a Practical Approach to a Ketogenic Lifestyle in 2020 to Heal Your Body and Shed Weight,673796
"Keto Dessert Cookbook 2020: Best Keto-Friendly and Delicious Low Carb and High Fat Ketogenic Sweet Treat Recipes for Fat Burning, Energy Boosting and Disease Reversal",706914
Instant Pot Air Fryer Lid Cookbook for Beginners: fast and easy recipes with low carbohydrate content for a healthy but tasty diet! discover how to change ... better meal plan (The complete Air Fryer 1),539118
Sephardic Baking from Nona and More Favorites: A Collection of Recipes For Baking Desayuno And More,618465
Israel Style Recipes: A Complete Cookbook of Middle-Eastern Dish Ideas!,593564
Balaboosta,569710
My Yiddishe Mama: A Collection of Heritage Recipes and Haimishe Stories from South Africa's Yiddishe Mamas,605417
Encyclopedia of Jewish Food,525922
"Hello! 350 Garbanzo Bean Recipes: Best Garbanzo Bean Cookbook Ever For Beginners [Hummus Recipe, Roasted Vegetable Cookbook, Chickpea Recipes, Tuna Salad ... Slow Cooker Beans Cookbook] [Book 1]",663364
"Hello! 365 Sugar-Free Recipes: Best Sugar-Free Cookbook Ever For Beginners [Roasted Vegetable Cookbook, Sugar Free Vegan Cookbook, Roast Dinner Cookbook, Sugar Free Cookies Cookbook] [Book 1]",714142
Modern Jewish Cooking: Recipes & Customs for Today's Kitchen,523721
Bread Machine Cookbook: Bread Machine Recipes for Baking Perfect Homemade Bread with Different Flavors and Ingredients,416263
German Cookbook: Traditional German Dishes for The Home Cook,479317
"Mama Nazima's Jewish Iraqi Cuisine: Cuisine, History, Cultural References and Survival Stories of the Jewish-Iraqi",578505
"Air Fryer Cookbook #2020: More than 75 Easy Recipes to Bake, Grill, Fry, and Roast with Your Air Fryer",727565
King Solomon's Table: A Culinary Exploration of Jewish Cooking from Around the World: A Cookbook,601148
Rhapsody in Schmaltz: Yiddish Food and Why We Can't Stop Eating It,727694
Homemade Pastrami and To-Die-For Corned Beef,537866
Modern Sourdough:Sweet and Savoury Recipes from Margot Bakery,477238
Sababa Cookbook: The Israeli Soul Cookbook (The kosher cookbook with the best of israeli recipes from Middle Eastern and Mediterranean Food),489387
"Hello! 100 Cajun Vegetarian Recipes: Best Cajun Vegetarian Cookbook Ever For Beginners [Best Cajun Cookbook, Cajun Vegan Cookbook, Cajun Seafood Cookbook, Healthy Cajun Cookbook] [Book 1]",453101
Food of Israel: Authentic Recipes from the Land of Milk and Honey (Food Of The World Cookbooks),659734
Cherish: Food to make for the people you love,706976
Keto Bread Cookbook of Your Dream: Making Low Carb Bread the Right Way,686527
"Hello! 365 Caramel Recipes: Best Caramel Cookbook Ever For Beginners [Pecan Cookbook, Cake Fillings Cookbook, Easy Cheesecake Recipe, Dark Chocolate Cookbook, White Chocolate Cookbook] [Book 1]",416099
"Keto For Women Over 50: The Complete Guide to a Ketogenic Lifestyle for Senior Women: for a Healthy Weight Loss, Diabetes Prevention, Hormones Balance and Promote Longevity with a Gentler Approach.",533405
"Hello! 365 Oatmeal Cookie Recipes: Best Oatmeal Cookie Cookbook Ever For Beginners [Cranberry Cookbook, White Chocolate Cookbook, Macaroon Cookies Cookbook, Shortbread Cookie Recipe] [Book 1]",691785
A Drizzle of Honey: The Life and Recipes of Spain's Secret Jews,454355
AIR FRYER COOKBOOK: 550 Easy & Delicious Air Fryer Recipes for Smart and Busy People,701690
"Artisan Bread: A Complete Beginner’s Cookbook for Delicious Homemade Bread. Bake Loaves, Baguettes, Bagels, and Pizza with Easy, Step-by-Step Recipes that will Blow Your Mind!",491563
Keto Diet for Beginners: 10 simple keys to Success. Easy and Healthy Everyday Ketogenic Diet Recipes to Reset Your Body and Live a Healthy Life,667833
The Easy Anti-Inflammatory Diet Cookbook: Satisfying Menu Plan with Top Natural Foods to Reduce Inflammation and Make You Feel Fantastic,422448
The SirtFood Diet: Learn how to Activate your Skinny Gene and Get Lean Fast. A Complete Beginner's Guide to Smart Weight Loss with Delicious and Healthy Recipes.,537197
Inside the Jewish Bakery: Rye & Other Breads,582651
Yemek. The Tasty Turkish Cookbook: 65 Delicious and Easy Mediterranean Recipes for Your Family (Mediterranean Diet Recipes Book 2),632050
Traditional Jewish Baking: Retro Recipes Your Grandma Would Make… If She Had a Mixer,643848
"Inside the Jewish Bakery: Bagels, Rolls & Bialys",540834
"Un-Junk Your Diet: How to Shop, Cook, and Eat to Fight Inflammation and Feel Better Forever",613302
"Hello! 123 Root Vegetable Recipes: Best Root Vegetable Cookbook Ever For Beginners [Beet Recipe Book, Roasted Vegetable Cookbook, Pickled Vegetables Recipe Book, Pickling Cookbook] [Book 1]",722736
"Hello! 365 Pear Recipes: Best Pear Cookbook Ever For Beginners [Easy Juicing Recipes, Hand Pie Recipes, Asian Salad Cookbook, Fruit Pie Book, Pie Tart ... Homemade Salad Dressing Recipes] [Book 1]",727543
The Simply Kosher Cookbook: 100+ Recipes for Quick Weeknight Meals and Easy Holiday Favorites,455810
The William Greenberg Desserts Cookbook: Classic Desserts from an Iconic New York City Bakery,707498
The Deli Maven's Cookbook,553837
"The Anti-Inflammatory Diet Guide for Beginners: Reduce Inflammation Naturally, Boost Your Immune System with the Right Foods and Change Your Life Easily",641583
"A Jewish Baker's Pastry Secrets: Recipes from a New York Baking Legend for Strudel, Stollen, Danishes, Puff Pastry, and More",428479
Plant-based Diet Cookbook for Beginners: Simple and Easy Plant-Based Meal Plan Whole Foods Recipes for Weight Loss (A 3-Week Kick-Start Guide for Healthy Eating),581601
Air Fryer Cookbook: The Top 700 Quick and Easy Recipes For Healthy Oil Free Living (The Air Fryer Series),654661
Aromas of Aleppo: The Legendary Cuisine of Syrian Jews,553375
Sous Vide for Everybody Cookbook 2019: Healthy Eating Meal Prep for Effortless Cooking at Home (sous vide better home cooking),536774
The New Yiddish Kitchen: Gluten-Free and Paleo Kosher Recipes for the Holidays and Every Day,497367
The Complete Ketogenic Diet for Beginners: Your Essential Guide to Living the Keto Lifestyle,555
"Vegan for Everybody: Foolproof Plant-Based Recipes for Breakfast, Lunch, Dinner, and In-Between",60405
"The Complete Keto Guide for Beginners after 50: Ketogenic Diet for Weight Loss Fast and Easy, Reset your Metabolism and Stay Healthy. Cookbook with Tasty ... Men and Women Over 50. (Diet for healthy 1)",38589
The Complete Diabetes Cookbook: The Healthy Way to Eat the Foods You Love,51332
"The DIRTY, LAZY, KETO Cookbook: Bend the Rules to Lose the Weight!",35733
Keto-Green 16: The Fat-Burning Power of Ketogenic Eating + The Nourishing Strength of Alkaline Foods = Rapid Weight Loss and Hormone Balance,23757
Keto Cookies: Low Carb Keto Cookie Recipes That Are Ideal For Snacks or Desserts Whilst Following The Ketogenic Diet!,42923
"Keto Desserts Cookbook: The Complete Ketogenic Desserts Cookbook with Easy, Delicious, & Low-Carb Recipes for Weight Loss, Lower Cholesterol and Boost Energy",60127
Keto Diet Cookbook After 50: The Ultimate Ketogenic Diet Guide for Seniors | 28-Day Meal Plan | Lose Up To 20 Pounds In 3 Weeks,64713
"The Super Easy Keto Air Fryer Cookbook for Beginners on a Budget: 500 Quick & Easy, Low Carb Air Frying Recipes for Busy People on Ketogenic Diet | Bake, ... Roast & Fry Crispy Delicious Keto Meals",51933
The Complete Keto Diet for Beginners: Your Essential Ketogenic Diet Guide to Live Keto lifestyle on a Budget,55859
"Keto Copycat Recipes: Delicious, Quick, Healthy, and Easy to Follow Cookbook For Making Your Favorite Restaurant Dishes At Home The Ketogenic Way!",13543
Keto Meal Plan 28 Days: For Women and Men On Ketogenic Diet - Easy Keto Recipe Cookbook For Beginners,19213
The Dubrow Keto Fusion Diet: The Ultimate Plan for Interval Eating and Sustainable Fat Burning,22874
"The Official Stupid Simple Keto Handbook: Ketogenic diet beginners guide, shopping lists, meal plans, recipes, and more!",41731
The Keto Instant Pot Cookbook: Ketogenic Diet Pressure Cooker Recipes Made Easy and Fast,26661
"Keto Diet After 50: The Complete Ketogenic Diet Guide for Seniors to Lose Weight, Boost Energy, Prevent Diseases and Stay Healthy. Includes Delicious 5-Ingredient Keto Recipes",29040
"KETOGENIC BREAD COOKBOOK: LOAVES: 35 LOW CARB KETO LOAVES TO BRIGHTEN YOUR DAY! FOR LOW CARB, KETOGENIC, PALEO, WHEAT-FREE, GRAIN-FREE AND GLUTEN FREE DIETS (bread recipes, breakfast cookbooks, keto)",45049
Keto Bread: Easy Ketogenic Diet Low-Carb Gluten Free Artisan Bread Recipes (Bread Baking Cookbooks Book 2),26093
The Mexican Keto Cookbook: 50 Easy Mexican Keto Recipes For Beginners. Add Some Spicy To Your Diet And Prepare To Lose Your Weight Fast,58279
"The Ultimate Keto Meal Prep: A Complete Keto Diet Guide Cookbook for Beginners, 600 Affordable and Delicious Ketogenic Recipes, 28 Days Keto Challenge for Weight Loss & Saving Time",18469
Keto Quick Start: A Beginner's Guide to a Whole-Foods Ketogenic Diet with More Than 100 Recipes,41871
Keto Cleanse: 14-Day Plans to Reset with a Clean Ketogenic Diet,57648
The Keto Reset Diet: Reboot Your Metabolism in 21 Days and Burn Fat Forever,37223
Keto Diet Cookbook for Beginners: 500 Simple and Healthy Ketogenic Recipes That Will Make Your Life Insanely Easy,28820
The Wholesome Yum Easy Keto Cookbook: 100 Simple Low Carb Recipes. 10 Ingredients or Less,39920
"Keto Chaffle Recipes Cookbook for Beginners: Simple, Easy and Irresistible Low Carb and Gluten Free Ketogenic Waffle Recipes to Lose Weight, Reverse Disease, Boost Brain and Live Healthy",45391
Keto Diet for Beginners 2020-2021: 600 Foulproof Recipes for the Newbie Ketoer. The Only Cookbook You'll Need for 100% Keto Success,61876
"Keto Diet After 50: Ultimate Keto Cookbook for People Over 50 with Easy Recipes & Meal Plan - Regain Your Metabolism and Lose Weight, Stay Healthy and ... in Your Senior Years (Keto Diet for Women)",48741
The Keto Vegan: 101 Low-Carb Recipes For A 100% Plant-Based Ketogenic Diet (Recipe-Only Edition) (The Carbless Cook Book 5),38613
"Keto: The Complete Guide to Success on The Ketogenic Diet, including Simplified Science and No-cook Meal Plans",65813
"Keto Diet Cookbook After 50: The Complete Ketogenic Diet Cookbook 800 | Amazingly Easy & Delicious Recipes to Reactivate Your Genes of Health, Energy, and Burn Fat",42476
"Essential Ketogenic Mediterranean Diet Cookbook: 100 Low-Carb, Heart-Healthy Recipes for Lasting Weight Loss",43344
