"How to Cook Everything: Summer: 20 Fresh, Seasonal Recipes and 32 Variations",173162
"Everyday Food: Great Food Fast: 250 Recipes for Easy, Delicious Meals All Year Long: A Cookbook",175516
The First Mess Cookbook: Vibrant Plant-Based Recipes to Eat Well Through the Seasons,182831
The Food52 Cookbook: 140 Winning Recipes from Exceptional Home Cooks,166244
The Home Preserving Bible: A Complete Guide to Every Type of Food Preservation with Hundreds of Delicious Recipes (Living Free Guides),227838
"Love and Lemons Every Day: More than 100 Bright, Plant-Forward Recipes for Every Meal: A Cookbook",120436
"Nuwave Air Fryer Oven Cookbook for Beginners: Amazingly Easy Recipes to Fry, Bake, Grill, and Roast with Your Nuwave Air Fryer Oven",222217
"Master of the Grill: Foolproof Recipes, Top-Rated Gadgets, Gear, & Ingredients Plus Clever Test Kitchen Tips & Fascinating Food Science",189558
For The Love Of Austria: A collection of my favorite Austrian dishes growing up,232738
"Taste of Home American Summer Cookbook: Fast Weeknight Favorites, backyard barbecues and everything in between",133896
"Oh Sweet Day!: A Celebration Cookbook of Edible Gifts, Party Treats, and Festive Desserts",213602
"TOP 50 Most Delicious Christmas Recipes: A Stunning Collection of Some of the Most Mouthwatering Christmas Meals & Treats (christmas books 2019, christmas recipes for parties, christmas recipes)",271061
"Instant Pot Cookbook for Beginners: Master Your Instant Pot Pressure Cooker Basics with Quick, Easy and Healthy Recipes Anyone Will Love",53181
"The Ultimate Cookbook for African Jollof rice: African Recipes from Ghana, Nigeria and other African countries",428251
"Air Fryer Accessories Recipe Cookbook: Best Fresh and Healthy Ideas with Easy to Follow Recipes to Air Fry, Bake, Grill and Roast, Cooking Everything (Best Air Frying Book 1)",615891
"The DIY Balloon Bible Themes & Dreams: How To Decorate For Galas, Anniversaries, Banquets & Other Themed Events",205289
Weeknight Meals Cookbook for Two: Easy and Healthy Dinner Recipes for Weeknight Cooking for Two,120018
"Inversion Therapy for Neck and Back Pain: How to Use the Inversion Table Therapy to Manage Neck Pain, Back Pain, and Sciatica",593023
Mastering The Keto Meal Prep: The Ultimate Guide To Quick And Healthy Ketogenic Meals To Boost Weight Loss,464887
Best Holiday Dishes for the Vegans in Your Life: Amazing Recipes to Try for the Most Popular Holidays Cookbook (Trying Out Vegan 1),105954
Easy Baking: 75 Quick And Easy Pies Recipes For Beginners. The Complete Homemade Pastry Bible.,327487
"Grillaholics Stuffed Burger Press Recipe Book: Turn Boring Burgers to Gourmet in 3 Easy Steps: Press It, Stuff It, Seal It (Stuffed Burger Recipes Book 1)",124894
"Complete Electric Smoker Cookbook: Delicious Electric Smoker Recipes, Tasty BBQ Sauces, Step-by-Step Techniques for Perfect Smoking",647013
"Homemade Stand Mixer Ice Cream Recipes Infused with Booze: Fun, Flavorful Easy to Make Ice Cream, Frozen Yogurt, Sorbet, Gelato and Milkshakes for Any ... Ice Cream Maker (Boozy Ice Cream Book 1)",274416
40 Easy Recipes: Perfect for Any Occasion,415922
THE COMPLETE INSTANT POT COOKBOOK: Over 100+ Quick & Foolproof Recipes for Your Whole Family with Beginners Guide,61368
Air Fryer Cookbook for Beginners: 1001 Day Quick & Easy Recipe Book #2020: Healthy Meals for Newbies and Advanced Users with Keto Air Fryer Recipes,118756
"Cooking With the Blackstone Outdoor Gas Griddle, A Quick-Start Cookbook: 101 Delicious Recipes, plus Pro Tips & Illustrated Instructions, from Quick-Start Cookbooks!",18471
Fixin' to Eat: Southern Cooking for the Southern at Heart (Cooking Squared Book 4),148473
"Crisper Tray® Recipe Cookbook: Newest Complete Revolutionary Nonstick Copper Basket Air Fryer Style Cookware Works Magic on Any Grill, Stovetop or in Your ... the Healthy Way! (Crispy Creations Book 1)",194053
"Copycat Recipes: 2020 Ultimate Cookbook to Easily Making Most Popular Recipes from Your Favorite Restaurants at Home ON A BUDGET - Cracker Barrel, Chipotle, Texas Roadhouse and many others!",26758
"The Ultimate Stuffed Burger Press Hamburger Patty Maker Recipe Book: Cookbook Guide for Express Home, Grilling, Camping, Sports Events or Tailgating, Non ... Kitchen Crafted Sliders (Stuffed Burgers 1)",972430
TOTS EVERYTHING Recipe Cookbook: BEST Creative Simple and Easy to Make Tater Tot Recipes at Home,494880
"Ceramic Titanium Cookbook: 125 Delicious Non Stick Recipes for Your Copper Square Frying Pan, Fryer Basket, Steamer Tray & Crisper Cookware Set! (Smart ... for Nutritious Stove Top Cooking Book 1)",813703
Meal Prep: 100 Delicious And Simple Meal Prep Recipes - A Quick Guide Meal Prepping For Beginners,861217
Wood Pellet Smoker and Grill Cookbook: The Ultimate Guide with the Best Barbeque Secrets. Techniques and Recipes for Smoking and Grilling as a Grill Master,169193
Bush Brew - Moonshine Recipes: 13 of the Most Sketchy & Ill-Advised Drinks,539653
GoWise USA Air Fryer Recipe Cookbook Made with Air Fry Accessoreries: Unlimited Recipes Healthy and Easy to Follow Fresh Ideas of Fried Favorites Cooking (Air Fryer Accessories Recipe Cookbook 1),781755
The Quick & Easy Cookbook: 50 Tasty New Recipes for You,399655
Banh Mi Vietnamese Sandwich Guide: Essential Recipe Handbook for the Authentic Craft of Delicious Mouthwatering Homemade Vietnamese Culture (Banh Mi Sandwiches 1),190383
"Keto Air Fryer Cookbook: Easy and Healthy Low Carb Recipes You’ll Want to Try ASAP (air fryer recipes cookbook, low carb keto, high fats foods, air fryer ketogenic, low carb air fryer recipes)",162912
Sous Vide Cookbook for Beginners: Easy-to-Follow Guide to Cooking Restaurant-Quality Meals at Home,328208
"Crisper Basket® Recipe Cookbook: Nonstick Copper Tray Works as an Air Fryer. Multi-Purpose Cooking for Oven, Stovetop or Grill. (Crispy Healthy Cooking Book 1)",522194
Anova Sous Vide Cookbook: Best Complete Effortless Meals and Perfectly Cooked Recipes Crafting at Home through a Modern Technique with Restaurant-Quality ... Circulator (Best Sous Vide Cooking Book 1),489152
"Instant Pot Cookbook: Low-Carb, Easy and Healthy Instant Pot Pressure Cooker Recipes That Taste Incredible",74174
Electric Skillet Cookbook Complete: Big Mouth Watering Recipes for your  Best Rated BPA Free  Nonstick Energy Saving Cookware (The Electric Slide Recipe Series 1),85804
Instant Pot Cookbook for Beginners: Instant Pot Budget Cookbook: 1001 Day Instant Pot Healthy Recipes Easy Cookbook: Instant Pot Cookbook Easy Recipes #2020: Smart People Instant Pot College Cookbook,57836
Easy Baking: 50 Quick And Easy Bread Recipes For Beginners. The Complete Homemade Pastry Bible,68686
"CROCK POT: Delicious, Healthy Crock Pot Recipes (2100 Crock Pot Recipes Cookbook, Clean Eating, Crockpot, Healthy Crock Pot, Crock Pot Chicken, Crock Pot Recipes Cookbook Book 1)",860869
"Making Ice Cream with the Cuisinart Ice Cream Maker, a Good Dessert: A Recipe Nerds Cookbook: The Perfect Scoop of Frozen Yogurt Sorbet Gelato & Milkshakes ... (A Recipe Nerds Cookbook on Ice Cream 1)",127018
"Easy Baking: 75 Quick And Easy Desserts Recipes For Beginners: Cheesecakes, Pies, Muffins, Cupcakes, Cookies, Brownies and More. The Complete Homemade Pastry Bible",637450
Game of Bones: Bone Broth Cookbook of the Seven Kingdoms: Healing Broths and Hearty Feasts to Die For,935597
I Hate Vegetables Cookbook: Fresh and Easy Vegetable Recipes That Will Change Your Mind (Cooking Squared Book 1),97698
Copycat Coockbook: Making Buffalo Wild Wings Most Popular Recipes at Home,288606
Kosher Recipe Book for Purim & More: 10 easy and delicious dairy free baking recipes (Mediterranean Diet Recipes 1),406000
"Delicious Keto Desserts: Best 50, Tasty, Low Carb Recipes for Weight loss and Healthy Life",979787
Sous Vide Cookbook: The Essential Beginner's Guide For The Modern Technique Cooking,563994
"THE KETO INSTANT POT COOKBOOK: Quick, Easy & Delicious Ketogenic Pressure Cooker Recipes Made for Your Instant Pot.",803555
"Celery Juice, The Miracle Juice: Harness the Immense Healing Powers of Celery Juice with These Easy To Prepare Celery Juice Recipes",161305
"Keto Drinks: Tasty Ketogenic Cocktails, Warm Drinks and Lemonades for Weight Loss - The Collection of Low-Carb Recipes That Will Keep You In Ketosis",167078
Finger Foods and Missing Legs (Sandy Bay Cozy Mystery Book 6),68333
Renewing Your Wedding Vows: A Complete Planning Guide to Saying I Still Do,1459519
"Intermittent Fasting: Wear Your Favorite Pair of Jeans, Look Good In Photos and Feel Sexy Again! (Diet Books, Fitness Books, Weight Loss, Health Book 1)",1216719
Easy Peasy Tasty Salads: A Salad Cookbook of Fast and Easy Homemade Salad Recipes,1242196
Accessible Fine Dining: The Art of Creating Exciting Food in Your Everyday Kitchen,1862646
"Keto Savory Fat Bombs: Savory Fat Bombs Recipes for Ketogenic,Gluten Free & Low-Carb Diets Made Easy and Fast to Living your Keto Lifestyle(keto fat bombs ... fat snacks,fat bombs keto snacks)",1035958
"Modern Skillet A Chef's Classic: A Recipe Nerds Cookbook: Best Nonstick Hard Anodized Recipe Book  with Quick Easy Healthy on the Go for Best Breakfast, ... Dinner at Home! (Modern Skillet Cooking 1)",1310714
Muffins Cupcakes and Buns: 36 Full Color Sugarcraft Cake Recipe Treats for All The Family: English Muffins to Blueberry. You're Covered! (Sugarcraft by Karla),1886686
The Power of the Kitchen Table: Foodgasmic Conversations & The 10 Secret Recipes to Happiness,1381900
"The Everything Cocktail Parties And Drinks Book: The Ultimate Guide to Creating Colorful Concoctions, Fabulous Finger Foods, And the Perfect Setting (Everything®)",1187623
Easy Thanksgiving - The Paleo and Lowcarb Way,2998172
"Mediterranean Diet and Cookbook for Beginners: All you Need to get Started, healthy and Easy Mediterranean Diet Recipes for Wight Loss",1423512
Perfect Drip: The Journey to a Sublime Cup of Coffee,1651295
"Electric Smoker Meat Recipes: Complete Guide, Tips & Tricks, Essential TOP recipes including Beef, Pork & Lamb (with pictures) by Francis Wood",1813781
"Electric Smoker Meat Recipes: Smoke Chicken & Turkey Like a Pro (with pictures, complete guide, tips and tricks, temperature control, wood pairing, brines ... recipes included) (Poultry Recipes Book 1)",1371116
HEDONISM EATS Barcelona: Your All-in-One Recipe for a Catalan Dinner Party,1382292
Easy and healthy food with instant pot cookbook: Current in 2020 recipes for excellent dishes using instant pot. About food for every day (Food for everyone Book 13),2319488
The Everything Slow Cooking For A Crowd Cookbook: Features 300 Appetizing Home-cooked Recipes (Everything®),1203312
Western Theme Parties: Organizing A Simple and Spectacular Western Party,3318989
The Swell Dressed Party,3604785
"Just Egg Recipes: Best recipes for breakfast, lunch, dinners and more!",991616
The Everything Wedding Shower Book: Thrill the Bride and Amaze the Guests With a Celebration to Remember (Everything®),2022465
Party People: How We Make Millions from Having Fun - the Inside Story of Britain's Biggest Party Planning and Event Management Empire,2429849
"36 Juicing Recipes: for Weight loss, Detox and Healthy Living",1800643
"Breakfast: Breakfast At The Castle! 90 Amazingly Elegant, Incredibly Delicious Breakfast Recipes Fit For Kings & Queens (Cookbooks Best Sellers 2015 Series Book 15)",1927517
Katie O's Cookbook: Creating Fun Food in the Kitchen,1350416
"Meal Prep: 101 Superfast and Easy Prep-and-Go Healthy Whole Food Recipes to Lose Weight and Heal Your Body (Picture Cookbook, Meal Planning, Meal Prep Recipes, & Meal Prep Cookbook)",1075634
"50 Shades of Punch - 50 Delicious, Fast & Easy Punch Recipes",2217152
Instant Pot cookbook. Recipes of professional chefs: Jennifer Williams asked a professional chefs to advise what you can cook using instant pot. To be ... many recipes. (Food for everyone Book 7),1441229
Mexican Cookbook Fish Recipes With Videos,3135606
Low Carb and Paleo Christmas - Healthy Easy Recipes: Based on the 12 days of Christmas,3259002
The Recovering Sorority Girls' Guide to a Year's Worth of Perfect Parties,3162919
The Everything Bachelorette Party Book: Throw a Party That the Bride and Her Friends Will Never Forget (Everything®),1520687
"PALEO FOOD LIST: Paleo Diet Food List For Weight Loss: The Amazing Benefits of Clean Eating For Your Health and Life: Eat Healthy, Feel Good, Lose Weight ... with Paleo Diet! (PALEO WORLD Book 1)",1608310
Smoking Meat: Charcoal Smoker Grill Recipes For Your Perfect BBQ,1177792
The Easy Slow Cook Crockpot Recipe Cookbook: Fast Healthy Dump Meals | Crock Pot Recipes | Quantity Cookery | Professional Cooking | Slow Cooker Recipes ... Color Pictures (The Keto Crockpot Book 1),2203954
"Dinner for Two: Appetizers, Main Courses and Desserts",1440308
Cooking is easy with Instant Pot: Cookbook for beginners in the kitchen. Easy cooking. Especially when you use Instant Pot. This book describes what to do (Food for everyone 9),1767677
Halloween Cookbook For Kids: 30 halloween recipes for kids,1553311
The Magic of a Keto Diet.  Easy Weight Loss & Healthy Habits: Seventy-Seven Recipes for Beginners,1069189
"22 WAYS TO IMPROVE YOUR LUNCH: WRAPS, SANDWICHES, SOUPS, SALADS AND SNACK RECIPES FOR SCHOOL AND WORK",1687493
"Pork Chops Recipes: The Keto way: baked, slow-cooked, fried, and stuffed.",2903655
"Cake, Cupcake, Cookie Bundle (How to Decorate a Cake, How to Decorate Cupcakes, How to Make and Decorate Cookies) (Cake Decorating for Beginners Book 4)",3064399
Mystery Homemade Every Flavor Beans: Simple Recipes For Homemade Every Flavor Beans,2772103
Simple New Years Eve Recipes,2587831
Katie Brown Celebrates: Simple and Spectacular Parties All Year Round,1454075
HEALTHY DESSERTS FOR THE FAMILY: Nutritious Family Desserts For All Meal,2048869
Recipes from a Teenage Chef: Easy meals for independent young adults,2144326
Secrets of flavor. Instant Pot cookbook: The book tells about the secrets of cooking delicious food with Instant Pot. Recipes for real gourmets (Food for everyone 6),2298719
"How to Have A Successful Bridal Shower A to Z, With More Than 500 Creative Ideas",1724070
"Paleo Baking and Dessert Recipes: 53 Delicious Paleo Baking Recipes of the Week (Paleo Diet, Gluten Free, Crockpot Recipes, Paleo Recipes, Paleo, Crock Pot, Grain Free Book 2)",2546352
"Oh Sweet Day!: A Celebration Cookbook of Edible Gifts, Party Treats, and Festive Desserts",213602
The Avengers Cookbook: Recipes to Save Your Taste Buds,167235
THE COMPLETE INSTANT POT COOKBOOK: Over 100+ Quick & Foolproof Recipes for Your Whole Family with Beginners Guide,61368
America's Test Kitchen Menu Cookbook: More than 250 Recipes and 50 Menus That Guarantee Foolproof Entertaining,197986
"Danielle Walker's Against All Grain Celebrations: A Year of Gluten-Free, Dairy-Free, and Paleo Recipes for Every Occasion [A Cookbook]",55673
The Baking Cookbook: 50 Tasty New Recipes for You | Breads Pizza Cookies Cakes Pies and More,107017
"The Pioneer Woman Cooks: A Year of Holidays (Enhanced Edition): 140 Step-by-Step Recipes for Simple, Scrumptious Celebrations",195821
Martha Stewart's Cookie Perfection: 100+ Recipes to Take Your Sweet Treats to the Next Level: A Baking Book,185143
Christmas at Highclere: Recipes and traditions from the real Downton Abbey,205241
Best Holiday Dishes for the Vegans in Your Life: Amazing Recipes to Try for the Most Popular Holidays Cookbook (Trying Out Vegan 1),105954
"Harry Potter Cookbook: Hogwarts Magical Recipes for Witches, Wizards and Muggles. Learn How to Prepare Treacle Tart, Butterbeer and 30+ Other Potterhead Recipes",43840
"Copycat Recipes: Step-by-Step Guide to Cook the Most Popular Restaurant Dishes at Home On a Budget - Cracker Barrel, Olive Garden and Taco Bell (Special Bonus - Starter Sourdough and Artisan Bread)",37622
Mason Jar Cookbook: 60 Super #Delish Mason Jar Recipes & Seasoning Mixes (60 Super Recipes Book 11),107930
Christmas Kisses and Cookies Complete Set -The most heartwarming festive romance set of 2019: A Small Town Wholesome Christmas Holiday Romance Series (Christmas ... Set of Fabulously Funny Holiday Romances),106122
Betty Crocker Christmas Cookies: HMH Selects (Betty Crocker Cooking),213093
"1001 Best Crock Pot Recipes of All Time: A Crock Pot Cookbook with Over 1001 Crockpot Recipes Book For Beginners Slow Cooking Breakfast, Easy Instant Pot Lunch and Pressure Cooker Dinner Meals",20315
"1001 Best Baking Recipes of All Time: A Baking Cookbook with Over 1001 Recipes Book For Baking Basics such as Bread, Cakes, Chocolate, Cookies, Desserts, Muffin, Pastry and More",32136
Hometown Harvest Cookbook (Everyday Cookbook Collection),176328
"1001 Best Slow Cooker Recipes of All Time: A Slow Cooking Cookbook with Over 1001 Recipes Book for Healthy Electric Pressure Instant Pot Crock Pot Breakfast, Lunch and Dinner Meals",205052
"Natural Liver Cleanse Recipes: Liver cleanse juices, liver cleanse tea, Liver cleanse soup, fatty liver cleanse, liver cleanse smoothie and liver cleanse vegan recipes",195537
El pan: Manual de técnicas y recetas de panadería (Spanish Edition),167403
Instant Pot Keto Cookbook For Beginners: 800 Days of Keto Cooking For Your Instant Pot Quick & Easy Recipes (Keto Instant Pot Cookbook),198529
Dough: Simple Contemporary Bread,66374
NuWave Oven Cookbook for Beginners: Complete Guide to Start Cooking Delicious and Healthy Meals on a Budget at Home,171146
Fixin' to Eat: Southern Cooking for the Southern at Heart (Cooking Squared Book 4),148473
English Teatime Treats: Delicious Traditional Recipes Made Simple,115371
Copycat Cookbook: Learn the Secrets of Famous Restaurants and Cook Easily the Most Popular Recipes at Home,92592
"Christmas Treat Recipes: Christmas Cookies, Cakes, Pies, Candies, Fudge, and Other Delicious Holiday Desserts Cookbook",126133
Easy Baking: 50 Quick And Easy Bread Recipes For Beginners. The Complete Homemade Pastry Bible,68686
Jingle Bells and Deadly Smells (Sandy Bay Cozy Mystery Book 10),173968
Homemade Christmas Gifts and More - Frugal Christmas Gift Ideas For The Whole Family,169543
The Bread Baking Cookbook: 50 Tasty New Recipes for Beginners | Artisan Handcrafted Keto Gluten-Free Five Minutes a Day and More,160504
The Bread Baking Cookbook: A Step-by-Step Guide to Making No-Knead Bread at Home,88182
"The DIY Balloon Bible Themes & Dreams: How To Decorate For Galas, Anniversaries, Banquets & Other Themed Events",205289
Instant Pot Cookbook for Beginners: Pressure Cooker Recipe Book with Pictures #2020: Quick & Easy Meals for your Multicooker: A One Pot Guide for Newbies and Advanced Users (Recipes with Pictures 1),56552
Instant Pot Cookbook for Beginners: 1000 Day Quick and Easy Instant Pot Recipes Meal Plan: The Most Complete Instant Pot Recipe Cookbook for Beginners ... Instant Pot Pressure Cooker Cookbook 1),108307
The German-Jewish Cookbook: Recipes and History of a Cuisine (HBI Series on Jewish Women),165846
"Dehydrator Cookbook for Beginners: A Beginner's Guide to Dehydrating Foods, Vegetables, Fruits and More!",176879
"Magical Harry Potter Cookbook: Potions, Treats And Harry's Favorite Recipes!",146918
"The Enchanted Harry Potter Cookbook: From Choco Frogs to Pumpkin Pasties, 30+ Magical and Tasty Recipes for Wizards and Muggles",86396
Payard Cookies,55740
D'OH: The Simpsons Cookbook,196876
"Keto Snacks: Perfect Ketogenic Fat Burner Recipes | Supports Healthy Weight Loss - Burn Fat Instead of Carbs | Formulated for Keto, Diabetic, Paleo and Low-Carb/High-Fat Diets",86039
Scene of the Grind: A Dog Cozy Mystery (A Killer Coffee Mystery Series Book One),35509
"365 Days of Cookie Recipes: A Cookie Cookbook with Over 365 Recipes such as Top Delicious Thanksgiving, Christmas, Easy Baking Holiday Cookies, Sugar Desserts and More",97808
"How to Feed Wizards and Witches: Butterbeer, Snitchpops And Other Harry Potter Inspired Recipes",188396
Beautiful Boards:50 Amazing Snack Boards for Any Occasion,69469
100 More Easy Recipes in Jars,135243
100 Easy Recipes In Jars,128480
The Baker's Daughter Remembers the Holidays,147461
The Book on Pie: Everything You Need to Know to Bake Perfect Pies,373099
Wood Pellet Smoker and Grill Cookbook: Grill Like a Pro with the Easiest Recipes for a Perfect Smoking,364575
300 Recipes For Entertaining: Impress your guests with our deceptively simple showstoppers and sharing platters,315908
Greek Village Cooking: The Short and Happy Tale of Pippo Alampo,225166
Aladdin: A Whole New World of Recipes: Take Your Taste Buds on A Magic Carpet Ride!,235557
"Brownies, Gingerbread & Hot Chocolate: Winter & Holiday Comfort Foods! (Southern Cooking Recipes Book 27)",285903
"Now & Again: Go-To Recipes, Inspired Menus + Endless Ideas for Reinventing Leftovers",369629
Cook Like a Jedi: Best Recipes from a Star Wars Menu,248367
Gifts in Jars: Quick and Easy Mason Jars Edible Gifts Recipes,265316
Christmas Drinks: Delicious and Tasty Holiday Drink Recipes,247374
50 Vibrant & Delicious Appetizers: For Your Next Get Together - Quick Simple Appetizer Recipes,286437
"1001 Best Pressure Cooker Recipes of All Time: An Electric Pressure Cooker Cookbook with Over 1001 Recipes For Healthy Fast and Slow Cooking Instant Pot Breakfast, Lunch and Dinner Meals",374387
"TOP 50 Most Delicious Christmas Recipes: A Stunning Collection of Some of the Most Mouthwatering Christmas Meals & Treats (christmas books 2019, christmas recipes for parties, christmas recipes)",271061
99 Recipes for 99 Cents: The underground classic from 1962 is now available as an eBook,341261
How to Cook Everything: Christmas: 20 Festive Holiday Recipes and 34 Variations,352371
Pan y dulces italianos: Un clásico de la tradición italiana (Libros con Miga nº 2) (Spanish Edition),356263
Perfect Pumpkin Recipes: A Charming Holiday Pumpkin Cookbook,259503
"Slow Cooker: Cookbook: 87 Easy Recipes - Simple to Follow: Food, Recipes, Cooking, Eating and Enjoying (Meals For Your Crock Pot, Meals For Your Slow Cooker, ... Loss Slow Cooker, Slow Cooker Recipes)",295417
"Southern Holiday Feast: Thanksgiving, Christmas, New Year's, Easter & More! (Southern Cooking Recipes Book 13)",235632
Potterdrunk: Magical Drink and Dessert Recipes Inspired by The Wizarding World of Harry Potter,258696
Best Christmas Recipes to Bring the Holiday Spirit in Your Home: A Must- Have for The Holidays,289219
Being Dead Is No Excuse: The Official Southern Ladies Guide to Hosting the Perfect Funeral,301678
Batch Cocktails: Make-Ahead Pitcher Drinks for Every Occasion,226814
Date Night In: More than 120 Recipes to Nourish Your Relationship,272928
Christmas Drink Recipes: Delicious and Simple Holiday Drinks (2018 Edition),246933
Vegan Christmas,354363
Mexican Cooking: Hot & Delicious (Something Else Publishing eCookbooks),348169
Sheet Pan Cookbook: Clean Eating Made Simple with these Sheet Pan Recipes. The Sheet Pan Dinners Cookbook with The Best Simple Recipes with also Vegetarian Meals and Vegan Meals.,305245
"The Year of Cozy: 125 Recipes, Crafts, and Other Homemade Adventures",358159
Disney in a whole New Form: Discover 30 Disney Inspired Food and Eat Heartily,247483
"Petite Eats: Appetizers, Tasters, Miniature Desserts, and More",251420
"The Cake Mix Doctor’s 25 Best Birthday Cakes: Easy Luscious Layer Cakes, Plus Frostings, Icings, Tips, and More",356400
The Magical Harry Potter Cookbook: 45 Mouthwatering and Exquisite Recipes from the Wizarding World of Harry Potter,240485
Five Seasons of Jam,331862
Gin O’clock: A Year of Ginspiration,336114
The Four & Twenty Blackbirds Pie Book: Uncommon Recipes from the Celebrated Brooklyn Pie Shop,356077
Nantucket Open-House Cookbook,334667
"How To Make Edible Slime: 30 Fun and Yummy Slime Recipes: ( A Slime Book For Kids To Have Safe And Yummy Fun- Includes Clear Slime, and Glow In The Dark Slime) (Slime Books For Kids)",334151
Scandikitchen Christmas: Recipes and traditions from Scandinavia,346975
The 100 Most Jewish Foods: A Highly Debatable List,348102
Dough: Simple Contemporary Bread,283501
"Sasha in Good Taste: Recipes for Bites, Feasts, Sips & Celebrations",340626
"VEGAN Electric Pressure Cooker Cookbook: The Best Healthy Quick & Easy Plant-Based Cooking, Recipes for Beginners and Advanced Users",270002
Jill's Plant-Based Thanksgiving Recipes,311460
OF BUTTERBEERS AND TREACLE TARTS:: THE HARRY POTTER COOKBOOK A Magical Collection of Fancy Harry Potter-Inspired Recipes,271487
The Man Who Ate Too Much: The Life of James Beard,310651
"Let's Party: 40 Big-Batch Crowd-Pleasing Recipes for 12 Guests, or More",288314
"Modern Jewish Baker: Challah, Babka, Bagels & More",351065
Holiday Cookies: Showstopping Recipes to Sweeten the Season [A Baking Book],287278
"The Artisanal Kitchen: Holiday Cookies: The Ultimate Chewy, Gooey, Crispy, Crunchy Treats",329661
Jacques Pépin New Complete Techniques,132174
Fifty Shades of Chicken: A Parody in a Cookbook,213495
Making Artisan Pasta,23176
Prune: A Cookbook,111708
The James Beard Cookbook,168273
"Sous Vide Cookbook For Beginners: Tasty, Healthy & Simple Recipes To Make At Home Everyday",130063
"Grillaholics Stuffed Burger Press Recipe Book: Turn Boring Burgers to Gourmet in 3 Easy Steps: Press It, Stuff It, Seal It (Stuffed Burger Recipes Book 1)",124894
Voilà!: The Effortless French Cookbook: Easy Recipes to Savor the Classic Tastes of France,125983
Bread Illustrated: A Step-By-Step Guide to Achieving Bakery-Quality Results At Home,68915
"SAVEUR: The New Classics Cookbook: 1,000 Recipes + Expert Advice, Tips, and Tales",185815
"Asian Dumplings: Mastering Gyoza, Spring Rolls, Samosas, and More [A Cookbook]",185614
James Beard's Theory and Practice of Good Cooking,10548
"Quick & Easy No-Bake Desserts Cookbook: Over 75 delicious recipes for cookies, cakes, pies, and other tasty treats!",154889
