Keto after 50: Beginners guide for women over 50 to start your ketogenic diet and reset your metabolism. Included a 7-day meal plan and a special BONUS about intermittent fasting,40011
The 30-Day Ketogenic Cleanse: Reset Your Metabolism with 160 Tasty Whole-Food Recipes & Meal Plans,62432
The Skinnytaste Air Fryer Cookbook: The 75 Best Healthy Recipes for Your Air Fryer,18788
"The Essential Keto Diet for Beginners #2020: 5-Ingredient Affordable, Quick & Easy Ketogenic Recipes | Lose Weight, Cut Cholesterol & Reverse Diabetes | 30-Day Keto Meal Plan",9614
"The Essential Keto Cookbook: 105 Ketogenic Diet Recipes For Weight Loss, Energy, and Rejuvenation (Including Keto Meal Plan and Food List)",31717
Keto in an Instant: 100 Ketogenic Recipes for Your Instant Pot,47728
"Food: What the Heck Should I Cook?: More than 100 Delicious Recipes--Pegan, Vegan, Paleo, Gluten-free, Dairy-free, and More--For Lifelong Health",54548
"The Super Lazy Keto Diet for Beginners 2020: Catapult Your Weight Loss Journey into Reality with these Quick & Easy, 5-Ingredient Recipes to Prepare in Only 5 Minutes!",63358
"Keto Meal Prep: Easy, Healthy and Wholesome Ketogenic Meals to Prep, Grab, and Go. 21-Day Keto Meal Plan for Beginners. Keto Kitchen Cookbook (keto meal ... ketogenic meal plans, keto diet foods)",26869
Everyday Keto Cookbook: 60 Amazing Ketogenic Recipes - Completely Delicious Keto Cookbook - Test Ketosis Meal Ideas at Your Kitchen (The Healthy Orange Books 4),28216
"Keto Meal Prep Cookbook For Beginners: 600 Easy, Simple & Basic Ketogenic Diet Recipes (Keto Cookbook)",7982
The Bad Food Bible: Why You Can (and Maybe Should) Eat Everything You Thought You Couldn't,62999
Keto Diet For Dummies,39734
"Ketotarian: The (Mostly) Plant-Based Plan to Burn Fat, Boost Your Energy, Crush Your Cravings, and Calm Inflammation: A Cookbook",45938
Copycat recipes of Keto cookbook: Quick and easy ways to make the most  popular recipes from restaurants at home  in ketogenic version to improve your  lifestyle,35644
"The Complete Mediterranean Cookbook: 500 Vibrant, Kitchen-Tested Recipes for Living and Eating Well Every Day",17836
"The Big Ketogenic Cookbook - KETO MADE EASY For BEGINNERS  - Delicious & Nutritious Keto Diet Recipes : High Fat Low Carb Cookbook for Breakfast, Lunch, Dinner & Dessert",54914
"Air Fryer Perfection: From Crispy Fries and Juicy Steaks to Perfect Vegetables, What to Cook & How to  Get the Best Results",69801
Easy Everyday Keto: Healthy Kitchen-Perfected Recipes,76552
The Every-Other-Day Diet: The Diet That Lets You Eat All You Want (Half the Time) and Keep the Weight Off,76383
Keto Friendly Recipes: Easy Keto for Busy People,65895
The Big Book of Ketogenic Diet Cooking: 200 Everyday Recipes and Easy 2-Week Meal Plans for a Healthy Keto Lifestyle,77410
"The Wicked Good Ketogenic Diet Cookbook: Easy, Whole Food Keto Recipes for Any Budget",74777
"Keto Snacks: Perfect Ketogenic Fat Burner Recipes | Supports Healthy Weight Loss - Burn Fat Instead of Carbs | Formulated for Keto, Diabetic, Paleo and Low-Carb/High-Fat Diets",92167
The Keto Vegan: 14-Day Ketogenic & Intermittent Fasting Meal Plan (With 51 Tasty Low-Carb Plant-Based Recipes) (The Carbless Cook Book 7),69329
"Keto Dessert Cookbook 2020: 250 Quick & Easy, Sugar-free, Ketogenic Bombs, Cakes & Sweets to Shed Weight, Lower Cholesterol & Boost Energy",95190
Rocco's Keto Comfort Food Diet: Eat the Foods You Miss and Still Lose Up to a Pound a Day,87212
Keto Diet En Español: Keto Diet Cookbook for Quick & Easy Keto recipes (ketogenic recipes) (Spanish Edition),90466
"365 Days of Ketogenic Diet Recipes: A Ketogenic Diet Cookbook with Over 365 Healthy Keto Recipes Book For Beginners Kitchen Cooking, Low Carb Meals and Cleanse Weight Loss Diet Plan",92172
The Affordable Keto Meal Prep Cookbook 2020: 5-Ingredient Quick & Easy Budget Friendly Meal Prep Recipes on the Ketogenic Diet,70879
Keto for Life: Reset Your Biological Clock in 21 Days and Optimize Your Diet for Longevity,98803
Keto 1000 Recipes: Big Fat Keto Cookbook with Over 1000 Ultra Low Carb Ketogenic Recipes,82988
"Keto Living Day by Day: An Inspirational Guide to the Ketogenic Diet, with 130 Deceptively Simple Recipes",88448
"Keto Diet Cookbook: 125+ Delicious Recipes to Lose Weight, Balance Hormones, Boost Brain Health, and Reverse Disease",80362
"Ketogenic Slow Cooker Cookbook: Easy, Healthy and Fast Keto Recipes to Burn Fat, Lose Weight and Living the Keto Lifestyle",101467
The Salt Fix: Why the Experts Got It All Wrong--and How Eating More Might Save Your Life,97548
"Keto For Women Over 50: A Complete Guide to Keto Diet for Senior Women to Regulate Metabolism, Burn Fat, Lose Weight Healthily, Prevent Diabetes and Balance Hormones, Including Ketogenic Recipes",67476
"The Carnivore Diet Handbook: Get Lean, Strong, and Feel Your Best Ever on a 100% Animal-Based Diet (with meal plans, keto recipes, and smart tips to start)",86483
"Intermittent Fasting 101: Heal Your Body Through Alternate-Day Fasting, Autophagy & Ketogenic Diet. Get the benefits of Healthy Weight Loss & Burn Fat. The A-Z guide and recipes for men and women",76457
Low Carb Yum 5-Ingredient Keto: 120+ Easy Recipes,84360
Keto Diet Cookbook for Women after 50: The Ultimate Guide Book Ketogenic Diet Lifestyle for Seniors.Simple Keto Recipes and 21-Day Meal Plan - Balance ... Regain Your Metabolism and Stay Healthy,87512
"The Vegan Ketogenic Diet Cookbook: 75 Satisfying High Fat, Low Carb, Dairy Free Recipes",81395
The Complete Vegetarian Cookbook: A Fresh Guide to Eating Well With 700 Foolproof Recipes,86491
"The Basic Keto Cookbook For Beginners On A Budget: 800 Days of Quick, Easy and Healthy Ketogenic Diet Recipes (Ketogenic Diet Books For Beginners 1)",94695
Easy Dairy-Free Ketogenic Recipes: Family Favorites Made Low-Carb and Healthy,102503
Keto Air Fryer Cookbook For Beginners: 550 Air Frying Recipes To Lose Weight Quick and Easy on the Ketogenic Diet (Keto Air Fryer Recipes),97680
Lunch in Five: 30 Low Carb Lunches. Up to 5 Net Carbs & 5 Ingredients Each! (Keto in Five Book 2),86040
"The Hormone Fix: Burn Fat Naturally, Boost Energy, Sleep Better, and Stop Hot Flashes, the Keto-Green Way",96900
The Ketogenic Bible: The Authoritative Guide to Ketosis,81243
Keto Bread: Low Carb Bakers Cookbook with Delicious Homemade Ketogenic Recipes (Keto Sweets 1),71363
"The Everyday Ketogenic Kitchen: With More than 150 Inspirational Low-Carb, High-Fat Recipes to Maximize Your Health",86672
"Keto Bread: From Bagels and Buns to Crusts and Muffins, 100 Low-Carb, Keto-Friendly Breads for Every Meal",98130
"Healthy Keto Smoothies and Shakes Cookbook: Quick and Delicious Ketogenic Diet Smoothies and Shakes Recipes to Get Healthy, Lose Weight and Feel Great",67544
She Does Keto: The Complete Ketogenic Diet for Women,79507
Keto Diet for Beginners: 30-Day Keto Meal Plan for Rapid Weight Loss. Ketogenic Meal Prep Cookbook Full of Easy to Follow Recipes! Lose up to 20 Pounds in 30 Days! (Keto Diet for Beginners),91182
Keto Life: Over 100 Healthy and Delicious Ketogenic Recipes,101973
Keto After 50: The Ultimate Ketogenic Diet Guide for Seniors. Includes Recipes to Reset Your Metabolism and Boost your Energy,100901
Vegan Keto: The Complete 100% Plant-Based Whole Foods Ketogenic Diet. Tasty Low Carb Recipes Cookbook to Nourish Your Mind and Promote Weight Loss Naturally. (21-Day Time Saving Meal Plan Included),85568
"Keto Chaffle Recipes Cookbook for Beginners: Easy, Vibrant & Irresistible Low Carb Ketogenic Waffles to Make, Bake & Toast! + Secret Hacks & Tips to a Crispier Chaffle",91352
"Keto Kids: Ketogenic Cookbook For Low Carb Breakfast, Lunch, Dinner, And Snack Recipes To Promote Healthy Living With Easy To Follow, Quick, Delicious, And Child Friendly Meals!",66712
"Homemade Keto Soup Cookbook: Fat Burning & Delicious Soups, Stews, Broths & Bread (Elizabeth Jane Cookbook Book 13)",99921
KETO DIET FOR BEGINNERS 2020: The complete Ketogenic guide to lose weight and transform your body with an easy and healthy low-carb lifestyle. Bonus: recipes and meal preps included,73093
500 Keto Instant Pot Recipes Cookbook: The Easy Electric Pressure Cooker Ketogenic Diet Cookbook to Reset Your Body and Live a Healthy Life,67096
Bowls: Vibrant Recipes with Endless Possibilities,84547
Keto in an Instant: More Than 80 Recipes for Quick & Delicious Keto Meals Using Your Pressure Cooker,95676
"High-Protein Plant-Based Diet Cookbook: Vegan Bodybuilding Diet Book for Athletic Performance and Muscle Growth with Low-Carb, High-Protein Foods. 90 Recipes ... and 30-Day Meal Plan (ketogenic beginners)",101457
"The Fighter's Kitchen: 100 Muscle-Building, Fat Burning Recipes, with meal Plans to Sculpt Your Warrior Body",88315
"Prevent and Reverse Heart Disease: The Revolutionary, Scientifically Proven, Nutrition-Based Cure",14613
Atrial Fibrillation Explained: Understanding The Next Cardiac Epidemic,167838
The Mediterranean Diet Weight Loss Solution: The 28-Day Kickstart Plan for Lasting Weight Loss,16636
Hypertension Cookbook: Cure High Blood Pressure with Healing Foods - 101 Healthy Recipes,238086
Anti-Inflammatory Diet: Essential Meals that Heal. No-Hassle Recipes to Reduce Inflammation (Ultimate Health Book 2),179551
"American Heart Association Low-Salt Cookbook, 4th Edition: A Complete Guide to Reducing Sodium and Fat in Your Diet",142199
Mediterranean Instant Pot Cookbook: 100 + New Recipes to Your Life. Delicious & Easy Instant Pot Recipes for Beginners and Advanced Users,138437
"Mediterranean Diet Cookbook: 550 Quick, Easy and Healthy Mediterranean Diet Recipes for Everyday Cooking",11816
"The New American Heart Association Cookbook, 9th Edition: Revised and Updated with More Than 100 All-New Recipes",119479
"The Heart Healthy Cookbook for Beginners 2020: 600 Low Sodium, Low Fat Recipes to Drop Pounds, Improve Health and Lower Blood Pressure (21 Day Meal Plan Included)",231038
"DASH Diet for Women: Quick, Easy and Healthy Restaurant Style Recipes for Weight Loss, Increasing Energy and Lowering Blood Pressure",195246
The Complete Vegetarian Cookbook: A Fresh Guide to Eating Well With 700 Foolproof Recipes,86491
The Mediterranean Diet Cookbook: 550 Heart-Healthy Recipes to Lose Weight and Boost Your Immune System,112791
"The Prevent and Reverse Heart Disease Cookbook: Over 125 Delicious, Life-Changing, Plant-Based Recipes",52801
"365 Days of Mediterranean Diet Recipes: A Mediterranean Diet Cookbook with Over 365 Mediterranean Recipes Book for Beginners Diet, Healthy Lifestyle and Weight Loss",132980
Diabetes and Heart Healthy Meals for Two,203280
"Dash Diet Cookbook 2019 for Beginners: 500 Quick, Easy and Healthy Dash Diet Recipes - 21 Day Dash Diet Meal Plan to Lose Weight and Lower Your Blood Pressure",142926
Air Fryer Cookbook for Beginners: 1001 Day Air Fryer Cookbook Healthy Meal Plan: Air Fryer Cookbook for Two and Easy Air Fryer Recipes: The Ultimate Air ... Recipe Book: Air Fryer Cookbook Beginners,135099
The Heart Disease Prevention Cookbook: 125 Easy Mediterranean Diet Recipes for a Healthier You,228541
The Longevity Diet: ‘How to live to 100 . . . Longevity has become the new wellness watchword . . . nutrition is the key’ VOGUE,197311
"The 30-Minute Immune System Diet Plan: Quick Recipes to Boost Immunity, Heal Inflammation and Prevent Disease",121947
The Complete Anti-Inflammatory Diet for Beginners: A No-Stress Meal Plan with Easy Recipes to Heal the Immune System,1487
"Eating in Color: Delicious, Healthy Recipes for You and Your Family",46670
REVERSE DIABETES - LOWER BLOOD SUGAR TO NORMAL - BE DRUG FREE - END TESTING - BONUS: HOW TO KEEP DIABETES OFF MEDICAL RECORDS,158491
Dash Diet Cookbook for Beginners: 21-Day Dash Diet Meal Plan to Lose Weight and Lower Your Blood Pressure,22140
"American Heart Association Quick & Easy Cookbook, 2nd Edition: More Than 200 Healthy Recipes You Can Make in Minutes",213948
"Mediterranean Diet Meal Prep: Easy and Healthy Mediterranean Diet Recipes to Prep, Grab and Go. 21-Day Fix Meal Plan to Lose Weight as Fast as Possible",45650
Reducing High Blood Pressure for Beginners: A Cookbook for Eating and Living Well,247209
"Mediterranean Dash Diet: The Step By Step Guide to Lose Weight, Lower Blood Pressure and Improve Health. Boost Your Metabolism and Detoxify Your Body With Meal Plan and Meal Prep.",193166
"Keto Meal Prep by FlavCity: 125+ Low Carb Recipes That Actually Taste Good (Keto Cookbook, Keto Diet Recipes, Keto Foods, Keto Dinner Ideas)",39776
"The Heart Healthy Diet  and  Action Plan: 4 Weeks to Lower Cholesterol  and  Improved Heart Health (menu for a month: breakfast, lunch, dinner, snaсk) (Healthy Food Book 1)",157625
The 20-Minute Mediterranean Diet Cookbook: Quick and Delicious Mediterranean Recipes for Weight Loss and Health,253488
My Greek Traditional Cookbook 2: A Simple Greek Cuisine,246764
Meals That Heal: 100+ Everyday Anti-Inflammatory Recipes in 30 Minutes or Less,98043
"Autoimmune Diet  Instant Pot Cookbook: AIP Diet to Prevent and Reverse the Full Spectrum of Inflammatory Symptoms, Have Less Disease, and Be Longevity with Savory Recipes and A Healthy Meal Plan",147625
"The Everyday DASH Diet Cookbook: Over 150 Fresh and Delicious Recipes to Speed Weight Loss, Lower Blood Pressure, and Prevent Diabetes (A DASH Diet Book)",115196
"The Mediterranean Method: Your Complete Plan to Harness the Power of the Healthiest Diet on the Planet -- Lose Weight, Prevent Heart Disease, and More! (A Mediterranean Diet Cookbook)",151307
Blood Pressure: Solution - 2 Manuscripts - The Ultimate Guide to Naturally Lowering High Blood Pressure and Reducing Hypertension & 54 Delicious Heart Healthy Recipes (Blood Pressure Series Book 3),231539
Cannabis Cookbook: The Essential Guide to Edibles and Marijuana infused cooking,237396
Top 50 Most Delicious Avocado Recipes (Superfood Recipes Book 3),182444
Blood Pressure Down: The 10-Step Plan to Lower Your Blood Pressure in 4 Weeks--Without Prescription Drugs,85478
"Keto Bread Machine Recipes: 30 Easy, Healthy and Low-Carb Ketogenic Bread Machine Recipes",144196
The 4-Week Fast Metabolism Diet Plan: 100 Recipes to Reset Your Metabolism and Lose Weight,146123
The Great Cholesterol Myth + 100 Recipes for Preventing and Reversing Heart Disease,80466
21-Day Clean-Eating Meal Plan - 1200 Calories: Healthy Clean Eating Recipes: The 3-Week Weight Loss Cookbook for Beginners,47347
Anti-Inflammatory Diet: Heal Yourself: The Top 100 Best Recipes For Chronic Inflammation (All Natural Solutions For Healing Inflammation Along With Anti Inflammatory Cookbook and Recipes 1),243979
The Mediterranean Salad Cookbook: Salads and Salad Dressings for Healthy Living (Mediterranean Diet Cookbook Book 3),208768
"The Heart Healthy Cookbook for Two: 125 Perfectly Portioned Low Sodium, Low Fat Recipes",59535
The Easy Low Sodium Diet Plan and Cookbook: Quick-Fix and Slow Cooker Meals to Start (and Stick to) a Low Salt Diet,58848
"The Complete Mediterranean Cookbook: 500 Vibrant, Kitchen-Tested Recipes for Living and Eating Well Every Day",17836
"Natural Anti-Aging Wisdom: Secrets to Look Younger, Live Longer, and Feel Healthy Without a Doctors Prescription (How I Look Younger) (Foods, Diet, Sex, Fitness, and Mental Health) (2020 Update)",445625
Anti Inflammatory Diet Slow Cooker & One-Pot Meals: Prep-and-Go Recipes for Healthy Eating & Weight Loss,382840
The Kimchi Diet: Revive Your Gut • Get Lean • Live Longer,301008
"Anti-Inflammatory Instant Pot Cookbook: Healthy and Delicious Instant Pot Recipes to Decrease Inflammation, Live a Healthy Life",271211
"Keto for Women Over 50: Simple 30 Minute Keto Recipes for Instant Weight Loss and Healthy Living: Keto Cookbook, Lose Weight Without Dieting (Images Included! NEW 3 WEEK MEAL PLAN NOW AVAILABLE)",271184
Blood Pressure Solution: How to lower your Blood Pressure without medication using Natural Remedies,419014
"Mediterranean Diet Plan: The Beginner’s Guide for Healthy Eating to Weight Loss,Obesity Cure. Your 21-Day Meal Plan to Reset your Metabolism Code,Cookbook Diet",315618
"Mindful Eating: A Healthy, Balanced and Compassionate Way To Stop Overeating, How To Lose Weight and Get a Real Taste of Life by Eating Mindfully",267914
Anti-Inflammatory Diet Cookbook: How to Improve Your Nutrition with Healthy Recipes for Each Meal of the Day. Learn How to Change Your Diet Even if You Are a Beginner and Establish a Better Lifestyle,338043
"The Everything DASH Diet Cookbook: Lower your blood pressure and lose weight - with 300 quick and easy recipes! Lower your blood pressure without drugs, ... and Stay healthy for life! (Everything®)",299044
"American Heart Association Instant and Healthy: 100 Low-Fuss, High-Flavor Recipes for Your Pressure Cooker, Multicooker and Instant Pot®: A Cookbook",364342
The Anti-Inflammation Cookbook: The Delicious Way to Reduce Inflammation and Stay Healthy,271072
The Mediterranean Diet of Crete: Traditional Recipes from the Healthiest People in the World,372366
The Best Anti-Inflammatory Diet Cookbook: 30 Anti Inflammatory Foods for Everyone,426667
Vegan CookBook: All our health depends on what we eat!,342387
"Plant-Based Cookbook: Good for Your Heart, Your Health, and Your Life; 200 Whole-food Recipes",452933
"American Heart Association Healthy Fats, Low-Cholesterol Cookbook: Delicious Recipes to Help Reduce Bad Fats and Lower Your Cholesterol",334631
"DASH Diet Smoothies: For Low Salt, Low Cholesterol, Weight Loss, and Diabetes Diets (DASH Diet Cookbook Book 1)",440100
Mediterranean Diet for Beginners: The Complete Guide - Healthy and Easy Mediterranean Diet Recipes for Weight Loss - Prevention of Cardiovascular Diseases - Everything You Need to Get Started,301670
Turmeric Cookbook: 55 Recipes for Adding Turmeric to Your Life for Health & Longevity,276306
Anti-Inflammatory Diet for Beginners: 600+ Incredible and Irresistible Recipes for The Smart People in A Budget,375487
Summer Salads Recipe Book: Salad diet weight loss,311998
"Keto Diet for Beginners: Essential Guide to Ketogenic Diet for Weight Loss, Body Healing and Happy Lifestyle. 57 Delectable Low-Carbohydrate Easy Recipes and a 21-Day Meal Plan (Сookbook)",379418
HIGH TRIGLYCERIDES DIET: The Perfect Guide on Lowering Triglycerides Including Foods to Eat to Lower Triglycerides,317540
The Mediterranean Diet Plan: Heart-Healthy Recipes & Meal Plans for Every Type of Eater,350327
Life-Changing Salad Dressings: In 3 Minutes Flat (Grace Légere Cookbooks Book 2),380100
"Everyday Cooking with Dr. Dean Ornish: 150 Easy, Low-Fat, High-Flavor Recipes",364493
American Heart Association No-Fad Diet: A Personal Plan for Healthy Weight Loss,296090
Anti Inflammatory Diet Instant Pot Cookbook: Easy Instant Pot Recipes to Decrease Inflammation. Heal Your Body and Lose Weight with Your Electric Pressure Cooker. Anti-inflammation Meal Plan,388382
Vegan: Ice Cream Vegan Recipes for Vegetarians and Raw Vegans that are Delicious and Soul Satisfying,328399
VEGAN COOKBOOK: FILIPINO VEGANIZED: 50 RECIPES,390797
Live to Eat: Cooking the Mediterranean Way,392069
Intermittent Fasting vs Ketogenic Diet: Accelerated Weight-Loss for Your Body Type. A Personal Investigation for the Curious Mind.,321732
"Keto Vegetarian Cookbook: Easy & Delicious Low-Carb Vegetarian Recipes for Easy and Fast Weight Loss, Heal your Body and Improve your Life",259175
DUKAN DIET:  Lose Weight FAST And Lose Weight FOREVER: Four Phase Plan,339538
Sardine Solution: How and Why to Eat the World's Most Badass Source of Protein,380661
"50 Fitness Tips You Wish You Knew: The Ultimate Collection Of Tips, Tricks, And Hacks To Transform Your Mind, Body, and Life",369907
"DASH DIET: Guidelines and Recipes: 14-Day Heart Healthy Eating Plan to Jump Start Your Diet, Lose Weight and Gain Control of Your Health",423047
The Mexican Food Diet™: Healthy Eating that Feels like Cheating,444029
"The ""Plan A"" Diet: Combining Whole Food, Plant Based Nutrition with the Timeless Wisdom of Scripture",307664
Love Vegan: The Ultimate Mexican Cookbook: Easy Plant Based Recipes Anyone Can Cook | Includes a Bonus Gift Inside Each Copy!,288427
"The Whole Life Nutrition Cookbook: Over 300 Delicious Whole Foods Recipes, Including Gluten-Free, Dairy-Free, Soy-Free, and Egg-Free Dishes",379718
"Healthy Weekly Meal Prep Recipes: Easy & Simple diet recipes, First 2 Weeks of Clean Eating, Weight loss And Saving Time | Quick and Delicious Recipes | Step-by-Step For Beginners",394919
Cholesterol Lowering Cookbooks: Superfoods and Dairy Free for a Low Cholesterol Diet,417521
Low Iron Diet: Food Advice for Iron Deficiency Anemia,383591
Heart Failure Prevention & Treatment: A Companion Book To All You Need to Know About Cardiac Failure,396997
Mediterranean Diet Cookbook For Beginners: 101 Quick and Healthy Recipes with Easy-to-Find Ingredients to Enjoy The Mediterranean Lifestyle (21-Day Meal ... Weight Loss) (The Mediterranean Method 1),290632
"The No-Salt, Lowest-Sodium Cookbook: Hundreds of Favorite Recipes Created to Combat Congestive Heart Failure and Dangerous Hypertension",417545
The How Not To Die Cookbook: Over 100 Recipes to Help Prevent and Reverse Disease,452284
Eat Plants Love: Recipes for a Good Life,452809
Sourdough Bread Baking for Beginners: Complete Beginner's Guide. No Baking Tools. No Experience. From Sourdough Starter to Delicious Home-Made Sourdough Bread,62307
"Keto Fat Bombs, Sweets & Treats: Over 100 Recipes and Ideas for Low-Carb Breads, Cakes, Cookies and More",135706
Love Your Body Feed Your Soul: Self-Care Rituals and Recipes for Your Inner Goddess,120630
"Meal Prep Plan: The Ultimate Guide to Saving Time, Losing Weight and Improving Your Life by Meal Prepping (Not on a Diet)",102614
"Wheat Belly: Lose the Wheat, Lose the Weight, and Find Your Path Back to Health",62804
Crazy Sexy Kitchen: 150 Plant-Empowered Recipes to Ignite a Mouthwatering Revolution,14311
"Eating Clean: Budget-Friendly Breakfast, Lunch & Dinner Recipes for Clean Eating Diet and Healthy Weight Loss. Clean-Eating Cookbook for Beginners and Busy Families (eat clean diet recipes)",65309
"The Gut-Friendly Cookbook: Delicious Low-FODMAP, Gluten-Free, Allergy-Friendly Recipes for a Happy Tummy",154505
New Weight Watchers Freestyle Cookbook: Wholesome & Easy New WW Freestyle Recipes 500 | Delicious Meals With WW SmartPoints System,100054
The Daniel Plan Cookbook: Healthy Eating for Life,127221
"Keto Bread: Simple and Rapid Step by Step Low-Carb and Gluten-Free Cookbook for Ketogenic Diet (Includes Pizza, Cookies, Crusts, Muffins Bakers Recipes and more)",108763
New Weight Watchers Freestyle Cookbook: Healthy & Tasty WW Freestyle Rapid Weight Loss Program 2020,21947
Wheat Belly 10-Day Grain Detox: Reprogram Your Body for Rapid Weight Loss and Amazing Health,111934
"Dairy-Free Gluten-Free Baking Cookbook: 75+ Delicious Cookies, Cakes, Pies, Breads & More",115306
"Air Fryer Cookbook for Beginners: Easy, Healthy & Low-Carb Recipes That Will Help Keep You Sane",40347
Ketogenic Diet :The Step by Step Guide For Beginners: Ketogenic Diet For Beginners : Ketogenic Diet For Weight Loss : Keto Diet : The Step by Step Guide For Beginners,140277
"Keto Instant Pot Cookbook: The Complete Ketogenic Diet Instant Pot Cookbook – Healthy, Quick & Easy Keto Instant Pot Recipes for Everyone",156311
The Grain Brain Cookbook: More Than 150 Life-Changing Gluten-Free Recipes to Transform Your Health,53805
"The Gluten-Free Asian Kitchen: Recipes for Noodles, Dumplings, Sauces, and More [A Cookbook]",150244
The Easy Gluten-Free Cookbook: Fast and Fuss-Free Recipes for Busy People on a Gluten-Free Diet,32181
"YumUniverse: Infinite Possibilities for a Gluten-Free, Plant-Powerful, Whole-Food Lifestyle",23807
"Danielle Walker's Against All Grain: Meals Made Simple: Gluten-Free, Dairy-Free, and Paleo Recipes to Make Anytime",105414
Alkaline Smoothies: Alkaline Smoothie Recipes for Weight Loss and the Benefits of an Alkaline Diet - Alkaline Drinks Your Way to Vibrant Health - Massive Energy and Natural Weight Loss,138586
"Paleo Baking at Home: The Ultimate Resource for Delicious Grain-Free Cookies, Cakes, Bars, Breads and More",133140
"The Simply Real Health Cookbook: Easy Real Food Recipes for a Healthy Life, Made Simple",78116
"Bakerita: 100+ No-Fuss Gluten-Free, Dairy-Free, and Refined Sugar-Free Recipes for the Modern Baker",114042
"Instant Loss: Eat Real, Lose Weight: How I Lost 125 Pounds—Includes 100+ Recipes",860
"Danielle Walker's Eat What You Love: Everyday Comfort Food You Crave; Gluten-Free, Dairy-Free, and Paleo Recipes [A Cookbook]",58416
The Sourdough School: The ground-breaking guide to making gut-friendly bread,116030
Perfect Health Diet: Regain Health and Lose Weight by Eating the Way You Were Meant to Eat,152157
Gout Smoothie Recipes : Contains Cherry in Each Recipe for Gout Relief,153694
"Eating Clean: The 21-Day Plan to Detox, Fight Inflammation, and Reset Your Body",136184
"The Dance of Fear: Rising Above Anxiety, Fear, and Shame to Be Your Best and Bravest Self",115880
"Wheat Belly (Revised and Expanded Edition): Lose the Wheat, Lose the Weight, and Find Your Path Back to Health",127833
Mediterranean Diet for Beginners 2019-2020: The Complete Guide - 21-Day Diet Meal Plan - Lose Up to 20 Pounds in 3 Weeks,42142
The Homemade Flour Cookbook,30060
"Danielle Walker's Against All Grain Celebrations: A Year of Gluten-Free, Dairy-Free, and Paleo Recipes for Every Occasion [A Cookbook]",60669
"Eat Happy: Gluten Free, Grain Free, Low Carb Recipes For A Joyful Life",65466
"Keto Bread: Easy and Delicious Low Carb and Gluten-Free Bakery Recipes for Every Meal to Lose Weight, Burn Fat and Transform Your Body",137011
Everyday Grain-Free Baking: Over 100 Recipes for Deliciously Easy Grain-Free and Gluten-Free Baking,99221
