Renal Diet Cookbook: The Ultimate Guide For Healthy Kidneys: Delicious Low Sodium Recipes,388175
"Clean Eating: The Simple Guide to Living a Healthy Lifestyle, Eating Clean and Losing Weight",391484
Air Fryer Dash Diet Recipes: 30 Easy Air Fryer Dash Diet Recipes for healthy eating.,320412
"Essential Kidney Disease Cookbook: 130 Delicious, Kidney-Friendly Meals To Manage Your Kidney Disease (CKD) (The Kidney Diet & Kidney Disease Cookbook Series)",388992
"Kidney Disease Diet: Stop Kidney Disease  and Improve Kidney  Function  with a Healthy Diet, a Correct Lifestyle  and the  Latest Scientific Findings;  Includes the Renal Diet Cookbook",372053
EAT TO TRIM: GET IT OFF AND KEEP IT OFF!  Includes Over 200 recipes,180655
KETO DIET FOR BEGINNERS 2020: The complete Ketogenic guide to lose weight and transform your body with an easy and healthy low-carb lifestyle. Bonus: recipes and meal preps included,112011
Forever Fat Loss: Escape the Low Calorie and Low Carb Diet Traps and Achieve Effortless and Permanent Fat Loss by Working with Your Biology Instead of Against It,49434
"Instant Pot Air Fryer Lid Cookbook: 500 Easy, Affordable and Flavorful Recipes to Fry, Roast, Bakes and Dehydrate with Your Instant Pot Air fryer Lid",128109
Mediterranean Diet for Beginners 2019-2020: The Complete Guide - 21-Day Diet Meal Plan - Lose Up to 20 Pounds in 3 Weeks,39092
"Keto Diet After 50: Ultimate Keto Cookbook for People Over 50 with Easy Recipes & Meal Plan - Regain Your Metabolism and Lose Weight, Stay Healthy and ... in Your Senior Years (Keto Diet for Women)",45209
"365 Days of Ketogenic Diet Recipes: A Ketogenic Diet Cookbook with Over 365 Healthy Keto Recipes Book For Beginners Kitchen Cooking, Low Carb Meals and Cleanse Weight Loss Diet Plan",92172
Alkaline Diet Cookbook: 400 Recipes For Rapid Weight Loss & Balancing Your pH Levels,141165
"Eat What You Love: Restaurant Favorites: Classic and Crave-Worthy Recipes Low in Sugar, Fat, and Calories",96209
"Plant-Based Meal Prep Cookbook for Beginners 2020: The Complete Plant-Based Guide with Delicious Whole Food Recipes for Beginners to Prep, Grab and Go （A 21-Day Time-Saving Meal Plan Included）",128076
The McDougall Quick and Easy Cookbook: Over 300 Delicious Low-Fat Recipes You Can Prepare in Fifteen Minutes or Less,16745
Everyday Happy Herbivore: Over 175 Quick-and-Easy Fat-Free and Low-Fat Vegan Recipes,151492
"100+ Low Carb Keto Snack Ideas - KETO MADE EASY for BEGINNERS - Desserts for Any Occasion: Savory and Sweet / Prep and No-Prep. High fat, high protein, low sugar snacks perfect for Atkins or Keto",86093
"Air Fryer Cookbook for Beginners: Easy, Healthy & Low-Carb Recipes That Will Help Keep You Sane",38814
"Mediterranean Keto diet cookbook: Healthy Mediterranean Recipes in a Ketogenic version, to Eat Well Every Day, Lose Weight Fast and Live Long",148298
Sous Vide Cookbook: 100 Amazing Sous Vide Recipes for Your Friends and Family: Get the Restaurant Flavor at Home,157254
"Clean Slate: A Cookbook and Guide: Reset Your Health, Detox Your Body, and Feel Your Best",140553
Dairy Free Keto Cookbook: Beginner's Guide to Non-Dairy Ketogenic Diet with Low-Carb Recipes & 2-Week Dairy-Free Keto Meal Plan to Speed Up Your Weight Loss,121077
Keto after 50: Beginners guide for women over 50 to start your ketogenic diet and reset your metabolism. Included a 7-day meal plan and a special BONUS about intermittent fasting,59386
"FAT BOMBS: 120 SWEET AND SAVORY KETO TREATS FOR KETOGENIC, LOW CARB, GLUTEN-FREE AND PALEO DIETS (keto, ketogenic diet, keto fat bombs, desserts, healthy recipes, fat bombs cookbook, paleo, low carb)",114432
The Fast Metabolism Diet Cookbook: Eat Even More Food and Lose Even More Weight,62913
BOSH!: Healthy Vegan (BOSH Series Book 4),116372
"The Eat Fat, Get Thin Cookbook: More Than 175 Delicious Recipes for Sustained Weight Loss and Vibrant Health",123506
"The Shredded Chef: 125 Recipes for Building Muscle, Getting Lean, and Staying Healthy (Muscle for Life Book 3)",22625
Air Fryer Cookbook: 500 Quick and Delicious Recipes for Beginners and Advanced Users,133995
"Weight Watchers New Complete Cookbook, SmartPoints™ Edition: Over 500 Delicious Recipes for the Healthy Cook's Kitchen",78162
"365 Days of Mediterranean Diet Recipes: A Mediterranean Diet Cookbook with Over 365 Mediterranean Recipes Book for Beginners Diet, Healthy Lifestyle and Weight Loss",122023
The Skinnytaste Air Fryer Cookbook: The 75 Best Healthy Recipes for Your Air Fryer,18788
"Air Fry Every Day: 75 Recipes to Fry, Roast, and Bake Using Your Air Fryer: A Cookbook",139022
"The Gastroparesis Cookbook: 102 Delicious, Nutritious Recipes for Gastroparesis Relief",79310
Sirtfood Diet: Healthy and delicious recipes to quickly lose weight.Discover how to activate your metabolism and skinny gene without missing a tasty meal plan.Burn fat and enjoy Sirtfood benefits,57046
"Skinnytaste One and Done: 140 No-Fuss Dinners for Your Instant Pot®, Slow Cooker, Air Fryer, Sheet Pan, Skillet, Dutch Oven, and More: A Cookbook",77444
The McDougall Program: 12 Days to Dynamic Health,37479
"365 Days of Clean Eating Recipes: A Clean Eating Cookbook with Over 365 Recipes Book for Healthy Clean Eat Diet, Healthy Living Wellness Lifestyle and Weight Loss",76805
Keto Food List: Ketogenic Diet Quick Guide for Beginners: Keto Food List with Macros Nutritional Charts Meal Plans & Recipes with Calories Net Carbs Fat for Healthy Weight Loss (keto food list book),153068
"The Essential Air Fryer Cookbook: The Only Book You Need for Your Small, Medium, or Large Air Fryer",51042
"The Skinnytaste Cookbook: Light on Calories, Big on Flavor",24857
"THE LOW CALORIE DIET: The  Convincing Guide To Using Calorie Diet Which Will Help You To Burn Body Fat, Lose Weight And Live Healthy",133657
"Meal Prep Plan: The Ultimate Guide to Saving Time, Losing Weight and Improving Your Life by Meal Prepping (Not on a Diet)",91708
"Air Fry Everything: Foolproof Recipes for Fried Favorites and Easy Fresh Ideas by Blue Jean Chef, Meredith Laurence (The Blue Jean Chef)",142296
"30-Minute Heart Healthy Cookbook: Delicious Recipes for Easy, Low-Sodium Meals",72923
"The Wild Diet: Get Back to Your Roots, Burn Fat, and Drop Up to 20 Pounds in 40 Days",164378
"Keto Snacks: Perfect Ketogenic Fat Burner Recipes | Supports Healthy Weight Loss - Burn Fat Instead of Carbs | Formulated for Keto, Diabetic, Paleo and Low-Carb/High-Fat Diets",92167
"PALEO: Paleo Diet For Rapid Weight Loss: Lose Up To 30 lbs. In 30 Days (Paleo diet, Paleo diet for weight loss, Paleo diet for beginners, Diabetes diet, Ketogenic diet, Anti inflammatory diet)",111595
"The Starch Solution: Eat the Foods You Love, Regain Your Health, and Lose the Weight for Good!",8213
Sirtfood Diet: Practical and complete guide for fast weight loss and activates your metabolism and your Skinny gene with the help of Sirt foods. Contains simple and tasty recipes for your food plan.,162879
The Anti-Inflammatory Diet Cookbook: Easy To Follow Recipes To Boost Your Immune System. No-Stress Meal Plan To Reduce Inflammation And Increase Weight Loss Included. (English Edition),152062
Skinnytaste Fast and Slow: Knockout Quick-Fix and Slow Cooker Recipes: A Cookbook,119233
"Gastric Bypass: 3 in 1 Box Set - Gastric Bypass Cookbook, Gastric Bypass Diet Guide, Gastric Bypass Recipes",159782
Paleo Smoothies: Recipes to Energize and for Weight Loss,130293
"The Big Air Fryer Cookbook for Quarantine: 800 Easy and Amazing Frying Recipes to Enjoy your Time at Home. Includes Alphabetic Glossary, Nutritional Facts and Some Low Carb Recipes",241433
Gastroparesis Cookbook Collection: All The Best The Recipes From The Essential Gastroparesis Cookbook and The Gastroparesis Cookbook For Two,199968
Bravo!,218801
"Keto in Five: Trustworthy Approach to Health & Weight Loss, with 130 Low-Carb High-Fat Ketogenic Recipes (5 ingredient keto cookbook Book 1)",240252
The Ketogenic Diet Cookbook: New Recipes for Beginners. Keto Diet for Weight Loss & Healthy Recipes for Your Meal Prep,244811
"Air Fryer Oven Cookbook: Cook and get the best results with the air fryer. Easy Recipes to Fry, and Roast with your Air Fryer Oven. Fast and tasty cooking",267578
"George Foreman's Big Book of Grilling, Barbecue, and Rotisserie: More Than 75 Recipes for Family and Friends",261803
"Air Fryer Cookbook: 1000 Day Delicious, Quick & Easy Air Fryer Recipes for Everyone",208958
"21-Day Clean-Eating Meal Plan - 1200 Calories: Weight Loss Cookbook for Beginners,healthy recipes,Fight Inflammation, and Reset Your Body",275805
"Leptin Resistance: Leptin Diet to Control Your Hormones, Get Permanent Weight Loss, Cure Obesity and Live Healthy (Leptin Resistance, Leptin Diet, Ghrelin, Adiponectin)",278274
The Fat Chance Cookbook: More Than 100 Recipes Ready in Under 30 Minutes to Help You Lose the Sugar and the Weight,281147
Instant Pot Cookbook: 550 Easy and Healthy Instant Pot Recipes You’ll Wish You Discovered Sooner,195098
"American Heart Association Quick & Easy Cookbook, 2nd Edition: More Than 200 Healthy Recipes You Can Make in Minutes",200116
"Atkins: Eat Right, Not Less: Your Guidebook for Living a Low-Carb and Low-Sugar Lifestyle",256849
Crockpot Recipes: Easy and Healthy Meals for Smart People,211636
"Skinny Italian: Eat It and Enjoy It - Live La Bella Vita and Look Great, Too!",257469
"Keto Bread Cookbook: Delicious and Easy Homemade Recipes (Keto Bread, Pizza, Bagels, Muffins, Sweets and Snacks)",173018
Bariatric Cookbook for Gastric Bypass: Easy and Healthy Recipes to Enjoy Favorite Foods Before and After weight-Loss Surgery,174959
Plant Based Diet Air Fryer  Cookbook 800: Ultimate Guide of Plant-based Vegetarian Diet Air Frying Cook book for Beginners and Pros| A Healthy 30-Day Meal Plan| 100 Foolproof Savory Vegan Recipes,185005
"The Mindful Glow Cookbook: Radiant Recipes for Being the Healthiest, Happiest You",210222
2020 Starter HCG Diet Recipes Cookbook: Delicious Hassle Free HCG Diet Recipes That Will Get You Started on the HCG Diet,197846
Pound Dropper: A recipe book for a healthy alternative for everyday cooking.,244431
"The Gallbladder Diet: Salads, Soups & Fast Dishes (Global Edition): Easy, low-fat recipes for a healthy life after gallbladder removal surgery",194262
Skinny Meals: Everything You Need to Lose Weight-Fast!: A Cookbook (Skinny Rules),228661
"Whole Grains Every Day, Every Way: A Cookbook",242494
"Mediterranean Diet Meal Prep: Delicious and Healthy Recipes. Reduce Weight, Saving Time and Feeling at your Absolute Best with The Mediterranean Diet",252922
The Blood Sugar Solution 10-Day Detox Diet Cookbook: More than 150 Recipes to Help You Lose Weight and Stay Healthy for Life,185751
Cooking Light Low-Sugar Recipes,227318
Keto Chaffles: Tasty and Healthy Ketogenic Chaffles to Eat Every Day and Lose Weight Without Feeling You Are on a Diet,208361
Veggie Burgers: 50 Delicious Vegan Burger Recipes (Veganized Recipes Book 5),264876
"INSTANT OMNI TOASTER OVEN AIR FRYER COOKBOOK FOR BEGINNERS: The Complete Instant Omni Toaster Oven Air Fryer Guide. Real Easy, Crispy and Healthy Recipes. Recipes which Anyone Can Cook!",263360
Gluten-Free All-in-One For Dummies,198795
"Dependable STARCH SOLUTION Manual: Comprehensive Guide on Everything You Need to Know About Starch Solution to Lose Weight, Keep Healthy, Prevent Diseases & So Much More",226988
"366 Delicious Ways to Cook Rice, Beans, and Grains",246979
"Eat What You Love: Quick & Easy: Great Recipes Low in Sugar, Fat, and Calories",235965
"The Fat Resistance Diet: Unlock the Secret of the Hormone Leptin to: Eliminate Cravings, Supercharge Your Metabolism, Fight Inflammation, Lose Weight & Reprogram Your Body to Stay Thin-",245510
"Air Fryer Toast Oven Cookbook 2020: Beginners’ Guide of Air Fryer Toast Oven Recipe Cookbook| Air Fry, Bake, Toast, Broil and Grill Tasty Effortless Wholesome Recipes| A Healthy 30-Day Meal Plan",232133
"Delicious Nutribullet Soup Recipes: 4 Weeks of Healthy Soups for Weight Loss, Detox & Natural Healing",287561
"The Skinny Vegan Cookbook: Easy Weight Loss With A Plant Based Diet | Recipes Include Oil-Free Mayo, Pizza, Burgers, Chocolate Fudge Brownies etc",205408
"Down South Paleo: Delectable Southern Recipes Adapted for Gluten-free, Paleo Eaters",272759
Skinnytaste Meal Prep: Healthy Make-Ahead Meals and Freezer Recipes to Simplify Your Life: A Cookbook,254811
"The New American Heart Association Cookbook, 9th Edition: Revised and Updated with More Than 100 All-New Recipes",171989
"Better Than Vegan: 101 Favorite Low-Fat, Plant-Based Recipes That Helped Me Lose Over 200 Pounds",205869
"ULTIMATE PANCREATITIS DIET COOKBOOK : Includes Diet Tips, Food to Eat and Avoid, Meal Plan and Lots of Healthy and Delicious Recipes to Prevent and Reverse Pancreatitis",206867
Vegetarian Weight Loss: How to Achieve Healthy Living & Low Fat Lifestyle (Weight Maintenance & Heart Healthy Diet) (Special Diet Cookbooks & Vegetarian Recipes Collection Book 1),220536
"The Everything Low-Cholesterol Cookbook: Keep you heart healthy with 300 delicious low-fat, low-carb recipes (Everything®)",184941
"The Gallbladder Diet: Main Dishes (US Edition): Easy, low-fat recipes for a healthy life after gallbladder removal surgery",189083
"The Endurance Training Diet & Cookbook: The How, When, and What for Fueling Runners and Triathletes to Improve Performance",245213
"Eat More, Weigh Less: Dr. Dean Ornish's Life Choice Program for Losing Weight Safely While Eating Abundantly",264767
"Bon Appetit: The Food Lover's Cleanse: 140 Delicious, Nourishing Recipes That Will Tempt You Back into Healthful Eating",264325
The plant based diet for beginners: an easy and effective approach to help you lose weight and live healthy with delicious high protein plant based recipes,266086
"The DIRTY, LAZY, KETO Cookbook: Bend the Rules to Lose the Weight!",35733
"The Super Lazy Keto Diet for Beginners 2020: Catapult Your Weight Loss Journey into Reality with these Quick & Easy, 5-Ingredient Recipes to Prepare in Only 5 Minutes!",58710
"Natural Liver Cleanse Recipes: Liver cleanse juices, liver cleanse tea, Liver cleanse soup, fatty liver cleanse, liver cleanse smoothie and liver cleanse vegan recipes",195537
"The Heart Healthy Cookbook for Beginners 2020: 600 Low Sodium, Low Fat Recipes to Drop Pounds, Improve Health and Lower Blood Pressure (21 Day Meal Plan Included)",226816
"Celery Juice, The Miracle Juice: Harness the Immense Healing Powers of Celery Juice with These Easy To Prepare Celery Juice Recipes",161305
"Sirtfood Diet : An Essential Beginner's Guide for your Weight Reduction, Body Fat Loss and Skinny Gene Activation with Tasty Recipes",36495
"Vegetarian Instant Pot Cookbook for Beginners #2020: 700 Mouthwatering, Quick and Easy Plant Based Recipes for Your Pressure Cooker",190484
Intermittent Fasting 16/8: Delightful Recipes & Meal Plan for 3 Weeks  Lose Weight with the Revolutionary Intermittent Fasting 16/8 Method,179222
THE MEDITERRANEAN DIET: The Complete Guide To The Mediterranean Diet For Weight Loss,185095
Traeger Grill & Smoker Cookbook: The Complete Wood Pellet Smoker and Grill Cookbook,40187
Instant Pot College Cookbook: Tasty & Affordable Instant Pot Recipes for Beginners College Students. Fast and Healthy Meals Made Right on Campus,262768
The Low Cholesterol Cookbook and Action Plan: 4 Weeks to Cut Cholesterol and Improve Heart Health,145329
"Make Food Simple: Take the Stress and Confusion Out of Nutrition And Make Quick, Healthy Meals For the Entire Family",149114
"Mindful Eating: A Healthy, Balanced and Compassionate Way To Stop Overeating, How To Lose Weight and Get a Real Taste of Life by Eating Mindfully",267914
"The Art of Intermittent Fasting: How to Lose Weight, Shed Fat, and Live a Healthier Life",200496
The Plant-Based Diet Meal Plan: A 3-Week Kick-Start Guide to Eat & Live Your Best,16725
"The Renal Diet Cookbook for Beginners 2019: Only Low Sodium, Low Potassium and Easy-to-follow Recipes to Control Your Kidney Disease(CKD) and Avoid Dialysis",179300
"Dependable STARCH SOLUTION Manual: Comprehensive Guide on Everything You Need to Know About Starch Solution to Lose Weight, Keep Healthy, Prevent Diseases & So Much More",226988
"Air Fryer Cookbook: 1000 Day Delicious, Quick & Easy Air Fryer Recipes for Everyone",208958
The Longevity Diet: ‘How to live to 100 . . . Longevity has become the new wellness watchword . . . nutrition is the key’ VOGUE,197311
"SIMPLE 30-MINUTE HEART HEALTHY COOKBOOK FOR BEGINNERS: Fast and Delicious Low Sodium, Low Fat Recipes for Good Health and a Thriving Heart (With Tips for Creating Meal Plans)",212381
"The Heart Healthy Diet  and  Action Plan: 4 Weeks to Lower Cholesterol  and  Improved Heart Health (menu for a month: breakfast, lunch, dinner, snaсk) (Healthy Food Book 1)",144940
Juicing! Natural Cholesterol Solution: Juice and Smoothie Recipes for Cholesterol Lowering Diet (Diet Recipe Books - Healthy Cooking for Healthy Living Book 4),200804
The Ketogenic Diet Cookbook: New Recipes for Beginners. Keto Diet for Weight Loss & Healthy Recipes for Your Meal Prep,244811
The Great Cholesterol Myth + 100 Recipes for Preventing and Reversing Heart Disease,99204
Keto Diet for Beginners 2020-2021: 600 Foulproof Recipes for the Newbie Ketoer. The Only Cookbook You'll Need for 100% Keto Success,61876
"The Skinny Vegan Cookbook: Easy Weight Loss With A Plant Based Diet | Recipes Include Oil-Free Mayo, Pizza, Burgers, Chocolate Fudge Brownies etc",205408
"BAKING RECIPE COOKBOOK FOR BEGINNERS: 575 Quick, Easy and Delicious Recipes and Some Proven Techniques for the New Bakers with 30- Day Hand-Picked Meal Plan",105712
The 28 Day DASH Diet Weight Loss Program: Recipes and Workouts to Lower Blood Pressure and Improve Your Health,47490
"VEGAN: VEGETARIAN: 35 High Protein Vegan Recipes for Weight Loss and Building Muscle (Clean Eating, Slow Cooker, Raw Food) (Spanish Edition)",47556
Dash Diet 2020: The Ultimate Guide to Lose Weight and Reduce Blood Pressure – 28 Days Meal Plane with 100 Healthy Recipes Full of Flavor. Super Easy 30 – Minute Cookbook for Busy People,114512
"VEGAN: VEGETARIAN:  32 Dump Dinner Recipes on a Budget (One pot, Slow Cooker, Raw Food)",168964
Plant-Based Diet: The Essential Cookbook for Beginners. Healthy Recipes & Meal Plan for Weight Loss,290781
"The Everything Low-Cholesterol Cookbook: Keep you heart healthy with 300 delicious low-fat, low-carb recipes (Everything®)",168917
Ketogenic Diet :The Step by Step Guide For Beginners: Ketogenic Diet For Beginners : Ketogenic Diet For Weight Loss : Keto Diet : The Step by Step Guide For Beginners,140277
The DASH Diet Action Plan: Proven to Lower Blood Pressure and Cholesterol Without Medication (A DASH Diet Book),123403
Fatty Liver Cookbook & Diet Guide: 85 Most Powerful Recipes to Avert Fatty Liver Disease & Lose Weight Fast,267020
KETO DIET FOR BEGINNERS 2020: The complete Ketogenic guide to lose weight and transform your body with an easy and healthy low-carb lifestyle. Bonus: recipes and meal preps included,73093
"365 Days of Vegan Recipes: A Vegan Cookbook with Over 365 Recipes Book for Beginners Easy, Fun and Filling Plant-Based Recipes for Weight Loss and Healthy Lifestyle",164322
The 30-minute Low-Cholesterol Cookbook: 125 Satisfying Recipes for a Healthy Lifestyle,52986
Dash Diet: Dash Diet for Beginners: Dash Diet Cookbook with 21 Days Dash Diet Meal Plan to Lose Weight and Lower Your Blood Pressure (Dash Diet Cookbooks 1),261749
Unprocessed,73562
The Healthy Low-Carb Slow Cooker Cookbook: 100 Easy Recipes to Kickstart Weight Loss,121292
"The Complete Instant Pot Duo Crisp Air Fryer Cookbook: 550 Incredible, Delicious, Healthy and Fast Mouthwatering Recipes for Smart People to Roast, Bake, Broil and Dehydrate",213797
The Sirtfood Diet: Beginner’s cookbook with easy and healthy recipes to activate your skinny gene and burn fat. This book will help you to lose weight fast and improve your life,96965
"Weight Loss Smoothies: 33 Healthy and Delicious Smoothie Recipes to Boost Your Metabolism, Burn Fat and Lose Weight Fast (Smoothie Recipe Book for Fast Weight Loss)",234641
The Complete DASH Diet for Beginners: The Essential Guide to Lose Weight and Live Healthy,98485
"The Complete Autoimmune Protocol Meal Prep Cookbook: Easy, Delicious and Nourishing Allergen-Free Recipes to Get Healthier Together (With 3 Week Meal Included)",205820
Cholesterol Down: Ten Simple Steps to Lower Your Cholesterol in Four Weeks--Without Prescription Drugs,139262
"Air Fryer Cookbook: The Complete Air Fryer Cookbook – Delicious, Quick & Easy Air Fryer Recipes For Everyone",365909
"College Cookbook: Healthy, Budget-Friendly Recipes for Every Student | Gain Energy While Enjoying Delicious Meals",440425
Anti-Inflammatory Diet for Beginners: 600+ Incredible and Irresistible Recipes for The Smart People in A Budget,362832
Summer Salads Recipe Book: Salad diet weight loss,311998
"Instant Pot Duo Crisp Air Fryer Cookbook: Delicious and Healthy Recipes for Smart People. The New “Quick-To-Make” Method for Roast, Bake & Dehydrate Your Food for a Quick Meal Prep Solution",441965
Low-Cholesterol Cookbook For Dummies,395887
Sirtfood Diet: Vibrant Recipes For Rapid Weight Loss,421731
Vegan Athlete Cookbook: High-Protein Delicious Recipes in Your Workouts. Golden Rules for Vegan Athletes & 70 Recipes Meal Prep,304537
The plant based diet for beginners: an easy and effective approach to help you lose weight and live healthy with delicious high protein plant based recipes,287087
"Sirtfood diet: A complete program to lose weight healthy, boost your metabolism and activate your skinny gene to burn fat",406903
Instant Vortex Air Fryer Oven Cookbook for beginners: Most Affordable and Delicious Air Fryer Oven Recipes for smart people (21- day meal plan),319157
"The Everything Low Cholesterol Book: Reduce Your Risks and Ensure a Longer, Healthier Life (Everything®)",417477
"The Gallstone Diet: Foods for Your Gallbladder – Prevent, Manage, and Flush your Gallstones",392564
"Prevent a Second Heart Attack: 8 Foods, 8 Weeks to Reverse Heart Disease",409748
"DASH Diet 2020: The Ultimate Cookbook To induce Weight Loss, Improve Your Health And Stop Hypertension. 21 Days Meal Plan Included. (English Edition)",389228
"Dash Diet Cookbook 2020: Quick and Healthy Dash Diet Recipes To Improve Your Health, Lose Weight, And Lower Blood Pressure. 21 Days Healthy Meal Plan Included to Prevent Disease.",424586
"American Heart Association Healthy Fats, Low-Cholesterol Cookbook: Delicious Recipes to Help Reduce Bad Fats and Lower Your Cholesterol",334631
Plant-Based Diet: The Essential Cookbook for Beginners. Healthy Recipes & Meal Plan for Weight Loss,290781
"Plant-Based Diet: Easy and Whole Foods Recipes for Healthy Eating, Lower Blood Pressure, and Control Sugar Levels. Use the 3 Weeks Plant-Based Diet Meal Plan to Lose Weight and Energize Your Body",355278
"THE NEW LOW CARB DIET FOR VEGETARIAN: Various easy to make delicious low carb diet recipes and sample meal plan for improved health, lose weight, lower cholesterol, and energy boosting.",409129
Superfoods Spinach Recipes: Over 60 Quick & Easy Gluten Free Low Cholesterol Whole Foods Recipes full of Antioxidants & Phytochemicals (Natural Weight Loss Transformation Book 233),318857
"INTERMITTENT FASTING 16/8: A Complete Step by Step Guide to Lose Weight Easily, Improve Insulin Resistance, Overall Health and Live Longer. A Fasting Program Perfect for Men and Women and Over 50",341036
"Atkins Diet Cookbook: 600 Healthy, Quick, Easy and Delicious Recipes for Healthy Cook’s Kitchen",295710
"Easy Indian Recipes Cookbook: Quick, Healthy, Delicious Indian Dishes",380009
"105 recipes of diet and low-calorie dishes: Recipes for breakfast, lunch and desserts. Ingredients: chicken, pork, beef, fish, vegetables and fruits. Easy to prepare. (A series of cookbooks Book 18)",439355
"Clean Eating: Change Your Mindset, Lose Weight Fast and Keep It Off Forever",439202
"Food Dehydrator Recipes Book: The Complete Guide to Dehydrating Foods Including Vegetable, Fruits, Meat, Snacks & more",344857
"The Whole Life Nutrition Cookbook: Over 300 Delicious Whole Foods Recipes, Including Gluten-Free, Dairy-Free, Soy-Free, and Egg-Free Dishes",379718
The Low-Cholesterol Cookbook for Two: 100 Perfectly Portioned Recipes for Better Heart Health,295371
"Libro de cocina de freidoras de aire para principiantes: Recetas deliciosas, rápidas y fáciles para ahorrar tiempo, comer sano y disfrutar cocinando (Spanish Edition)",363184
"Weeknight Wonders: Delicious, Healthy Dinners in 30 Minutes or Less",361289
Everyday Super Food,365899
Grilling and Campfire Cooking (Everyday Cookbook Collection),300088
"Healthy Eating Cookbook and Meal Plan: 2 Books in 1 Food for the Prevention of Alzheimer's, Nutrition to Become more Productive, Longevity Plan to Boost your Health",383118
Eat Plants Love: Recipes for a Good Life,452809
Healthy Overnight Oats: 50 Delicious Recipes Made From Nutritious Ingredients,304860
Deliciously Ella The Plant-Based Cookbook: The fastest selling vegan cookbook of all time,356027
"Fatty Liver Diet: 50+ Smoothies, Dessert and Breakfast Recipes designed for Fatty Liver Diet",408679
Ketogenic Diet Guide for Beginners: 21-Day Ketogenic Meal Plan To Reset Your Body,389904
Vegan: Ice Cream Vegan Recipes for Vegetarians and Raw Vegans that are Delicious and Soul Satisfying,328399
"Vegetarian Cookbook for Beginners: 100+ Hand-picked, Healthy, Delicious Vegetarian Recipes for the healthy Cook’s Kitchen",354626
FATTY LIVER COOKBOOK AND DIET GUIDE: Simple Liver Detox Recipes Cookbook and Diet Guide to Cure Various Fatty Liver Diseases for Life,387570
